author_id;topic;text;topic_id;discussion_stance_id;topic_stance_id;discussion_stance
76;abortion;"I choose life Reagan once said something like this Notice that everyone who is pro choice has been born";3;1;2;Pro-Life
76;abortion;"Actually the government does tell women what they can and can't do with their bodies It's illegal to commit suicide If a person is caught trying to hack themselves to peices they could be placed in a mental institute So the government actually does limit what a woman can do with her body";3;1;2;Pro-Life
76;abortion;"That situation is very rare and can usually be countered with a contraceptive drug if the woman seeks medical attention after the assault";3;1;2;Pro-Life
1761;abortion;"Nobody has the right to tell you what to do with your body, but if that which you are trying to rid off moves away at the first sign of pain, without you feeling it, then "that" is no longer yours, since it feels outside your own.";3;1;2;Pro-Life
1823;abortion;"There are tons of ways to not get pregnant. There are condoms (99% effective) for men and women, there are morning-after pills (75% effective), the patch, pill, and other forms of ways not to get pregnant. It's the woman's fault that she didn't do it. And maybe instead of Pro-choice vs. Pro-life, they (i don't know who "they" is) should have pro-life, but with exceptions (i.e. women that get raped) so that it's fair all-around.";3;1;2;Pro-Life
319;abortion;"i recently read a story..i wish i could find it, but i cant, so ill give you a summary you are a doctor. Two mothers come in, seperately. Both ask for your choice on an abortion. You feel the weight of a life on your shoulders. it goes on like this, giving the backgrounds of the mothers. Then it poses the statement: should you decide to abort either one, you may have robbed the world the beautiful mind of leonardo da vinci or the cruelty of adolf hitler. i think that every child has a right to live in this world, except in a few extreme circumstances...if it was an unwanted pregnancy, and only if the pregnancy is in the early stages. that is my view";3;1;2;Pro-Life
1855;abortion;"While this debate is made more palatable when said to be based on a disagreement between choice (democracy) or the lack there of (fascism) - I beg those on either side of the line to at least be honest with each other. If one holds firm to a belief stating that life begins at conception, any act which eliminates said life is by definition murderous and therefore wrong. Regardless of the reason of the life's inception, it is a life and no human being has a right to extinguish an innocent. If one does not believe that life begins at conception than they are able to 'choose' whether it is to be allowed (legal) or prohibited (illegal). So the debate should center on when life begins, allow those who believe it to begin post conception to bicker on the morality of abortion. Those of us who believe it to begin at conception are unable to debate, as it is an absolute in our mind and by definition is unable to be changed.";3;1;2;Pro-Life
1855;abortion;"Not to be glib, but are you stating that we should look to the government to assist us with our belief system. Ever read T. Hobbes...?";3;1;2;Pro-Life
78;abortion;"Don't kid yourself: the vast majority of abortions in this country are for reasons of convenience. If I was allowed to kill someone anytime they were inconvenient to me, I would be leaving a trail of bodies behind me when I walked down the street.";3;1;2;Pro-Life
167;abortion;"i don't disagree that people have the right to do what they want with their bodies, hence the reasons i am all for tattoos and piercings and whatever other kinds of body modification. but the choice we are talking about here is not about a woman's body. this is about another life, not a woman's body. we don't have the choice to murder people without consequence. this is no different. people need to accept the consequences of their actions. you have sex and don't use protection, you pay the price. if you truly feel that you are not able to raise and care for a child, there is always the option of adoption. i was adopted. i thank my lucky stars everyday that my mom made the smart choice. just put yourself in that position. just considerer for five minutes that the possibility that you might not be alive. its a scary thought, isn't it? abortion is murder, plain and simple.";3;1;2;Pro-Life
1815;abortion;"It's often funny how we tend to spin facts to make ourselves feel better about the situations we create. In the case of abortion, we tell ourselves that since the baby has not yet fully developed into the recognizable human form, that it's technically not a human being. Therefore, it's not murder to end its existence. Following this line of thought, an apple seed is not technically an edible apple, so destroying a farmer's stock of seed is not immoral, since we are not ridding him of the final product he sells. Yet, it's pretty clear you're robbing him of his livelihood, regardless of how you phrase it. Just because a fetus is not fully formed does not mean it is not a human.";3;1;2;Pro-Life
1880;abortion;"You are mixing topics thereby creating fallacy in your argument. The debate is not to determine under what circumstances may murder be morally acceptable, rather, the legal (some may say moral) foundation on which one can state that an individual has the right to terminate pregnancy. In addition, you may want to brush up on your etymology and vary your sources rather than simply paraphrasing definitions that fit your point of view.";3;1;2;Pro-Life
76;abortion;"I argue for the rights of the child, who deserves the same right to life as the mother";3;1;2;Pro-Life
405;abortion;"Is personhood absolute or is it predicated upon position? If a premature baby is lying in an incubator or, let's say for the sake of argument, a 5 gallon pail, it is illegal to kill it. Why does the situation change so drastically just because the child is inside the womb?";3;1;2;Pro-Life
439;abortion;""If a women is raped" is a good argument. However why would you punish an innocent baby with the death penalty for some other man's crime. If the women does not want the child she could give it up for adoption. I just dont understand why you would kill the baby, the emotional trauma would happen without the baby as well.";3;1;2;Pro-Life
828;abortion;"Alright, let's break this down if we can. 1. Outside of rape or the 1% where a condom/birth control fails, women do have the right to choose not to have unprotected sex. 1a. For those who argue that people make mistakes and they shouldn't be forced to have a child and to raise them I want to mention 2 points, 1. there is adoption, and 2. Other simple mistakes such as driving home drunk and hitting somebody, pulling a trigger and not realizing the gun was loaded...and of course there are more. In these cases the person is still held accountable and has to pay for their actions, why shouldn't a woman who gets pregnant due to lack of protection? 2. Psychological Trauma - others here have mentioned that it is wrong to force a young girl to go through the trauma and pain of having a child for 9 months. Well I think both sides can provide cases where a woman has psychological trauma either due to having the child or aborting the child, so this point is null for both sides. 3. Finally, for those that think that since it is the woman's body and nobody can tell her what to do, then I ask this question, what is the difference between a baby seconds after delivery and second before delivery? Nobody would ever allow somebody to kill a baby seconds after delivery because it wasn't convenient, couldn't be afforded, etc. So why when there is no physical difference for the child is it allowed to be aborted? Ultimately, I feel that abortion is wrong and the only exception to that is women who are raped. I still feel it is wrong at that point, but I have personally seen what a rape can do to a woman and I would never try to tell them they have to be reminded on a daily basis of that horrible moment in their life. Outside of that, sex is a mature activity that should only be practiced if people understand the potential consequences (STDs, pregnancy, etc.)";3;1;2;Pro-Life
657;abortion;"Therefore, legalize illegal drugs?";3;1;2;Pro-Life
454;abortion;"Abortion...the worst form of child abuse";3;1;2;Pro-Life
1553;abortion;"I always considered myself pro choice. I figured if The subject ever came up my self and my woman BOTH would choose and (do the right thing and choose to have the child.) my right to choose pertained to us. So wat was right for us may not be the same as someone else. I refuse to butt in on someone elses life decisions. Besides if it it the sin many say it is then these people will have to answer for that on judjment day.. well back to the subject....Either way BOTH of us should have been in the choice process! Then the time came and she didn't even tell me she was pregnant. She got an abortion and told me nothing! Understandablely I was devistated. I love my kids and to kill one of them would be unfathomable. I felt so betrayed. And Shes all standoffish "Its my body"................. Ban them!";3;1;2;Pro-Life
375;abortion;""The government has no place to tell a woman what she can do with her own body, ever." The government DOES have that right. 1) a woman cannot legally prostitute herself in many states 2) a woman cannot take illicit drugs into her own body 3) a woman cannot use her body to murder others 4) a woman cannot use her body to steal 5) a woman cannot display her naked body in public there are many others. Men can also not do these things. The government tells us what to do with our bodies ALL THE TIME. This is no different.";3;1;2;Pro-Life
1268;abortion;"we did not create the baby, we are not the ones who gave it life, why should we be the ones who put it to death, we have no authority to do such a thing.";3;1;2;Pro-Life
1268;abortion;"the one whom bestows life, is the one whom bestows death";3;1;2;Pro-Life
403;abortion;"They tell you to wear a seat belt. They tell you not to propell yourself down the street to fast. They tell you not to put yourself in the middle of oncoming traffic. As a society, we have norms (that - in theory, the mojority agrees upon). We then codify these norms into law to be administered by governement. We are "the goverment" - or "the governement" is the sum of all our past reditions of "us." We've collectively decided that the government does have a right to enforce societal norms. Such is democracy and goverment. "Of the people, by the people, for the people." The question isn't about whata the "government" does/doesn't have the right to do. The question is about what we as a society want to have the government to (to maintain our established norms - or create new norms).";3;1;2;Pro-Life
518;abortion;"In Nebraska, it's legal to have an abortion by killing the baby while it's coming out of the womb. How can you argue against that?";3;1;2;Pro-Life
627;abortion;"i do not see any difference in killing an embroyo or a 40 year old person. Murder....is murder";3;1;2;Pro-Life
1812;abortion;"As a former fetus, I am pro-life.";3;1;2;Pro-Life
1130;abortion;"I can not understand the horror of being impregnated by an immediate family member, or being the victim in any other way and having a pregnancy result. It is still the ending of a life. The traumatic experience calls for a lot of therapy that will go on for years and years. Tons of healing is needed, how is killing the baby any kind of help? It is still murder. That child is not at fault in any way, allow it the opportunity to be cared for by someone else. Also, for you women that use abortion as a form of birth control because you didn't feel like thinking a second ahead. That is not understandable and it is just disgusting. There are lots of awful experiences that happen to people every day, deal with them. Killing another person isn't a solution.";3;1;2;Pro-Life
1812;abortion;"How do you know she would die? According to snopes (whatever credibility you lend to them, that's up to you), the youngest mother on record was five-years-old. http://www.snopes.com/pregnant/medina.asp";3;1;2;Pro-Life
1817;abortion;"How very true. Even today, many of those children that were allowed to live cause their mothers grief everyday just by their existence. I say we find and kill them all.";3;1;2;Pro-Life
1817;abortion;""And that is between them and their consciences, not between you and them." Just as a conflict among two angry men resulting in death is just between them. Society, law and YOU should simply ignore this. "but that doesn't mean that they should be barred from correcting their mistakes" Yes, I think Don Corleone might agree with you: Murder can sometimes be a solution for the mistakes YOU'VE made. Nevermind that the victim is innocent in the matter. "forcing them to become parents instead is flat-out backwards." forcing the profound experience of life to halt because of your irresponsibilities and fear is flat-out wrong.";3;1;2;Pro-Life
1817;abortion;""This lead to many women dying from the injection that was meant only to kill the baby." Poor women, karma has caught up with them. I hate to sound callous, but I think it's fair to think of this as an early death penalty for premeditated murder. "they would pierce themselves with a wire coat hanger or other things to that effect to kill the baby." Hmm, surprisingly, visuals of women stabbing babies with wire hangers is not making me feel more sympathetic towards their plight. "with abortion legal, many lives have been saved." are you trying to be funny? "Therefore, the weight of death would (in theory) equal the weight of life." 1) I can guarantee you that more lives have been lost by legalized abortion than by the small percentage of women desperate enough to commit such acts (by their own hands even). 2) Even if this were not true and the numbers were equal, this would still be a misguided way of thinking. You see, it is not simply about numbers, the simple facts of the babies' innocence tips the scales in their favor. We are not dealing with math, we are dealing with moral principle.";3;1;2;Pro-Life
1817;abortion;"This true in the respect that I shouldn't be MADE to wear a seatbelt by the government, that's my business and does not affect the safety of others. But when what I do DOES affect the safety of others (including children and adults, blacks and whites, the fit and the disabled, and yes, even the unborn) then the government BETTER be involved. For it's primary purpose is to protect the rights, freedoms (assuming that these do not encroach on those of other people) and SAFETY of the people.";3;1;2;Pro-Life
1817;abortion;""Is a fetus not the product of a man and woman? If that farmer decides to rid HIS OWN APPLE SEED, then what business is it of ours what he does with his own...apples? Maybe he has decided that he doesn't have the right farming skills to nurture these apple seeds into full grown apples? I'd rather him realize that before he messed up some perfectly good apples. It is a mature decision to leave raising apples to people who are better apple farmers." The flaw in this metaphor is that an apple seed is not intelligent, not unique, not capable of thought or emotion. Whether the seed becomes an apple affects only whether Joe Schmoe in Wisconsin will drink juice in the morning, not whether the world and history will be changed through its actions or whether its personal experience will validate its existence. Besides, even if we take this illustration at face-value then the farmer, if not guilty of crime or sin, is at the very least stupid and inconsiderate. Burning the seeds is a waste, let them bless people who DO want apples but have no apple seed. "There are already so many unwanted children filling up orphanages (where they are often mistreated). " Then let us focus on improving those orphanages and the quality of people that inhabit this world. We can start with ourselves. "Also, do we really want people who don't want children to be responsible for taking care of them?" Its called growing up (relevant whether your 15 or 49, age is but a number) and learning to claim responsibility for your actions and your life. And think about it, very few people of any sort of caliber will regret the experience and love of raising a child once it's all said and done.";3;1;2;Pro-Life
1817;abortion;"I say that every human being does have inherent rights. "God-given" rights if you will. Our country was founded upon this idea. Citizen of some countries may have many rights REPRESSED, but that does not mean that they no longer hold these rights. They do not have the ability to excercise them, but, to put it simply, they ought to have.";3;1;2;Pro-Life
1851;abortion;"That only makes sense if you believe that laws against murder are also the Government deciding for society based on one view of religion. Try again.";3;1;2;Pro-Life
1851;abortion;"Using your principled analysis, the government also shouldn't tell me I can't kill my toddler.";3;1;2;Pro-Life
1837;abortion;"Let's start with what we agree on. Killing another person is wrong and must be outlawed. Since we agree on that, we must decide when a fetus should be considered a person. Imagine you are looking at family photo albums with your girlfriend. You show her a picture of you when you were five. "That was me," you say grinning. Then a picture of your first birthday. "That was me." Then a picture of you as a newborn. "That was me." Then a picture of an ultrasound of you at 24 weeks. "That was me," you once again say with confidence and without hesitation. It doesn't cross your mind to say, "That's what I was before I became me." Isn't it also logical that "that was me" at 9 weeks? How about at 2 weeks? Didn't "I" come into existence when unique DNA was formed when sperm and egg joined? A unique, human individual must not be killed.";3;1;2;Pro-Life
1837;abortion;"So your argument is that a child which grows up in an orphanage is a child that should never have been born. Such a child is and will grow up to be a detriment to society. Such human beings are better off dead. Sorry, you didn't convince me. But I will agree that adoption laws need to be changed and more parents should be encouraged to adopt.";3;1;2;Pro-Life
1851;abortion;"A women and she alone is the one who should determine if she wants to kill her toddler. I hope that "older white men" won't disagree.";3;1;2;Pro-Life
1837;abortion;"But should such extremely rare cases (as a percentage of the overall number of abortions) be a primary argument for establishing the rule? And is there a compelling reason that killing the innocent bystander (the baby) is preferable to giving him or her up for adoption?";3;1;2;Pro-Life
1817;abortion;"That may be so but it doesn't pertain to this debate in particular as obviously these conceptions are not being prevented. The issuse lies in what should be done after they occur.";3;1;2;Pro-Life
1817;abortion;"Living in an orphanage is not the end of the world, abortion (at least in a personal sense) is.";3;1;2;Pro-Life
1817;abortion;""Except that EVERYONE agrees that once a human is born that killing that person is murder" Do serial killers? Do tyrants? Maybe this is simply YOUR point of view, your "religion". Your religion may nor consist of gods or the supernatural, but whether you are atheist, agnostic, Islamic, Hindu, Jew, Christian, or Universalist you have a belief system (like it or not), and your belief system rejects some ideas and accepts others. Ultimately, this is the core of religion. Besides, even if you do want to speak of religion in the form of worship to gods, 98% of the world believes in some form of supernatural being. So you could say "EVERYONE" comes from a religious point of view. "not everyone agrees that life begins at conception (only people with a certain religious view" or a liscenced biologist...or just about anyone with a higher-level education. I'm sorry to burst your bubble, but life DOES exist through the entire pregnancy process. I can't remember the last time I saw a rock with reproducing cells.";3;1;2;Pro-Life
478;abortion;"There are no "God-given laws" in the Constitution.";3;1;2;Pro-Life
141;abortion;"I'm pro-life based on one major fact.... abortion being used the way it is today.. like a last minute form of birth control. If your too stupid to wear protection, get on the pill, just give the baby up, there are thousands of people who can't have children who'd love to have it.";3;1;2;Pro-Life
1837;abortion;"If we follow your argument to its logical conclusion, then we must legalize parents killing their children. If they are permitted to kill their unborn child simply because the child is a product of the man and the woman, certainly they can kill their children who have been born. I do agree with your statement, "It is a mature decision to leave raising apples to people who are better apple farmers." This is a reasonable and humane resolution to the problem of parents who are unfit or who do not want a child. Give the child up for adoption. Don't kill the child. You said, "There are already so many unwanted children filling up orphanages (where they are often mistreated). Why should we bring even more unwanted children into the world?" Let me suggest a more humane alternative. Some children are adopted into loving families. Some are not. Why don't we kill all orphans six years old and older since those are not likely to get adopted. Wouldn't this be preferable to killing all of them? I hope you find this suggestion morally outrageous and offensive. That's how I found yours. You artificially draw a line when you justify killing the smallest unwanted children, but mysteriously forbid killing older unwanted children. Why the distinction?";3;1;2;Pro-Life
1817;abortion;"Wow, your response is mature, logical, and effective. A more respectable way to bow out would have been to admit that you simply had no rational argument against mine, or at least not say anything at all. In the end, your attempt at a humorous statement accomplishes nothing. My attempt at a bit of ad hominem: Abortion is wrong, Exhibit A- advocates such as right2write.";3;1;2;Pro-Life
997;abortion;"There should be no argument in this really...whatever way yu see a fetus...its still a living form that has been created in a very intimate way... you shouldn't be changing what mothernature or God or fate or whatever has decided for you...and if you didn,t wannna get preggo in the first place...don't have sex or use protection. Yeh there are some women that get raped and it's very unfortunate but they should give the child up for adoption. It's not the child's fault that it was created. So why should the goring being have to pay the ultimate price of it's life?";3;1;2;Pro-Life
454;abortion;"There are way too many parents out there wanting to adopt, KILLING a child is not a good way to resolve this situation.";3;1;2;Pro-Life
1686;abortion;"Regarding only #5 above. You have a pet. Say, it's a dog. you love him so much!! Now, would you rather give him away to a loving home where he'll have a family who has wanted a dog for so long! or, would you rather pop a hole in his skull and suck his brains out? golly, which one is more traumatic...";3;1;2;Pro-Life
1817;abortion;"I'm certain I've already addressed that. Whether the rebuttal was a response to you in particular, I can't remember.";3;1;2;Pro-Life
1817;abortion;""NOT bringing an unwanted child in the world isn't comparable to killing all orphans six years old and older because NOT DOING SOMETHING (not having a baby) is a passive non-action while DOING SOMETHING (killing children) is an aggressive action. Again, you're arguing apples and paper. " Well, if you're referring to abortion, I think even you have to admit that that's still an aggresive action. With modern techniques abortion may be physically easy (as opposed to sticking a hanger into your body), but that certainly does not make it a "non-action". Come on, think man. "I don't see any pro-lifers getting this upset at dogs when they kill their young AFTER being born because they are sick and the mother knows they will not be able to survive alone. I also don't see pro-lifers getting up in arms about people KILLING HORSES just because they broke a leg. And I don't hear pro-lifers calling farmers murderers and giving up eating their eggs (CHICKEN BABIES!) or veal (LAMB BABIES!) in protest. A bunch of hypocrites. " Hmmm, let's weigh the difference here: thinking, feeling, sentient, self-aware and depending on your viewpoint, spirtual, human beings, and animals. Wow, I think there's a bit of a mistake in your arguement. Unless you're one of those who honestly feel that animals are virtually equal to humans, to which, I apologize, I will refuse to dignify with a response.";3;1;2;Pro-Life
