author_id,topic,text,topic_id,discussion_stance_id,discussion_stance
912,abortion,"Its good to clarify.
Yes the rape, incest, etc are horrible things. But these are not the only considerations during abortions.
Theres the family consequences, the relationship consequences, the social consequences, the economic consequences. Not to mention the fact that pregnancy is not pleasant and can have medical consequences. Theres also the time it is going to take. It will change your whole life. Adoption only deals with some of the economic factors. There will be tons of emotional damage from having to cary the baby to term and give it up.
"Condoms don't protect your heart” -- some people don’t have the same standards as you do, and sex with condoms outside of marriage is seen as part of a healthy relationship. Again, this is going with the whole personal values and morals thing we spoke about.
"I know a woman who had an abortion many years ago and she has regretted the decision her whole life.” -- And there is many stories like this one, there are also many stories where the woman had the child and regretted it her whole life. Jumping to try and shut it down is not constructive and will lead to suffering. Putting out resources, improving education, being respectful, being supportive, etc. These are the things that will be constructive.
"I completely agree, more needs to be done to help these women who have unwanted pregnancies. But the way to help them isn't to convince them to kill thier child.”
-- and suggesting that its either A) killing a child or B) forcing them to have a baby is also wrong.
Pro choice is not about convincing people to kill children. Its about giving education, preventing pregnancies by use of education on contraceptives, and abstinence (While an abstinence only education is flawed, it does have merits so long as people do realize that they could mess up and have a back up plan like condoms). Pro choice is actually aimed at trying to prevent pregnancies before abortion comes up as an *option*.
And it should be a very informed option with support for either choice without it being forced or made to convince the person that it is the only option",3,0,Pro-Choice
912,abortion,"Faith, As I see it relies on personal experience, feelings, etc rather than proof and evidence.
If you want to say that your faith has evidence you have a lot of evidence to present. I have respect for the jist of what christianity teaches, I see the important cultural and historical influences (and some negative influences caused by devout, but ill gilded followers)
From where I stand I do not see the evidence.
"My faith is based upon the testable laws of the Lord. i.e. "Do not murder." - People don't do it... nobody gets murdered. "Love your neighbor as yourself" - People do it... nobody gets the cops called on them for parking slightly in the neighbor's driveway. If people follow God, people won't get hurt.”
- I’m not sure If I understand this. You have faith because if people follow the ten commandments they don’t get hurt? How does this prove that God wrote the commandments and not men? how does it prove God? How does it account for christians who do not follow them? how does it account for people who follow them and get hurt?
...
What if we switch “ten Commandments” With “Buddhist Precepts”?
The Five Precepts are the basis of Buddhist morality. The first precept is to avoid killing or harming living beings. The second is to avoid stealing, the third is to avoid sexual misconduct, the fourth is to avoid lying and the fifth is to avoid alcohol and other intoxicating drugs.
The evidence for the five precepts:
After we have stopped doing bad, we then commence to do good. Take for example, speech. The Buddha says we should start by refraining from telling lies. After that, we should speak the truth, speak gently and politely and speak at the right time. He says:
"Giving up false speech he becomes a speaker of truth, reliable, trustworthy, dependable, he does not deceive the world. Giving up malicious speech he does not repeat there what he has heard here nor does he repeat here what he has heard there in order to cause variance between people. He reconciles those who are divided and brings closer together those who are already friends. Harmony is his joy, harmony is his delight, harmony is his love; it is the motive of his speech. Giving up harsh speech his speech is blameless, pleasing to the ear, agreeable, going to the heart, urbane, liked by most. Giving up idle chatter he speaks at the right time, what is correct, to the point, about Dhamma and about discipline. He speaks words worth being treasured up, seasonable, reasonable, well defined and to the point.” - Gautama, Buddha
(NOTE: I’m not a buddhist, I’m just putting this out as an example because its another religion I know a lot about)",3,0,Pro-Choice
972,abortion,"That was everyone's parent's choice... We didn't choose for our parents to give birth to us. If Hitler was aborted, the holocaust would of never happened. The world is overpopulated as it is and the way the economy is, we would technically be doing those babies a favor by aborting them instead of allowing most of them to suffer....",3,0,Pro-Choice
2,abortion,"I guess this is sarcasm. I hope it is. If it isn't then this is a very weird argument.",3,0,Pro-Choice
1204,abortion,"The right to abortion should not be abused,
however I do believe that the choice should be provided.
NOBODY should make decisions of what an individual should do with her body.",3,0,Pro-Choice
912,abortion,"Try being honest here:
Christians *Believe* abortion is wrong because of the faith in their God. If you claim to know it is wrong, you need to bring forth evidence. When it gets down to it, people need faith to believe in God.
"Abortion is killing an unborn baby” -- and others call it stopping the development of a fetus.
When it gets down to it, calling it murder is wrong. You can believe it is based on your faith, but this is getting into a philosophical debate on “what constitutes a person”.",3,0,Pro-Choice
912,abortion,"There are huge differences between the two examples you give. Your only perceiving it as a murder because of your personal, religious, and philosophical beliefs. Not to mention that your ignoring all the factors and portraying people who abort as having the same intentions as murderers.
If those are your personal beliefs then don’t do it. Just remember, your beliefs are not facts, and you have no right to force others to follow your philosophical and religious beliefs.",3,0,Pro-Choice
912,abortion,""The earth is not overpopulated. There is a lot of room for more people to live. Abortion is murder, no matter the reason.”
Another narrow minded statement.
Humans are not the only ones that need space.
There are countless species and ecosystems that are needed for key functions they play.
As it stands the only reason our current population is able to support itself is because of its excessive use of oil products.And it is not a renewable resource.
Aside from transportation, agriculture is the largest consumer of oil.
Without it, we could not feed our current population. In fact, even with it, many go hungry.
of course, if certain lifestyles and habits are changed we could support more people, but in the current system human populations are unsustainable and the size will be a problem.",3,0,Pro-Choice
1845,abortion,"Allow me to take the class to a blast from the past. (Sorry I couldn't help it.)
When our forefathers came to America there were still some huge problems with Britan being the ruler and telling us what to do. They fought for our freedom to do as we please. Hence why the Declaration of Independence came to be so that we could choose what we wanted to do ourself. Women have the right to abort a baby; no one can tell her that she can't. Donig so goes against our freedom as people, and being in control of our own life. I'm not saying that abortion is the best choice; of course not. NO ONE is Pro-Abortion.. We fight for pro-choice so that women have the right to choose as they please with their own bodies. That's why America can't be a Pro-Life place because it goes against our rights of freedom.",3,0,Pro-Choice
2,abortion,"Laws protect rare species because if we go around killing them, there won't be any left. Humans aren't rare, and a fetus is not a legal human under the law.",3,0,Pro-Choice
2,abortion,"Being forced to bring an unwanted child to term has an effect on other people as well. Plus, blowing up the world would be illegal; abortion isn't.",3,0,Pro-Choice
1244,abortion,"I agree in Pro-Choice because it is a woman's body not the male doctor or the male government official who is bearing a child that they cannot support. It is a woman's body so she should be able to do what she wants to do with it. The government does have SOME control over what you do with your body but not over the body inside you. Some people have too many children and cannot support another one so they choose abortion. IT IS THEIR BODY! YOU CANNOT CHANGE THE FACTS OF LIFE!",3,0,Pro-Choice
1572,abortion,"whoo hoo! pro-life is getting it's ass kicked. opening up a can of whoop-ass on them coat-hanger hooligans!",3,0,Pro-Choice
1827,abortion,"I'm a catholic and it says as most know that pro choice is not right and should be illegal. I just don't agree though. Personally I would never do it I feel like I would be getting rid of part of me I just can't do that but if another woman feels it is right because of whatever circumstance she comes up with them it's her choice it's her body bottom line you can't force someone to want to carry and have the child even if you did give them an option of giving it up. It's up to them that really all.",3,0,Pro-Choice
1846,abortion,"Say a woman was raped. Pro-life suggests that she should be forced to have the child. Yet not all women who menstruate are physically or mentally capable of having the child at all. If the conditions were such that the woman didn't want the child in the first place and either she, the child, or both would die in the process of birth, isn't that forcing death? Also, a study was made (search the Donohue-Levitt hypothesis) that shows that if the mother dies and the child survives, it's more likely that the child will feel unloved, and that it's the unloved children who grow up to be in gangs and street violence. Abortion is forcing and taking away choice. Aren't choice and freedom some of the main values of America?",3,0,Pro-Choice
1846,abortion,""95% of abortions", you said, were "because of not being able to afford the child, getting in the way of their job, too young, want to wait, etc."
And here comes the part where I put in my two cents.
If the mother can't afford the child, how is its life going to be? It would grow up, live in poverty, and probably suffer. Kids are expensive these days. Would ya rather have a child have to live through suffering for years, or have it (and its mother) be spared poverty?
The mother has a job, but a child would just get in the way. So if the child is born, what happens? The mother loses her job, and the kid's living in poverty. Back to the previous argument.
Too young. So if the person is, in their opinion, too young, they need to be forced to have the child? You said "you make the decision of having a child at the bed". So if the woman didn't want the child, she couldn't have sex at all? No matter the protection, there's always a chance of pregnancy. You're suggesting, it seems, that if she doesn't want a child she doesn't have sex. That, to me, seems unfair on the woman. She should be let to do what she wants without being forced to unnecessary measures.
Want to wait. Well, if she wants children later in life, but you force them on her now, is she still going to want them? Maybe the experience of motherhood would be ruined for her, because she was made to do something she, given her choice, would not have picked.",3,0,Pro-Choice
994,abortion,"A zygote, being a combination of two gametes, makes a baby, right?
Well, a sperm is half of that, and a female egg makes the other half.
Masturbation is technically "killing" sex cells. Which technically, in a pro-life argument, would be immoral.
Maybe we should make masturbation illegal.",3,0,Pro-Choice
1831,abortion,"The argument of pro-choice vs. pro-life is arbitrary. The matter is not whether your agree with the moral implications of abortion itself, but whether you agree with the American ideal of freedom of choices. You have the right to abstain from an abortion, but you do not have the right to regulate someone else's morality, nor does the government. The government is free from moral implications. And since a fetus is akin to a tumor, it cannot be considered a life, and therefore free from the implications of murder. With that said, abortion is a moral issue, making it out of the government's hands unless something is noted that makes a legitimate case for legality of abortion outside of morality.",3,0,Pro-Choice
1831,abortion,"By whose standards? The government sure doesn't recognize a fetus as a human being. With the fact that a fetus isn't legally considered a person, that point is null. Plus, murder isn't federally illegal so it becomes a state's rights problem, not a federal problem.",3,0,Pro-Choice
1854,abortion,"What if the woman has been through a traumatic experience in which she was impregnated? What if she was raped, and the child that she carries for nine months and maybe looks after, reminds her of the horrible experience? What if it will ruin the mothers life, her career? Although the foetus is alive, it does not feel anything nor know what is going on.",3,0,Pro-Choice
1373,abortion,"So, you want to convince me that a packet of thoughtless cells has rights? Your argument is that it has the potential to become human and therefore has all the rights it needs. But then aren't condoms the same then? Every time you partake in sex the potential to create a human is born. Are you saying anything but cumming inside is the same as murder? Those cells that are growing inside the woman's body are her responsibility, and is not a free choosing sentient being with rights yet. Woman should have children when they are ready, not when fate deals the blow.
Watch or read Freakenomics, it explains how state's that offered abortion or made it easily available had a crime rate decrease of about 10% over a decade or two. This is because women weren't trying to take on the task of raising a child when they weren't ready, making the child more likely to commit crimes when they grow up. That alone should be reason enough to let them choose.",3,0,Pro-Choice
1862,abortion,"People should have the right to choose, just like you had the right to choose which way to vote in this discussion. Maybe the woman can't support the child but can't bear with sending it off with another family because of the regret she'll feel later? Abortion. Maybe she doesn't want to put an end to the child's life so decides to give them up to a good home? Adoption. Maybe she finds a better job and CAN support the child? Keep it. But what if she has a disease that can be spread during pregnancy and doesn't want her child to suffer? Or what if it was rape? People have choices, always have, always will.",3,0,Pro-Choice
305,abortion,"You can't ban a procedure any more than you can ban prostitution. It has been around for centuries, and it will continue.
All we can really accomplish here is making it safer for the mother. Back alley abortions with a wire hanger and a can of Lysol is not policy, but it has been and will be again if we completely ban it.
The rich have another way to abort. They have the same procedure done as a woman with a miscarriage. That way, the family gets sympathy instead of cold shoulders. This is still abortion (unless it really is a miscarriage, of course), and you won't see Jerry Falwell banning that. Probably used it a few times himself.
I would not want my wife or daughter to have an abortion, and I don't think it should be used as a primary form of birth control, but if you ban it, you say that a 13 year old who gets raped by her dad MUST have the child. Family values does not include having daddy's baby.
Let's not get into the argument of "abortion sometimes". You can't have guidelines that can be changed over time. You have to keep medical procedures available to all. We need to educate about sex and birth control, promote adoption, and keep the abortion option open.",3,0,Yes
305,abortion,"Good points.
The problem is the terminology used here. Ban is a powerful word in a legal sense. I bring up the young girl not to be a sicko but to point out that when you outlaw the procedure for arguable moral reasons (reasons you and I share in some cases, as I mentioned before), you outlaw it for everyone in all cases.
You and I may come to the same conclusion if one of our loved ones was faced with this problem, but I don't feel I have the power to tell my neighbor what to do. Some moral views are personal and should remain that way.
I will not argue the point that I would not want my wife or daughter to get one. I think adoption is a wonderful thing, and so is keeping the baby you created and living with your responsibility. But I shudder to think of the admittedly small minority of women who are pregnant through rape or incest. Could you look a young girl in the eye and tell her that the baby inside her is a gift from god when her priest raped her in the first place?
Extreme examples, I know. But extreme measures such as a total ban require extreme arguments.",3,0,Yes
2263,abortion,"A fetus is part of the mother. Kind of an extension of the womans body. It is attached by a chord, and it is inside her.
it is part of the mother
a mother who wants to kill part of her own body is not the same as killing a seperate person.",3,0,Yes
375,abortion,"A child will also call a tadpole a fish and a platipus a bird. What a child would call something is irrelevant.
And in all fairness there is a difference. Your neighbor is free to tell his wife to leave. The woman is not free to eject the fetus without killing it. The woman is effectively being forced to provide rent-free lodgings to this "baby" for 9 months, plus the hormones, morning sickeness, cravings, and bloating. I'm sure if we could take out the fetus and put it into a mechanical womb or something women would choose that rather than killing it- but that is unfortunatly not an option.",3,0,Yes
2339,abortion,"From the religious point of view, conception makes a person. From a scientific view, it's not a person, a separate life, until at the very earliest around 7/8 months.",3,0,Yes
2341,abortion,"I find it so interesting that men or a man can feel so passionate about something that essentially has nothing to do with them. A man will never know what it is like to carry a baby, and he never will. How can he have any opinions over the going ons of a woman's body?
With that said, here is how I feel about abortion. I feel it should not be used as a primary source of birth control. However, if it is (which I doubt severely), who are we to stop it? If a woman is irresponsible enough to continually get pregnant, do we really want this kind of woman raising children? Think about it. If a woman, any woman, has decided that she does not want or cannot care for a child, she is probably making the best decision for all involved.
Why do you think there are so many people in the American criminal justice system? Many of these people probably should have been aborted. I know that sounds so cold and so cruel, but what good have they been to society? They've stolen, murdered, battered, defrauded, and so much more. I ask you, what is sadder, a lifetime spent behind bars or a life that was ended before it even began? And even more so, if they get the death penalty, aren't we ultimately performing an abortion, just many years later? We are aborting a member from society. I would be so bold as to say that if you are pro-life you are anti-death penalty.
My point is, many women abort because they know in their hearts that they cannot care for a child, and cannot bear the thought of a child growing up in adoption agencies. Some may argue, "well, she shouldn't have gotten pregnant in the first place." Well she did, and unfortunately with pregnancy, once the ball has started rolling, that baby is coming unless something is done to stop it.
I'm not heartless. I want children one day. And thankfully, I've never had to make the difficult decision of having an abortion. But if I ever were to be placed in that situation, I can't say what I'd do, but I'd certainly want the option there.",3,0,Yes
2341,abortion,"Unfortunately, this is one of those double standards that everybody hates so much. Sure, you've lent us your seed, but we are the carriers. We have more rights because of this. Your body is not stretched to unrecognizable proportions. You do not experience morning sickness. You do not risk your very life to bring a child forth into the world. Your life is not necessarily changed forever if you don't want it to be, but ours is. It is a double standard, I acknowledge that, but it is what it is. A man cannot and never will dictate what happens to me or my body. This is nothing more than men trying to control yet another aspect of the world. You all just need to accept that this is a woman's right, because ultimately it is a woman's burden.
And speaking of burdens, what say you about all these children, these fetuses that are being "saved," that are being born to unwed teenage mothers? To crackheads? To the unfit and the unworthy? What say you about these babies? Where exactly do you think they are going to end up? Statistics are very grim for these children. It amazes me that everyone is all "save the kids!" "It's murder!" "Save the babies!" But as soon as the kid is born, nobody wants to help out, and then the same people who screamed "pro-life" are the same ones calling for welfare reform. Lol!",3,0,Yes
2341,abortion,"I notice how you never seem to argue any of my main ideas. So I'll end this little debate with this:
You (a man) cannot control what a woman does with, to, or for her body.
You never will control what a woman does with, to, or for her body.
This issue has a built-in double standard that is simply a fact of life. Deal with it.
To avoid this altogether, wear a condom and use birth control!! LOL",3,0,Yes
2340,abortion,"Leaving aside the arguments that have been tossed around already regarding whether or not a foetus is human, murder or termination, etc..., I'll just say this.
All arguments against abortion rely on killing being wrong.
Killing isn't always wrong.
Therefore, these arguments don't stand.",3,0,Yes
1256,abortion,"Abortion should be legal. For those who disagree, just try and imagine one of your relatives getting raped. You are saying that you would deny a fifteen year old girl the right to kill the fetus inside of her after she went through such a horrific experience. Can you even began to comprehend the pain and humiliaty that she is going through? Of course not, unless you had to go through the same experience. You expect her to go through nine months of hell because you think that its wrong for the fetus to die. Imagine her giving birth to the baby and watching it grow up. All she can remember everytime she sees its face is the night that it was created. How can she explain to the child that it wasn't made between two individuals who loved each other but by a man that took advantage of her and practically beat her to death. What a lovely bed time story to tell them. I bet you eat eggs but that doesn't alarm you. The fetus isn't even fully developed and most likely wouldn't feel a thing. I understand that abortion shouldn't be offered to those who were careless but think about rape victims. Not only do they have to deal with the memories but they also have to deal with people who scream at them and call them murderers when it wasn't their fault to begin with. People should be ashamed of themselves for commiting such acts.",3,0,Yes
1256,abortion,"MINIMAL?!?!? How can you even begin to describe such events as if it is some petty offense or of small stature. In most cases, these rapes also include being beaten. You are obviously misinformed about these occurances if you choose to believe it to be something that a young girl can get passed easily. These things tramatize children and tend to dwell in their minds reminding them of the mental and physical pain they were put through. Rape is a common thing in today's world so maybe you should do some research so you can at least develop an intelligente argument.",3,0,Yes
1256,abortion,"" baby is 8 years old"
it wouldn't be a baby anymore. it would be a child.
Besides the argument you have created has a totally different scenario now. This child has already been born and is becoming a functional member of society. The fetus isn't even fully developed and wouldn't know what was happening. How could the mother have not known that the child was her brother's. Was she sleeping with four other different men or was she raped several times. No matter which scenario you use, if the girl was raped then she should have the right to decide if she wants an abortion or not. How can you call abortion murder? The word murder is defined as to kill or slaughter inhumanly or barbarously. War is murder. The diseased animals we are fed is murder. These women aren't slaughtering these fetuses. Those who are denied the right to it are because of people like you. You are ultimatly an accomplice because you have left no other choice for these women. So go on preaching about how wrong abortion is while you support the murder (not abortion) of these unborn babies.",3,0,Yes
