author_id,topic,text,topic_id,discussion_stance_id,discussion_stance
83,abortion,"Really? The issue isn't mainly abortion, and woman's choice. I have never looked at abortion that way, The thing I account abortion for is murder. That is the biggest debate. Now our country, America who supports life, liberty and the pursuit of happiness, denies a future american the right to life, is that murder, the pro-life people say yes, the pro-choice people say no. That is the issue, does the government allow what is considered by people as murder to continue and defame our country;s values or does it sit back and allow woman to choose because another amount of people wish it. Its dangerous ground either way.",3,0,Pro-Life
3312,abortion,"So you are tolerant enough of infanticide to let others choose to do it. Understood.",3,0,Pro-Life
3312,abortion,"You are right, the government has no say in regulating medical procedures or protecting the human right of infants. These are the things that make us a great people.",3,0,Pro-Life
83,abortion,"Addressing all of the comments made against my definition:
Everyone here knows I am pro-life. It is who I am. I don't like debating this topic just because of th fact that its opinion versus opinion, not on the way of facts because hey Ive heard both sides. I won't be swayed to swith my position on the subject and Im very aware tha many other people won't, both choice and life.",3,0,Pro-Life
1251,abortion,"YES. I am Pro-Life... and Pro-Choice.
I am in favor of people being alive (most of them anyway) and I am in favor of people having the ability to make choices (fack police states). These are not two mutually exclusive ideas. It is Pro- or Anti- Abortion that people should be talking about... unless you like dead people who can't make choices, then have at it.",3,0,Pro-Life
1251,abortion,"Democracy is by definition a mob rule style of government... thank goodness we live in a Constitutional Republic. I don't trust people enough to let them have a say in how I exercise my rights.",3,0,Pro-Life
1734,abortion,"this debate was listed under religion, not politics.
i would be interested to see where this went if people got away from the definition of murder (which seems somewhat irrelevant) and whether or not the state says abortion is legal. as a person who value free thought, i must say that one would have to have one's head shoved pretty far up one's ass to think that the government saying something is legal makes it okay, or that the government making something illegal suddenly makes it bad.",3,0,Pro-Life
3801,abortion,"how can you say that it should be alowed for a person to kill an inosent human being? the poor thing dosnt evan have a chance to beable to expeirence life its not fair! They are LIVING i dont care that peple say " oh well there not acualy living." ummmm YA THEY ARE!!!!!!! I have seen a ultrasound video of my cusines baby and hey guse what?? its heart is beating! now how can you see that and say that its not living? huh? If your heart is beating then umm hey gusse what... YOUR ALIVE!!!!",3,0,Pro-Life
3803,abortion,"Let me just say. There is no such thing as being against abortion and being pro-choice. If you are pro-choice, you are taking a stand and saying that it is ok to have an abortion. To say that you are against abortion, but then call yourself pro-choice is hypocritical.",3,0,Pro-Life
1267,abortion,"I'm not pro-abortion; I'd prefer that there be none. But I'm pro-choice, because the right way to prevent abortions is to prevent unwanted pregnancies, not to force women to carry pregnancies to term. The rights of the woman outweigh the potential rights of the embryo or fetus.
(I made this debate because the previous one was so long that it wouldn't load anymore. We need to start from scratch.)",3,0,"Yes, it should be allowed."
450,abortion,"**I made this debate because the previous one was so long that it wouldn't load anymore. We need to start from scratch.***
Why? it will never be settled",3,0,"Yes, it should be allowed."
1267,abortion,"The way to settle this issue, as a nation, is to make the question academic. Women who don't have unwanted pregnancies never have to decide whether to abort. While we can never prevent all unwanted pregnancies, we can do much, much more than we are doing now. In the end, abortion will be "safe, legal and rare".",3,0,"Yes, it should be allowed."
1068,abortion,"You'd rather kill our present?",3,0,"Yes, it should be allowed."
1068,abortion,Evidently.,3,0,"Yes, it should be allowed."
1189,abortion,"And what of the predicament of an impregnated rape victim? How does one take responsibility for 'her previous action' after being raped?
Responsible - having a capacity for moral decisions and therefore accountable; capable of rational thought or action: The defendant is not responsible for his actions.
Based on this definition, abortion is a responsible choice when confronting an unwanted pregnancy, by correcting her mistake and moving on.
The kid will maybe end up in an orphanage? Let's note that adoption was considered dumping your mistake on others and irresponsible in the days before legalized abortion. Is it necessary to put more kids in the foster care system? And, most people involved in that make money off of it.
"Why should I work for nine months, and then give someone else the benefit?"",3,0,"Yes, it should be allowed."
1267,abortion,"The woman is a person, not a potential person. This makes her "special", as you put it. It's not as if we have any lack of population. What we need is for all children to be born into families that actually want them.",3,0,"Yes, it should be allowed."
1267,abortion,"Actually, it's a very simple issue. Forcing a woman to carry an unwanted pregnancy to term is cruelty towards her, towards the baby that gets created this way, and towards society. If you want to teach someone a lesson, start by teaching them a lesson. I suggest we begin with comprehensive sexual education and add free access to contraception. If we do this, we will remove the demand for abortions, rather than trying to limit the supply.",3,0,"Yes, it should be allowed."
1267,abortion,"They are the "exception" that proves the rule isn't viable. If we don't allow rape victims abortions, we are even more cruel than not allowing other women with unwanted pregnancies to abort them. And if we do, a woman will merely have to claim she was raped in order to avoid being forced against her will to carry an unwanted pregnancy to term. The solution is to stp trying to force her.",3,0,"Yes, it should be allowed."
3610,abortion,"Thevenerablerob (love the name...it suits your argument...and yes, I'm being facetious) posted the following:
"I think that one main benefit of keeping abortion illegal is that the girl will have to take responsibility for that baby - take responsibility for her previous actions, since there is no way to prevent her previous actions..."
My Gosh...listen, buddy...it takes two to tango! The man is just as responsible for his actions, as she is for hers! Children do not come to being through immaculate conception!
Are you really and truly saying that a woman should never have sex, unless she is fully prepared to have the baby...but, the man can have all the sex he wants, without having any responsibility at all?
In other words...should an unwanted pregnancy occur...she MUST have the baby and LEARN HER LESSON...while he TAKES OFF, if he feels like it...no consequences to suffer, nor obligations to meet. No lessons to learn...and no remorse?! Hmmm...very interesting!!!
Let me ask you...if the shoe was on the other foot...and it was the man who got pregnant...would the equation of responsibility (and lack thereof) remain the same?
Would it be against the law for men to have abortions?
Should he be forced to have the baby, would it simply be accepted, if the "young teenage woman" decided to evade all responsibility?
The bottom line is...men do not get pregnant...and don't have women walking out on them, because they are pregnant. So, who are you to teach anyone a lesson!?",3,0,"Yes, it should be allowed."
1267,abortion,"Yes, there's a waiting list for healthy, white babies, but there's an excess of less desirable ones. Telling a woman that she had to carry the pregnancy to term amounts to taking away her most basic rights to her own body. Add to this the typical fate of unwanted babies and the idea of adoption as some sort of alternative to abortion disappears in a puff of realism.",3,0,"Yes, it should be allowed."
1267,abortion,"I'd like to separately rebut the notion that the anti-choice movement has anything at all to do with life being sacred. If anything, the same social conservativism that is behind anti-choice is correlated with being pro-torture and pro-execution.
Yes, an embryo or fetus is alive, but so's my left foot. Life doesn't translate to personhood, and without personhood, there can be no primary rights. The mere fact that an embryo is currently alive does not give it the right to remain so at the cost of the woman's autonomy.
I'm all for life, but I actually care about quality, not just quantity, so I distinguish between people and potential people.",3,0,"Yes, it should be allowed."
3610,abortion,"Thoughtcriminal posted..."It's not as if we have any lack of population. What we need is for all children to be born into families that actually want them."
...Absolutely! There are no qualms about taking the lives of animals during hunting season. In fact, the season is extended, if there are species that are "overpopulated." (...just another perspective)
What about the fact that human beings have been steadily encroaching upon wildlife habitats...adversely effecting animal and plant populations...to the point of
extinction!? Why aren't their lives "sacred"?
How about keeping our own population "in check"!? Do we really need anymore unwanted children in this world to adopt?
One of the main problems is that, certain religions perpetuate guilt about sex. They preach lifeways and practices that lack human understanding, wisdom, and better judgement. In the end...it all basically boils down to...ignorance, vulnerability, and irresponsibility.
Thoughtcriminal's comments also, about sex education and contraception, are definitely the way to go!",3,0,"Yes, it should be allowed."
1267,abortion,"This is commentary, not rebuttal...
All environmental issues are magnified by the population pressure, so it's hypocritical to brag about how green you are while popping out more than a pair of children. It comes down to quantity vs. quality: the world is a better place for each of us if there are fewer people to divide up the limited resources.
Having said this, abortion is just about the worst form of birth control available. It's better than carrying an unwanted pregnancy to term, but it falls far short of simply not getting pregnant in the first place. If we forced every woman who wanted an abortion to produce a baby, though, we would not only have a substantial increase in population, but it would this increase would arrive where it is lease desired.",3,0,"Yes, it should be allowed."
3220,abortion,"Women have the right to an abortion. Women should have the right to an abortion. There are medical guidelines in effect when the fetus is viable. That is the sum total of the argument. It seems to me there are a tremendous number of people who are more than willing to take any opportunity to “explain” to women the error of their ways and “according to them” how she should handle the remainder of her life. Let’s reverse the situation completely. For all of those people willing to give the women the benefit of their profound knowledge, wisdom and insight, I suggest we put your lives under a microscope and let us give you the benefit of our collective wisdom and from that information you will then conduct your life on our terms.
Pregnancy occurs when the sperm fertilizes and egg. This is not a huge surprise and has been known for a very long time. Terminate the pregnancy or have the baby and do the best you can in raising the child. Do not let anyone tell you otherwise. It’s none of their business.
All of the extraneous circumstances as to how it happened is of no concern. I also noticed that nobody has stepped forward with the scenario about whether or not she was impregnated by the space aliens who visited the earth.
If it’s not your pregnancy it’s not your business.",3,0,"Yes, it should be allowed."
3220,abortion,"Her life is so special because it's her life. If you are so concerned about the next generation you only have to find a woman who agrees with you and go forth and "well you know". I promise you I will not interfere in how you run your life.",3,0,"Yes, it should be allowed."
3220,abortion,"There is nothing complex about the issue. It only gets complex with these ridiculous analogies. Nice that you can explain her moral obligations and what you think she should do. If you are not pregnant, how is it your business?",3,0,"Yes, it should be allowed."
3220,abortion,"Since we are harping on all of the hypothetical scenarios of how she got pregnant. Let us assume her that she is on the pill, uses a condom and has an IUD and double saran wrapped him. Let us also assume she had sex because she wanted to because she likes it as much as the man does. Let us assume (here comes the horror) she is an unwed woman who also enjoys sex. OMG I know, there is no end to the number of sins involved in this one.
She has no interest in having a baby and discovers she is pregnant. She either will have it or she won’t have it. The answer is still the same. It’s none of your business. There is nothing terrible about giving up a child for adoption. It is simply another choice she has.
The most telling statement you made was that you don’t like other people telling you what to do. So the deal is simple; we won’t if you won’t.",3,0,"Yes, it should be allowed."
3220,abortion,"Dear Rob:
If you run the cursor over the bottom right hand corner of your computer screen you will note the time. Let the cursor sit over it for a second or two and you will notice the day and date will also display. Note the year. 2009 not 1509.
You do manage to describe sex in the most basic and wonderfully clinical terms. At the very least I would hope that you find it as much fun as the rest of us.
I got married at 21 and honestly, at no point did I consider abstinence a viable option. (There were a number of promising dates who thought it was an option I should vigorously pursue but that is really another subject).
I am glad you have not lost your sense of moving from the ridiculous to the absurd in a single statement. What does any of this have to do with China or forced abortions? We are talking about whether or not a woman can choose for herself.
A legitimate child is a child who is born. There right to legitimacy is not predicated on your sense of morality and we are all thankful for that.
The moral and ethical implications seem highly important to you and as such perhaps living your life in this way, according to your own terms, is the best thing for you. How wonderful for you never to have had a crisis of conscience.
Apart from the abortion issue, you seem to have taken on the quality of life issue too. You would allow the termination of life based on a genetic difference in the child or if the mother is terminally ill. How much prescreening would you do to make this determination? If the terminally ill mother decided to have the baby I think adoption may work for that child. Please make up your mind. Are abortions ok in some cases now?
Personally, I am forever happy to meet a flirtatious woman. I am way happier with them than I am with a self righteous prude of either sex.
Finally, I think you might ease up just a bit if you found a partner, of whichever gender is to your preference, get naked and try to relax.
Have a nice day.",3,0,"Yes, it should be allowed."
1267,abortion,"Rape is a violaton of a person's autonomy over their body; the woman is having a penis forced into her against her will. For some rapists, this isn't enough: they actively wish to impregnate their victim because they recognize forced pregnancy as an even bigger violation. For society to aid the rapist by forcing the woman to carry the unwanted pregnancy to term is akin to raping her daily for nine months.
Let me help you out with some language corrections. First, a fertilized egg is not a baby. It's not a baby when it becomes an embryo or early fetus, and it's not a baby when it gets aborted. If such a fetus is carried to term and all goes well, it will become a baby, but it would be premature to call it anything but a fetus until then. Likewise, a woman who gets pregnant is a pregnant woman, not a mother. A mother is someone who has a baby, and I just explained why a pregnancy is not a baby.",3,0,"Yes, it should be allowed."
1267,abortion,"Not at all. When someone makes an exception for rape, they're admitting that it's not really about "protecting the baby", it's about punishing the woman. Essentially, the anti-choicers have a dilemma: if they don't make exceptions for rape then they're very obviously cruel, but if they do then the STATED basis of their argument is revealed to be a lie.
You also missed the point I made about how, if we made an exception for rape, women would simply be forced to claim rape whenever a condom leaked.",3,0,"Yes, it should be allowed."
1267,abortion,"While we can and should make a distinction between the woman and the embryo, we don't get to grant any rights to the latter without first taking rights away from the former. And, to be frank, what rights ought an embryo have? Certainly not the right to be brought to term against the woman's will.",3,0,"Yes, it should be allowed."
3610,abortion,"Frankie and VenerableRob...I just find it interesting that so many men (and some women) are unabashed and even eager to decide/dictate a woman's future. That kind of treatment, lack of consideration and respect, has gone on for waaayyy tooooo loooong.
Frankie...if you, and Pro-Lifers, are not sexist and truly not interested in telling other people what to do with their bodies and their lives...then don't...because, it's really that simple! :)
Otherwise...be prepared to support more than a law against abortion...but, also a law that dictates the future of men who have fathered unwanted children, as well. (Ohhh...that's right...you don't like others to tell you what to do...dang it, I forgot! ) :(
Obviously, a man is not able to carry a baby to term...but, let's be real! It has to be a significant percentage of times...when the woman finally decides to have an abortion...because it just doesn't fit in with "his plans." Of course we all know why...life is just too "sacred." ;)
If she must make sacrifices, so should he! The weight and possible "blame," if you will, should not be placed solely on her shoulders. (It should go without saying that birth control is also, just as much his responsibility, as hers.)
If you, like VR, believe "the woman should not have intimate sex unless she is prepared to settle down and take responsibility for what might result of it from the man"...surely then, the same rules must apply to the man...or, I'm afraid, you got it right...you are sexist.
The lesson, proposed by VR...to be learned by the woman...will then also be learned by the man. "...What's good for the goose...is good for the gander!" ;) If a man is not prepared to father and care for a potential child...he better not attempt to spread seeds!
This is to both of you... Babies come from a sexual act that involves two people, not one...and if one is granted the right to choose, as well as, the freedom to walk away...so should the other be granted those very same freedoms.",3,0,"Yes, it should be allowed."
1267,abortion,"No, that's just your arbitrary personal definition, which happens not to match general usage.
Let's talk about usage and where you got your error from...
In the real world, we sometimes round up in the direction of intent. For example, if a woman is pregnant and wants to carry that pregnancy to term so as to become a mother, we might recognize this by somewhat prematurely calling her one. This is fine so long as everyone knows what's going on. The problem comes when people round up i against /i the direction of intent, as you just did.",3,0,"Yes, it should be allowed."
1267,abortion,"Then by all means start. A good direction for your new-found ability might be an explanation for why we should put an embryo's potential rights above a woman's actual rights.",3,0,"Yes, it should be allowed."
1267,abortion,"In the state of nature, there are no rights or obligations, just things you can get away with. In society, we grants rights based on what would satisfy our interests. Now, moving past this brief lesson in social contract theory, I would suggest that we grant rights no sooner than viability, as that is the point at which the termination of a pregnancy does not necessrily entail the termination of what is making the woman pregnant.",3,0,"Yes, it should be allowed."
1267,abortion,"No, narrow-minded would be referring to a fetus as a "he". Sexist, too.",3,0,"Yes, it should be allowed."
2787,abortion,"Every human should have freedom. are fetus human? if u take a example of a chicken.when does the egg turn into a chicken?",3,0,"Yes, it should be allowed."
1267,abortion,"Why should we grant embryos rights? We don't grant ova or sperm rights.",3,0,"Yes, it should be allowed."
1267,abortion,"A fetus is certainly human in the same sense that my kidney is human, but is it a person? My kidney isn't.",3,0,"Yes, it should be allowed."
1267,abortion,"I know a little English, so I know that there are less sexist alternatives.",3,0,"Yes, it should be allowed."
2784,abortion,"It's HER body. The 'baby' is a parasite in HER body. She has to carry it, feed it, care for it, provide it shelter, and what does she get out of it? She gets the glory of saying she brought another life into the world? She isn't even fully responsible for it, you need a woman and a man to make a baby. Her life has done something for the world already. She's already here. Maybe she doesn't want to contribute to our overpopulation problem. It should be the mother that decides what to do with her body. Or should we invade the privacy of women even further?",3,0,"Yes, it should be allowed."
1267,abortion,"I'd certainly be willing to give up my spare for the right person. It's a part of my body, so I have the right to decide what to do with it, even if that means removing it. And if that kidney had a cancerous tumor, I wouldn't blink before agreeing to having it removed and disposed of if that would improve my health.
Of course, if we could transplant a fetus, or keep it alive until "birth" in an artificial womb, then that might offer another option for pregnant women. But right now, the only way to end a pregnancy also ends the life of the fetus (or embryo).",3,0,"Yes, it should be allowed."
1267,abortion,"Chicken eggs start off with enough nutrition to make a chick. Human eggs do not, so they need a womb and a relatively long time.",3,0,"Yes, it should be allowed."
2787,abortion,"abortions are not being done against the will of the mother. If she wants it, then she should have it. her body, fetus is a part of her. she can decide if she wants it or not.",3,0,"Yes, it should be allowed."
2787,abortion,"people have been doing abortions for centuries. abortions should be allowed. making it a crime will not stop people from doing it. the true crime is the mother to scared of what people might think and then doing the abortion herself. that is why you find babies in garbage bins. if u take the abortion option away, the mothers might do something illegal and hurt themselves in the process",3,0,"Yes, it should be allowed."
1267,abortion,"You haven't explained why we should grant it personhood. You're going to need to if you expect your argument to hold up.",3,0,"Yes, it should be allowed."
1267,abortion,"Well, a separate issue is what the consequences would be if we banned abortion. We already know that the way to stop abortions is on the demand side (by helping women have only planned pregnancies) not on the supply side (by throwing doctors in prison). We also know that, so long as there is demand, an illegal and unsafe supply will exist. Whether it's the proverbial coathanger or its back-alley equivalent, these will kill actual people, along with the embryos and fetuses that the anti-choicers claim to care about.",3,0,"Yes, it should be allowed."
1267,abortion,"We absolutely must consider the foreseeable side-effects of any law we support. It's not as if we're just making an empty public statement: there are real consequences.",3,0,"Yes, it should be allowed."
1267,abortion,"If it's not a part of her, let's just take it out. Oh, wait, then it dies. It's either part of her or entirely parasitic. Your choice.",3,0,"Yes, it should be allowed."
1267,abortion,"I'd like to remind you that abortions involve pregnant women, not mothers. It's only when there's no abortion that motherhood enters the picture.",3,0,"Yes, it should be allowed."
1267,abortion,"The right to life does apply to people, but not to an embryo. The right to privacy is understood to include unwarranted intrusion upon people's bodies, which is what an abortion ban constitutes.",3,0,"Yes, it should be allowed."
