author_id;topic;text;topic_id;discussion_stance_id;topic_stance_id;discussion_stance
1408;abortion;"It is absurd and immoral to murder an innocent human being. The common pro-choice argument is against the humanity of the child. However, this is also absurd. What defines a human being? Quite simply, a living organism with the DNA of a Homo sapiens. An unborn child, not matter how far along, fulfills all three criteria. - An Unborn Child Is Alive - Biologically, there are three criteria for life. These are as follows: To be alive, something must (1) be able to reproduce on its own, either sexually or asexually, either through mitosis or meiosis, (2) be able to sense and react to its surroundings, on a cellular or macroscopic level, and (3) be able to consume energy from its surroundings for sustenance, on a cellular or macroscopic level. A child fulfills all of these conditions at conception. A fertilized egg can (1) divide by mitosis, (2) exhibit irritability, and (3) consume chemicals from the placenta. Thus, an unborn child is alive. - An Unborn Child Is An Organism (As Opposed to A Body Part) - What distinguishes an organism from a constituent of another organism? It be able to sustain the conditions of life separately from another organism, and must have different DNA. Both of these are satisfied in a fertilized egg. We all know that an embryo has different DNA than its mother. In addition, at conception, the child is capable of surviving in an environment separate from its mother. In pregnancy, it is possible for a child to die and the mother live, and vice versa. Thus, an unborn child is an independent organism. - An Unborn Child Has Homo Sapiens DNA - This is pretty indisputable. The mother DNA is human, and the father DNA is human, thus the embryo has human DNA. Since an unborn child is alive, is an independent organism, and has human DNA, it must be a human being. As a human, killing it without justification is murder. Since an unborn child is still innocent, as it has never done anything wrong, killing it is unjustified. Thus, killing an unborn child is murder. If murder is wrong, then, so is abortion.";3;1;2;Pro-Life
1811;abortion;""Fetus" is the greek word for "Baby." So in other words, "Abortion is ok because a Baby isn't a Human." Ummm... what? Sounds like some bad criteria to me.";3;1;2;Pro-Life
1811;abortion;"Caitie, as a Christian myself, I think it's important that we stand up for the same morals God' has. Psalm 139:13-16 says "For you created my inmost being, you knit me together in my mother’s womb. I praise you because I am fearfully and wonderfully made, your works are wonderful, I know that full well. My frame was not hidden from you when I was made in the secret place, when I was woven together in the depths of the earth. Your eyes saw my unformed body, all the days ordained for me were written in your book before one of them came to be." God knows us from conception, and when we see that, we know God has a plan for each and every one of us! To have an abortion is to cut that precious life short and to keep that life from some amazing plans that God has in store for him/her. Stopping Abortion is key to restoring God's hope in the hearts of people, especially America, where these morals have basically been flushed down the toilet. Many Americans today (I am American too) have lost sight of how precious life is. It is fragile and needs proper care, and we need to care for each other! And that definitley includes unborn children.";3;1;2;Pro-Life
1811;abortion;"Well, I gues I don't know how to say this exactly without sounding like so-called "bigot," but, the Bible doesn't talk about tolerance. Not once. I agree that people (in general, not just christians) should petition for education concerning pregnancy, but, if people just followed God's laws and made good choices there would be no need for abortion. Sadly, the heart is "decietfully wicked" and people do evil things. Many times the things leading a woman to get an abortion is because of evil! And its sad and horrible! But, we can't fight evil with more evil. Its worth it to be called names when you know you're fighting for something that is right.";3;1;2;Pro-Life
1811;abortion;"I see where you are coming from, and I agree! Christians are told to be loving by Jesus himself, and obviously, being loving doesn't mean to accuse people of "evil." The evil I was speaking of were things like rape, incest, cheating, etc. Obviously, a woman who is raped is not the evil one. It was the man who raped her who did evil, and in return caused her to take action and have an abortion. In your example, they both made the decision to consent to sex and that always comes with reprocussions... whether you use protection or not. Condoms don't protect your heart, for example. But to get rid of the child like that.... it's sad. Its not the baby's fault, and there are always better options like adoption. Its sad that things like this happen! I know a woman who had an abortion many years ago and she has regretted the decision her whole life. She is a persistent pro-life volunteer at the Women's Resource Center and everything now! A child is so precious and a fetus needs the same 4 things we need as adults: food, water, shelter, oxygen. I completely agree, more needs to be done to help these women who have unwanted pregnancies. But the way to help them isn't to convince them to kill thier child.";3;1;2;Pro-Life
1811;abortion;"Faith is misrepresented today. Faith is not something you "just believe," its something you believe SO MUCH that you are willing to change your life for it, AND you have evidence for it. The Bible explains faith as the "essence of things hoped for and evidence for things not seen." Faith requires EVIDENCE. So people saying "I believe it because of my faith and I just know...." they don't really know. My faith is based upon the testable laws of the Lord. i.e. "Do not murder." - People don't do it... nobody gets murdered. "Love your neighbor as yourself" - People do it... nobody gets the cops called on them for parking slightly in the neighbor's driveway. If people follow God, people won't get hurt.";3;1;2;Pro-Life
1844;abortion;"that is possibly the stupidest and least informed arguement i have ever heard in my life.";3;1;2;Pro-Life
1225;abortion;"when abortion happens it dosent just effect the womens body but the unborn person inside her is killed and if you have ever seen abortion happen, if you did it would utterly discust and horrify you look it up on youtube";3;1;2;Pro-Life
1225;abortion;"when abortion happens it dosent just effect the womens body but the unborn person inside her is killed and if you have ever seen abortion happen, if you did it would utterly discust and horrify you look it up on youtube";3;1;2;Pro-Life
1838;abortion;"My one question... Why is it we argue for the "right" to kill the unborn when the government is taking away our real rights?";3;1;2;Pro-Life
1881;abortion;"While I do not intend to attack anybody, please listen to what I have to say. Abortion is murder, plain and simple. The embryo (about eight weeks after the pregnancy starts it is called the fetus) is the baby, four months into the pregnancy there is a baby, six months into the pregnancy there is a baby, and nine months into the pregnancy there is a baby. All stages of the pregnancy, the baby exists. No human has the right to decide if another human should be born or not. It does not matter the circumstance, abortion is wrong. ----------- "You are the one who put me together inside my mother's body, and I praise you because of the wonderful way you created me. Everything you do is marvelous! Of this I have no doubt. Nothing about me is hidden from you! I was secretly woven together deep in the earth below, but with your own eyes you saw my body being formed. Even before I was born, you had written in your book everything I would do." - Psalm 139:13-16 - CEV";3;1;2;Pro-Life
1848;abortion;"its called adoption people!!!! why should you have the power to play god and decide whether that baby gets to live or die? the LEAST you can do is let the poor thing live and give it up for adoption for people who can't have children and want them!";3;1;2;Pro-Life
1881;abortion;"The fetus is a human. When an abortion happens, the baby is killed. The names embryo and fetus are used to describe the baby in different stages of the pregnancy.";3;1;2;Pro-Life
1881;abortion;"The earth is not overpopulated. There is a lot of room for more people to live. Abortion is murder, no matter the reason.";3;1;2;Pro-Life
902;abortion;"what we are dealing with is indirect murder if a women decides to abort a child she just had killed a life that may have been a big contribution to society";3;1;2;Pro-Life
1881;abortion;"Christians know that abortion is wrong because the God of the Bible says that murder is wrong. Abortion is killing an unborn baby, which is nothing else other than murder. People can come up with reasons why they or someone else needs to have an abortion, but nothing can take away the fact that abortion is murder. “Do not murder.” - Exodus 20:13 - CEV";3;1;2;Pro-Life
1881;abortion;"If someone killed a baby (that is already born) on purpose, that person goes to jail, but when someone kills an unborn baby via abortion, it is ok and justified. That is not right.";3;1;2;Pro-Life
902;abortion;"I understand where you coming from however I must disagree. A life is a life. If a woman abort a baby, that person just killed another being. Another idea, another, contributor to the human society that could have cured many diseases or even enlightened us. So yes, a person has a choice but should be charged with murder after doing so,";3;1;2;Pro-Life
833;abortion;"Ok lets take that out morals and religion who are you to tell someone that they cant live since were taking all the other factors out lets talk law cause you cant deny that now to my knowledge it may have changed in the past years you cant just wake up one morning and decide that your going to kill someone because you woke up on the wrong side of the bed its illegal even though the fetus is not fully developed its still a life form if they're laws protecting plants and bugs and rare animals its almost absolute that their should be laws making it illegal to kill a fetus its simple if you don't want to have a kid wear protection or don't have sex its called taking responsibility for your actions";3;1;2;Pro-Life
833;abortion;"what was the name i would like to read about that";3;1;2;Pro-Life
833;abortion;"what if i wanted to make a decision to blow up the world then what come on cant be that passive its one thing to make decisions that only effect you but when you start talking about effecting other people then thats a whole different ball game";3;1;2;Pro-Life
833;abortion;"what if i wanted to make a decision to blow up the world then what come on cant be that passive its one thing to make decisions that only effect you but when you start talking about effecting other people then thats a whole different ball game";3;1;2;Pro-Life
833;abortion;"how is it illegal if theres no consequence but thats beside the point go up and look at what mixendixon wrote and reply to that";3;1;2;Pro-Life
1834;abortion;"I choose life. Keeping the law pro-choice is allowing women to murder their own unborn human child.";3;1;2;Pro-Life
1485;abortion;"One thing we always tend to do when this topic comes up is putting the life of the woman above the child. I personally believe that the child's life is just as important as the woman, so when we are dealing with this topic, don't forget the importance of the life of the child. Everyone always begin to give specific examples of reasons for abortions, such as rape. Here are some statistics for you. Over 95% of abortions are because of birth control, such as not affording the child, getting in the way of their job, too young, want to wait, etc. Only 1% have an abortion because of rape, 1% because of fetal disabilities, and 3% because of mother's help problems. By giving the excuse of rape, we are allowing 95% of all the women to have an abortion just because they don't want the child. In my opinion, you make the decision of having a child at the bed. I understand it must be hard to bear a child after rape, which is still only 1% of all abortions. But don't punish the child for his/her father's crime. Personally, I think the hardest circumstances are when the women have health problems, which is still only 3% of all abortions. When this situation comes up, just keep in mind that the life of the woman and the child are both equally important.";3;1;2;Pro-Life
444;abortion;"Yes, but in the long term, both can benefit if the government proposes to adopt the child instead of aborting, thereby adding a future worker, and a future taxpayer, creating an investment for the social services that the government provides. And please, don't mention the probability that the kid will turn into a criminal, cause the probability that he would also turn into an individual seeking honest occupation is also high. Choosing to kill is not good because it overrides the right to life for the unborn child, and for me, the right to life weighs more than the freedom of choice in this case.";3;1;2;Pro-Life
444;abortion;"Yes but the government can limit what the woman can do with her unborn child. GO LIFE!!!!!";3;1;2;Pro-Life
1022;abortion;"A woman has no right to deny a life.";3;1;2;Pro-Life
1884;abortion;"I am Pro-Life, Here is a question for anyone who is Pro-Choice: Is the baby in the mother's stomach living and if not how do you know?";3;1;2;Pro-Life
1865;abortion;"True, the woman has the right to do with her own body as she pleases, but does she have the right to do what she wishes with another human beings body? The issue is not an issue of who chooses, but it is an issue of is the fetus a human.";3;1;2;Pro-Life
1865;abortion;"The main question that the whole debate is dependent upon is not that of who gets to choose, but what the unborn is. If the unborn is not human, than no evidence for the pro-life case is needed. If the unborn IS human, than no evidence for the pro-choice case is adequate. If the unborn isn't a human, than the pro-life movement has no ground to stand on, and the other way around. Now to answer that question, the unborn IS human. In order to prove this I will use two separate, but equally sufficient arguments. The Law of Biogenesis states that living things reproduce after their own kind, therefore human parents must reproduce human offspring. How would it be possible to have a nonhuman offspring from two human parents according to the Law of Biogenesis? The next argument begins with this question: Is a newborn a human? Some people like Peter Singer may say no, but the general population will say that a newborn is a human. From this we can say that there are only four differences between the newborn baby and the unborn fetus. These four differences are size, level of development, environment, and degree of dependency. Beginning with size, how does size determine the humanity of a fetus? Is a large person more human than a small person? Is Lebron James more human than Sarah Palin simply because he is larger? Next is level of development. A four year old girl doesn't have a functioning reproductive system, does that make her less human than an 18 year old woman? A 10 year old boy has a less developed brain, but that does not make him less human than a grown man. So how does the level of development matter to the determination of humanity? Next is environment. You change your environment nearly every minute. You are reading this on your computer now, tonight you will be in your bedroom, and tomorrow you will be at work. Does being at your computer make you less human than being at work? Environment is an invalid factor in deciding humanity as well. Last is degree of dependency. Many people are living on oxygen tanks, dialysis, food tubes, insulin, and inhalers. These do not make anybody less human, so it wouldn't be okay to kill them. The same applies to the fetus. The ability to be independent completely of anyone or anything is completely impossible, therefore nobody would be a human if we used this to decide.";3;1;2;Pro-Life
1865;abortion;"The argument is not about choice, sir. It is about the humanity of the unborn. The unborn is a human, therefore it IS wrong to kill it.";3;1;2;Pro-Life
1865;abortion;"First, does the government have to recognize it for it to be true? The government didn't recognize blacks as being people or women having rights. The government is not always right, but they adjust. If i claimed a black person isn't a person, but property several people would be offended and my argument of our early government saw it that way would hold no water. Next, just because the federal government doesn't penalize murder, does that make abortion right? And a human is a fetus, for evidence look at my longer argument or if you would like i will gladly retype it.";3;1;2;Pro-Life
1841;abortion;"If a teen is "prepared" enough to have sex, than they should be able to comprehend that having sex comes a child, if you're not prepared for a child don't have unprotected sex.";3;1;2;Pro-Life
305;abortion;"You can't ban a procedure any more than you can ban prostitution. It has been around for centuries, and it will continue. All we can really accomplish here is making it safer for the mother. Back alley abortions with a wire hanger and a can of Lysol is not policy, but it has been and will be again if we completely ban it. The rich have another way to abort. They have the same procedure done as a woman with a miscarriage. That way, the family gets sympathy instead of cold shoulders. This is still abortion (unless it really is a miscarriage, of course), and you won't see Jerry Falwell banning that. Probably used it a few times himself. I would not want my wife or daughter to have an abortion, and I don't think it should be used as a primary form of birth control, but if you ban it, you say that a 13 year old who gets raped by her dad MUST have the child. Family values does not include having daddy's baby. Let's not get into the argument of "abortion sometimes". You can't have guidelines that can be changed over time. You have to keep medical procedures available to all. We need to educate about sex and birth control, promote adoption, and keep the abortion option open.";3;0;2;Yes
305;abortion;"Good points. The problem is the terminology used here. Ban is a powerful word in a legal sense. I bring up the young girl not to be a sicko but to point out that when you outlaw the procedure for arguable moral reasons (reasons you and I share in some cases, as I mentioned before), you outlaw it for everyone in all cases. You and I may come to the same conclusion if one of our loved ones was faced with this problem, but I don't feel I have the power to tell my neighbor what to do. Some moral views are personal and should remain that way. I will not argue the point that I would not want my wife or daughter to get one. I think adoption is a wonderful thing, and so is keeping the baby you created and living with your responsibility. But I shudder to think of the admittedly small minority of women who are pregnant through rape or incest. Could you look a young girl in the eye and tell her that the baby inside her is a gift from god when her priest raped her in the first place? Extreme examples, I know. But extreme measures such as a total ban require extreme arguments.";3;0;2;Yes
2263;abortion;"A fetus is part of the mother. Kind of an extension of the womans body. It is attached by a chord, and it is inside her. it is part of the mother a mother who wants to kill part of her own body is not the same as killing a seperate person.";3;0;2;Yes
375;abortion;"A child will also call a tadpole a fish and a platipus a bird. What a child would call something is irrelevant. And in all fairness there is a difference. Your neighbor is free to tell his wife to leave. The woman is not free to eject the fetus without killing it. The woman is effectively being forced to provide rent-free lodgings to this "baby" for 9 months, plus the hormones, morning sickeness, cravings, and bloating. I'm sure if we could take out the fetus and put it into a mechanical womb or something women would choose that rather than killing it- but that is unfortunatly not an option.";3;0;2;Yes
2339;abortion;"From the religious point of view, conception makes a person. From a scientific view, it's not a person, a separate life, until at the very earliest around 7/8 months.";3;0;2;Yes
2341;abortion;"I find it so interesting that men or a man can feel so passionate about something that essentially has nothing to do with them. A man will never know what it is like to carry a baby, and he never will. How can he have any opinions over the going ons of a woman's body? With that said, here is how I feel about abortion. I feel it should not be used as a primary source of birth control. However, if it is (which I doubt severely), who are we to stop it? If a woman is irresponsible enough to continually get pregnant, do we really want this kind of woman raising children? Think about it. If a woman, any woman, has decided that she does not want or cannot care for a child, she is probably making the best decision for all involved. Why do you think there are so many people in the American criminal justice system? Many of these people probably should have been aborted. I know that sounds so cold and so cruel, but what good have they been to society? They've stolen, murdered, battered, defrauded, and so much more. I ask you, what is sadder, a lifetime spent behind bars or a life that was ended before it even began? And even more so, if they get the death penalty, aren't we ultimately performing an abortion, just many years later? We are aborting a member from society. I would be so bold as to say that if you are pro-life you are anti-death penalty. My point is, many women abort because they know in their hearts that they cannot care for a child, and cannot bear the thought of a child growing up in adoption agencies. Some may argue, "well, she shouldn't have gotten pregnant in the first place." Well she did, and unfortunately with pregnancy, once the ball has started rolling, that baby is coming unless something is done to stop it. I'm not heartless. I want children one day. And thankfully, I've never had to make the difficult decision of having an abortion. But if I ever were to be placed in that situation, I can't say what I'd do, but I'd certainly want the option there.";3;0;2;Yes
2341;abortion;"Unfortunately, this is one of those double standards that everybody hates so much. Sure, you've lent us your seed, but we are the carriers. We have more rights because of this. Your body is not stretched to unrecognizable proportions. You do not experience morning sickness. You do not risk your very life to bring a child forth into the world. Your life is not necessarily changed forever if you don't want it to be, but ours is. It is a double standard, I acknowledge that, but it is what it is. A man cannot and never will dictate what happens to me or my body. This is nothing more than men trying to control yet another aspect of the world. You all just need to accept that this is a woman's right, because ultimately it is a woman's burden. And speaking of burdens, what say you about all these children, these fetuses that are being "saved," that are being born to unwed teenage mothers? To crackheads? To the unfit and the unworthy? What say you about these babies? Where exactly do you think they are going to end up? Statistics are very grim for these children. It amazes me that everyone is all "save the kids!" "It's murder!" "Save the babies!" But as soon as the kid is born, nobody wants to help out, and then the same people who screamed "pro-life" are the same ones calling for welfare reform. Lol!";3;0;2;Yes
2341;abortion;"I notice how you never seem to argue any of my main ideas. So I'll end this little debate with this: You (a man) cannot control what a woman does with, to, or for her body. You never will control what a woman does with, to, or for her body. This issue has a built-in double standard that is simply a fact of life. Deal with it. To avoid this altogether, wear a condom and use birth control!! LOL";3;0;2;Yes
2340;abortion;"Leaving aside the arguments that have been tossed around already regarding whether or not a foetus is human, murder or termination, etc..., I'll just say this. All arguments against abortion rely on killing being wrong. Killing isn't always wrong. Therefore, these arguments don't stand.";3;0;2;Yes
