author_id,topic,text,topic_id,discussion_stance_id,discussion_stance
“If you are pregnant, you have options. If you are trying to decide if abortion is the right choice for you, you probably have many things to think about. Learning the facts about abortion may help you in making your decision. You may also want to learn more about parenting and adoption. Only you can decide what is best for you.”
So you have three links, options, parenting, adoption, think that is the best summary of my side of the debate as possible. Only YOU can decide what is best… not a POLITICIAN.",3,0,Pro-Choice
164,abortion,"nice rebuttal LOL!",3,0,Pro-Choice
164,abortion,"I believe you answered nothing again, further digging your grave of avoidence and failure in debate!LOL!!
This isn't a slogan site, you need more than bumper sticker comments!
How about debating lol!",3,0,Pro-Choice
164,abortion,"here is some commons sense for you to try and grasp, yet again lol!!!
As much as pro lifers would like to make choice about fetus personhood they ignore the realities of womanhood. They ignore the fact that it takes 2 to tango, but one to suffer the consequences. They belittle the consequences and say things like “give it up for adoption” without considering the realities of things like job loss and education that are not inconvenient, but ruining in the long term. One of the most important factors in women's advancement in society has been their ability to control their fertility. More than any law, the ability for a woman to chose when to become pregnant has led to higher rates of education and employment success.
Let me make this clear… when the Founding Fathers lived…. Abortion was LEGAL.
Abortion did not become illegal until 1857. Before then midwives distributed herbs and root mixtures to cause abortion, then called “quickening”. The group? The AMA! A large part of this push for criminalization was an attempt to push midwives out of the market in order to open up more patients for doctors. The bases of their argument was not moral, but instead nativist. Look up Dr. Horatio R. Storer, the leader of the criminalization movement. He was a bigot who believed whites needed to outbreed natives, and he also included midwifery with native “uncivilization”.
The AMA did not just fight for criminalization, but also abortion under special circumstances, thus, giving the male physician total control over who may have abortions, forcing midwives out of business and establishing a medical patriarchy. This continued through the 20th century with the institutionalization of health care which did nothing to stop abortion, but drove it underground.
Through the 1950s and 1960s abortions became more difficult, more dangerous, and more expensive to obtain. This led to reform legislation long before Roe v. Wade. By 1967 12 states had already passed legislation. The battle for most of US history was not a moral one, but one of womens place in society, patient rights, and civil liberties.
Some argue the cycle of child birth and rearing is a consequence for actions, personal responsibility bla bla bla, in other words I know enough to force my opinion on a decision I have not had to make, and for the guys, never will. When we say “consequences” we mean consequence, singular, for the woman, doubled in guilt through blame of questioning morality to be in the situation to begin with.
In the words of Supreme Court justices O'Connor, Kennedy and Souter: "At the heart of liberty is the right to define one's own concept of existence, of meaning, of the universe, and of the mystery of human life."
This is seen as immoral in our society by some, yet Viagra commercials are acceptable.
We can debate about teaching abstinence in school, yet have no problem with erectile dysfunction drug companies handing out pens to our doctors.
The best way to prevent unwanted pregnancy is through sexual education and ready access to contraceptives, two things many pro-life people are against.
Even in a perfect society where we are educated, have ready access to contraceptives, unique and individual cases arise that must be looked at with an objective and clear eye each and every time.
One thing is for sure, criminalization kills and does not prevent abortion.
43% of the worlds abortions are done illegally.
Pro life people often demonize those who simply look at reality, the consequences from the past, and the idea that such a decision is for the individual not the state to make. They talk about baby killers, social engineering, insane conspiracy theories etc.
I think –Planned Parenthood- says it best on their website,
“If you are pregnant, you have options. If you are trying to decide if abortion is the right choice for you, you probably have many things to think about. Learning the facts about abortion may help you in making your decision. You may also want to learn more about parenting and adoption. Only you can decide what is best for you.”
So you have three links, options, parenting, adoption, think that is the best summary of my side of the debate as possible. Only YOU can decide what is best… not a POLITICIAN.",3,0,Pro-Choice
164,abortion,"I'm sorry, your bumper sticker is blocking your rebuttal, lets try again....
As much as pro lifers would like to make choice about fetus personhood they ignore the realities of womanhood. They ignore the fact that it takes 2 to tango, but one to suffer the consequences. They belittle the consequences and say things like “give it up for adoption” without considering the realities of things like job loss and education that are not inconvenient, but ruining in the long term. One of the most important factors in women's advancement in society has been their ability to control their fertility. More than any law, the ability for a woman to chose when to become pregnant has led to higher rates of education and employment success.
Let me make this clear… when the Founding Fathers lived…. Abortion was LEGAL.
Abortion did not become illegal until 1857. Before then midwives distributed herbs and root mixtures to cause abortion, then called “quickening”. The group? The AMA! A large part of this push for criminalization was an attempt to push midwives out of the market in order to open up more patients for doctors. The bases of their argument was not moral, but instead nativist. Look up Dr. Horatio R. Storer, the leader of the criminalization movement. He was a bigot who believed whites needed to outbreed natives, and he also included midwifery with native “uncivilization”.
The AMA did not just fight for criminalization, but also abortion under special circumstances, thus, giving the male physician total control over who may have abortions, forcing midwives out of business and establishing a medical patriarchy. This continued through the 20th century with the institutionalization of health care which did nothing to stop abortion, but drove it underground.
Through the 1950s and 1960s abortions became more difficult, more dangerous, and more expensive to obtain. This led to reform legislation long before Roe v. Wade. By 1967 12 states had already passed legislation. The battle for most of US history was not a moral one, but one of womens place in society, patient rights, and civil liberties.
Some argue the cycle of child birth and rearing is a consequence for actions, personal responsibility bla bla bla, in other words I know enough to force my opinion on a decision I have not had to make, and for the guys, never will. When we say “consequences” we mean consequence, singular, for the woman, doubled in guilt through blame of questioning morality to be in the situation to begin with.
In the words of Supreme Court justices O'Connor, Kennedy and Souter: "At the heart of liberty is the right to define one's own concept of existence, of meaning, of the universe, and of the mystery of human life."
This is seen as immoral in our society by some, yet Viagra commercials are acceptable.
We can debate about teaching abstinence in school, yet have no problem with erectile dysfunction drug companies handing out pens to our doctors.
The best way to prevent unwanted pregnancy is through sexual education and ready access to contraceptives, two things many pro-life people are against.
Even in a perfect society where we are educated, have ready access to contraceptives, unique and individual cases arise that must be looked at with an objective and clear eye each and every time.
One thing is for sure, criminalization kills and does not prevent abortion.
43% of the worlds abortions are done illegally.
Pro life people often demonize those who simply look at reality, the consequences from the past, and the idea that such a decision is for the individual not the state to make. They talk about baby killers, social engineering, insane conspiracy theories etc.
I think –Planned Parenthood- says it best on their website,
“If you are pregnant, you have options. If you are trying to decide if abortion is the right choice for you, you probably have many things to think about. Learning the facts about abortion may help you in making your decision. You may also want to learn more about parenting and adoption. Only you can decide what is best for you.”
So you have three links, options, parenting, adoption, think that is the best summary of my side of the debate as possible. Only YOU can decide what is best… not a POLITICIAN.",3,0,Pro-Choice
912,abortion,"Look at it logically.
If your Pro choice you don’t have to do it yourself, and for those who do it is a relatively safe process for the mother.
If your “pro life” and want it to be illegal its still going to happen, Conditions are going to be much worse and the women will be at huge risk. Ultimately there will be deaths of both women and fetus... Being Pro life seems somewhat hypocritical.. Its should really just be “Anti-abortion”
At two months the fetus is the size of a kidney bean. Theres no evidence to indicate that its self conscious. I’m Pro-choice. If my girlfriend got pregnant I couldn’t tell her what to do as its her body and her choice. I would say that I would be with her and help her, support her through whatever decision she made but its her choice, not ours.",3,0,Pro-Choice
164,abortion,"no, if you are for criminalization you are literally killing the lay down the street, no poetry or metaphors necessary. Beautiful ending, seeing how communists got to Berlin before capitalists in WWII! LOL!!!!",3,0,Pro-Choice
3853,abortion,"I assume your against the death penalty then. You also must be against the wars in Iraq and Afghanistan. Yes?",3,0,"i am for abortions"
4829,abortion,"Well, when a fetus is developing in a mother's womb, the fetus is completely dependent upon the mother. In essence, the mother is choosing to give the fetus a life. The fetus isn't granted a life, otherwise it would be independently born. As such, since the fetus uses the mother's body to sustain itself, the mother should have the choice of whether or not she wants to allow something to use her body's resources. I know it contradicts the idea of fate, but sometimes reality is harsh. It sounds terrible to say that the mother is "taking an innocent life" but life is only what we know since birth, so she really isn't taking a life at all.",3,0,"i am for abortions"
450,abortion,"it is the sole decision of the pregnant female, depending on the situation-with input from the impregnator",3,0,"i am for abortions"
3853,abortion,"@ jonjax Thank you for mentioning the mans input, nobody seems to care about that...thinking about organizing some sort of rally",3,0,"i am for abortions"
4045,abortion,"I have never met a so-called pro-lifer who recognizes that criminalizing abortion only makes matters worse. Consider the following evidence:
1) There is very little, if any, relationship between abortion legality and abortion incidence;
2) Unsafe abortions kill thousands upon thousands of women each year with millions suffering complications; and
3) In industrialized countries with legal abortion, death from unsafe abortions has been virtually eliminated and complications are very rare.
So the only common denominator is whether or not women will needlessly die and suffer. Therefore, being anti-choice logically means either one of two things:
1) You do not think critically and/or are ignorant; or
2) You want women to die and suffer or do not care if they do.",3,0,"i am for abortions"
4045,abortion,"How is a soul created when a sperm and egg meet?
It is just genetic information combining in a cell. Most sperm and eggs will never combine.
When you shed blood, those cells could be cloned. Is that a lost soul?
You are writing about a blob of tissue and it is all relative. Are you a vegan? If you eat fish or cow you are eating something more advanced than a human embryo.
For most of pre-natal development the hypothalamus has no connection with the nervous system. No pain can be felt. And there is certainly no psychologically developed sense of self.",3,0,"i am for abortions"
4045,abortion,"Innocent people are killed on death row.",3,0,"i am for abortions"
4826,abortion,"I do not think an abortion is wrong because when the fetus is in the mothers stomach it has no conscience, it is not an innocent life intel it is born, it is like a sperm. And what if the mother can't afford the child, is living life in on the streets with no education your whole life a good thing.",3,0,"i am for abortions"
4045,abortion,"Almost seven billion homo sapien sapiens exist. An infinite number are unborn. Punishment is inflicting a penalty or sanction on someone. You assume an undeveloped fetus is someone. Why? It is a potential someone. But so are the infinite unborn. Neither feel or think. How is it not “punishment” for the infinite potentials that will never be. Do they not have the right to exist too? Accordingly, we must waste no sperm or egg and make every possible potential real. Be fruitful and multiply with the aid of science. 99.999% of sex cells must unite. (And what of animals that could evolve like us?)
Prokaryotic and eukaryotic organisms are innocent and alive. Cut no trees. Harvest ye not. Then we will return to take our place among the unborn.",3,0,"i am for abortions"
3130,abortion,"Shoot. I accidentally deleted my reply, and I'm too laz--er, busy to retype it.
Basically I just said: Scientists recently discovered a sort of "consciousness" in comatose hospital patients who were thought to be way past that. You should google that and read up, developing brain =/= damaged brain, but it illustrates the danger of defining life in a realm of unknowns, and it could help your argument.
---
On a side note, can I just point out how terribly this debate topic was phrased? It implies that A) Being pro-choice means you like abortion and B) that its impossible to feel even a little ambivalent on the issue. Jeesh.",3,0,"i am for abortions"
2,abortion,"Well the guy's still got a point about the Iraq and Afghanistan wars. Innocents die all the time there, and in the case of Iraq, the country was invaded on a false pretense.",3,0,"i am for abortions"
2,abortion,"Way to respond to the argument. Typically, when people play the "fallacy card", it means they either that the argument is completely useless due to fallacies, or that the responder is too lazy.
I don't think the argument was great, but it wasn't the mess you make it out to be.
S/he has a point about the legalization of abortions and its affect on mortality rates. People don't stop doing things just because they are illegal. Look at prohibition; people didn't stop drinking, they just drank moonshine, and a lot of them died from it. If abortions aren't legal, and trained doctors aren't allowed to perform them, women may go elsewhere, and die as a result.",3,0,"i am for abortions"
2,abortion,"Your definition of "life=heartbeat" is medically obsolete. Doctors no longer use cessation of hearbeat to determine time of death (this is due to the not so recent advent of CPR and the defibrillator). Also, someone is not defined as dead if they cannot circulate their blood on their own. Their are now machines that can do these jobs for patients in the short-term. The most accepted way of "diagnosing" death, is "brain stem death". If this occurs, there cannot be any higher functioning in the patient, nor do they have any chance of regulating their body's essential functions (temperature regulation, breathing, heart rate, etc.).
Of course, there have been cases of patients that recover from what is considered brain death. All this means, however, is that brain death is also open for debate. The fact still remains, however, that a flatline does not mean that the patient is dead (hence the development of the term 'cardiac arrest').",3,0,"i am for abortions"
4045,abortion,"My generalizations were based on facts revealed by research. They were not based on the assertion that they are true because not proven false (like the God argument). They do not simply appeal to emotion. Etc. Your grocery list of criticisms do not dent my Vulcan logic.
There aren't fallacies. Question the factual assertions. Okay. Criticize vagueness. Fine. That's step one. But assuming the facts are true, the conclusion is logical. Wait! Perhaps I am ignoring another "solution" to the abortion "problem" and am wrong to point out that abortion happens whether it is legal or not, and if it is illegal it also harms more pregnant women, not just the "baby." (Then you either don't know, don't care, or want to punish these women. Am I missing any others?) Maybe we could criminalize abortion and reduce its incidence. Simple, just lock up every known pregnant woman and monitor her. Then she won't have an illegal abortion. Ah snap! Guess I wasn't logical. How logical is that for you?
You have a point about providing sources. I didn't know you were expecting me to be Mr. Academic. You can also do your own investigation. My impression is that you are rejecting first, asking later, if at all. Here's a well referenced source for ya: http://www.guttmacher.org/pubs/fb_IAW.html. And from the same site: http://www.guttmacher.org/pubs/gpr/12/4/gpr120402.html. You want more? I'm not putting all my beans in one basket. Don't assume that's all I got. Those two articles should be of interest to you and are a start. Yes, they're from the same website because they're good. They're for you. I don't need to prove to you that I didn't make up the information or give you an extensive bibliography of what I considered in making my argument.
I guess I wasn't completely accurate because abortion incidence is less in countries where it is safe and legal. So it may not be just "little or no correlation." Safe and legal paradoxically appears better for the anti-abortion front. I'm playing with your "logic." I can be more nuanced and consider the weight of improved access to birth control as a factor.",3,0,"i am for abortions"
4045,abortion,"Now here is a lack of logic: "All life on Earth was created, and...it is wrong to deprive an unborn child of its God given right to live." You are assuming two things: 1) All life on Earth was created; and 2) God exists. These are mere assertions without empirical basis.
Let's assume God did create all life on Earth and ignore evolution for now. You also say this means only God "should" take life away. Well, God does. God is the ultimate abortionist. Miscarriages (or natural abortions) are far greater than intentional abortions. If we do not have the right, why should God? Since the baby is innocent, God is a jerk. More precisely, God is a murderer.
Your "human centered" view leaves out the other life God "created." Let's look at biology. If you eat animals you are often eating something more advanced than a human fetus. You are then a worse murderer. Tell me how it's not all relative. "Well, animals no souls, we yes souls." We are animals! (We're all innocent as animals.)
If God decided to miscarry my earlier form for no particular ascertainable reason, I would also not "be here." That (God abortion) was more likely than a people abortion.
Why would I fear nonexistence? If I do not exist I can not fear. The number of people who could exist and do not is infinite. What about those not living right now or in the future? This is suspended potential existence, not different from you or I. You want me to think about my 1/infinity shot at existence.
You've got nothing. The whole "what if you were aborted question" has no meaning. We are a part of the physical world and the rest is illusion, albeit an amazing one. The same underlying fundamental forces in the Universe apply to us and everything around us.
(Our taxes won't be funding Planned Parenthood anymore.)",3,0,"i am for abortions"
4894,abortion,"Abortion should be accepted mainly because it's the woman's right about what she wants with her life and whether she actually wants a child. Cases such as teen pregnancy and rape are good examples of why abortion should be allowed. Who wants to live with a child of a rapist or provide a child with hardship? Who wants to give up their life because of a teen pregnancy?
Furthermore, children need good environments to grow up in (Nature vs Nurture) to aid development both mentally and physically.",3,0,Yes
2,abortion,"What about rape cases? What about the lack of education regarding safe sex and proper birth control in US schools (I'm looking in your direction 'abstinence-only birth control education')? What about when the life of the child endangers the life of the mother?",3,0,Yes
2,abortion,"Early on in the gestation, the "baby" is nothing more than a clump of non-sentient cells. This cluster does not deserve the same rights as a person, especially seeing as there is a very real chance of miscarriage anyway. I already raised points in my post above, but you know what might also cause a woman great emotional stress? Unwanted pregnancy. Imagine a woman who is in med school, has sex, and gets pregnant despite taking every available precaution. What is she supposed to do? Quit school and work to save money to afford the baby? Get real.
Abortions are performed all the time, and are incredibly safe. The rates of mothers that die due to complications either during pregnancy or during labour are much higher.
As for the child's happiness, how would you feel being born to a mother whose life you had ruined? Not everyone wants to or is capable of being a parent, and if you're not up to the task, the child will only suffer.",3,0,Yes
4894,abortion,"Yes I agree with you there.
I don't feel its right that a woman should get an abortion before the baby is due. I consider that to be unethical because by then the baby is already fully developed.
I do feel though (I'm not saying its ethical) that a woman can abort a baby before the third month. At the moment I'm drawn to both sides because a woman can have the baby and then give it up for adoption if she doesn't want a child or for any other reason. Yet again there could be a case where she doesn't or can't have a baby for certain reasons.",3,0,Yes
2,abortion,"I brought up the issue of rape cases in response to ramonaskinner and that other person (3rd post on left side) who claimed that abortion should be illegal flat-out, making no exceptions for extenuating circumstances. For you, just ignore that.
I see a clump of cells as of lesser importance for 2 reasons: 1. it is not yet sentient (the mother is) and 2. it's survival until birth is not certain. Also, the law does not currently recognize a fetus as a legal person.
1. I am not aware of the statistics relating to health concerns and late-term abortions. Certain governments regulate late-term abortions, so I don't think that we should necessarily take up space arguing this right now.
2. This is true, there is no fail-safe birth control.
3. I see this as a reason that abortions should be legal, and more widely accepted. If abortions were more readily available, and therefore controlled, governments would be more able to regulate the procedure and ensure that the doctors performing the operation are competent. Illegal abortions would not stop people from seeking to abort. This would create a similar situation to that during prohibition. People who wanted alcohol, bought moonshine. This resulted in far greater poisonings than with regular alcohol. If doctors cannot perform abortions in regulated settings, people will seek back alley abortions from "doctors".
4. This argument is based on the assumption that the child will survive and also on the belief that life is in itself a positive. Philosophers are divided on the claim that "life itself" is an inherent 'good'. Also, I was not saying that these potential mothers are not competent, I was merely saying that perhaps their current circumstance prevented them from being proper parents (i.e. being 16, being in school, being too underemployed to provide for themselves and a child). This will not stop them from being excellent parents later in life.
5. I totally agree on this point. Also I think this is how schools that teach birth control methods currently do things (I was taught this way when I was in high school).",3,0,Yes
