author_id,topic,text,topic_id,discussion_stance_id,discussion_stance
1788,abortion,"The government has no place to tell a woman what she can do with her own body, ever.",3,0,Pro-Choice
517,abortion,"If a woman is raped and left with the bastard child of the man who raped her and severely emotionally traumatized her, she should have the decision to give up that baby. Certain circumstances call for desperate decisions and this is one, the choice should be her's to make and she should be allowed to make it.",3,0,Pro-Choice
21,abortion,"It really depends the situation; if a girl/woman gets raped, it's not fair that she has to keep the child. If a young teen has unprotected sex and ends up with a child, that's her fault for not being prepared.",3,0,Pro-Choice
101,abortion,"I support pro choice if nothing else because it is one of the last bastions that free people hold out against the government for.",3,0,Pro-Choice
168,abortion,"I am personally against the abortion, but I believe in the right of choice. What matters to a pregnant mother what I think or what most of the people thinks about it. She must decide what to do with her child.",3,0,Pro-Choice
672,abortion,"Here's an interesting thought for those of you who believe "life" begins at conception rather than birth... America grants citizenship to people "born" in the United States, but not to those conceived here.
Perhaps if you truly believe life begins at conception and that is a full person with rights to life, then we should also grant citizenship to that person, no?",3,0,Pro-Choice
1068,abortion,""Fair all-around?" Are you kidding? What could possibly be "fair" about YOU deciding when it is time for ME to have a child?
There are ways not to get pregnant; there are also exceptions to every rule.
If there are women out there using abortions as birth control, I am appalled, but the fact remains that there are plenty of cases in which thoughtful, moral, and careful women choose to terminate pregnancies. And that is between them and their consciences, not between you and them.
People don't always do the smart thing or the right thing the first time around, but that doesn't mean that they should be barred from correcting their mistakes--forcing them to become parents instead is flat-out backwards.",3,0,Pro-Choice
1729,abortion,"It's not a question of what YOU choose, it's a question of "who decides"?
A woman is not your property. Nor is she the property of your church, the state, or any fetus. You have no right to command her servitude.",3,0,Pro-Choice
1820,abortion,"people can make the choice for themselves. it is not up to us or the government to decide to add more unwanted children to this world.",3,0,Pro-Choice
1796,abortion,"Surely if we are worried about the feelings of unborn children within the first few months of pregnancy, than we should first be worried about protecting the rights of far more conscious animals, such as fully-developed primates.
If its isn't their feelings we are worried about, then I guess I am very confused about the pro-life point of view.",3,0,Pro-Choice
1796,abortion,"The fact that many women DO get pregnant despite their other wishes, and in situations other than rape, surely contradicts this argument.",3,0,Pro-Choice
270,abortion,"Those of you who believe that abortion should be outlawed, consider this - In the 70's(I believe, don't hold me to the date), there were thousands of women that got pregnant each year in the US that decided to have an abortion. Since abortion was not legal at this time, many women would go to an illegal clinic where the doctors were untrained. This lead to many women dying from the injection that was meant only to kill the baby. If these women did not choose to have an abortion through one of these illegal clinics, or even sometimes if they did, they would pierce themselves with a wire coat hanger or other things to that effect to kill the baby. Many times this lead to infection and as these women were afraid to tell anyone what they did, they often died instead of getting medical attention. Therefore, in conclusion, many women lost their lives over abortions and, with abortion legal, many lives have been saved. Therefore, the weight of death would (in theory) equal the weight of life. If abortion were outlawed, it would only increase the death and crime rates as illegal clinics were reestablished and pregnant women would become infected from puncture wounds and die.",3,0,Pro-Choice
70,abortion,"your argument doesn't hold validity since in the cases you sited, the mental stability and ability to reason are completely compromised. The state intervenes in the cases in instances of mental illness.
You will need to find a better answer. Sorry. Try again.",3,0,Pro-Choice
586,abortion,"The rape scenario actually occurs a lot. About 33% of women in this country have some encounter of being sexually assaulted before the age of 18. Being assaulted once raises the chances you'll get assaulted again later. Assault meaning any form of sexual violence against a woman, not necessarily including sex. So it does occur. The same people, though, that are pro-like are usually against contraceptive drugs. Walmart, for example, didn't (until recently) hand out the abortion pill...so how are women to get their hands on these vital drugs? Abortion pill is also not really technically correct as it doesn't cause abortion just prevents conception. There are quite a few circumstances in which women find themselves in a Christian based hospital after being raped, but they refuse to hand out these emergency measures.
Secondly, its no one else's business!! If you think someone is sinning...its not up to you to judge them. If they really are, God will judge them when their time comes. No one else can do that. We can't presume to know what God thinks of our actions and if we're going to heaven or hell. The Bible, the Torah, the Quran...these are historical books. I believe in the Quran, but you do have to look at it as a historical record of events as well. None of these books should be taken strictly as they are written. They have ALL been edited to suit the audience at the time. For example, some guy in the 12th century, I think, didn't like the version of the angry God as he was being depicted at the time and cut all that stuff out. That is how Christianity comes up with the notion of a loving, merciful, giving God. Editing!
We can make our own decisions and no government body or religious group should determine what to do with our health. Besides, the world has far too many children growing up with mean nasty parents that are resentful they were ever born. You think that child has a great life? They never even had a chance.",3,0,Pro-Choice
1729,abortion,""if one holds firm to a belief that life begins at conception"
...then one holds firm to a belief in the impossible. Of the two normal definitions of 'life' one does not start at conception (sperm and ova are also alive) and the other cannot start at conception (one conception may result in monozygotic twins or no baby at all, two conceptions may fuse to form a human chimera).
"any act which eliminates said life is by definition murderous "
This is also false. Even if one subscribes to the insane belief that something the size of a grain of salt is the moral equivalent of a walking, talking child then there is such a thing as killing in self-defence. Pregnancy and childbirth is extremely dangerous and abortion is about 10 times less likely to result result in the death of the woman.
If you did to a woman what pregnancy and childbirth does then you would be looking at jail time. If she had to blow you away in order to stop you, then she wouldn't.",3,0,Pro-Choice
672,abortion,"Uh, no. I'm not suggesting that in the slightest. I'm merely pointing out that if we, as a society, decide that life begins at conception then to stay consistent with that law (which is what the pro-life movement wants) we'll also have to accept granting citizenship in that fashion. I was posing something to think about, not suggesting anything.",3,0,Pro-Choice
672,abortion,"Suicide is not illegal. Attempted suicide is only a crime in 6 states. Most laws require psychiatric evaluation and counseling if someone attempts suicide, but there's no criminal punishment for it on the whole. The laws regarding mental institutions are much different than what you imply. It requires consent from 2 immediate family members and a doctor to have someone committed. And even then, you are granted evaluations on a regular basis that allow you the valid chance to be let out.
So no, there's no other time when the government tells us what we can or can't do with our bodies.",3,0,Pro-Choice
672,abortion,"Reagan also said, "I don't believe in a government that protects us from ourselves."",3,0,Pro-Choice
1850,abortion,"The worst thing a person could ever do to a child, is to bring them up in a family that never wanted them. For a child to have to grow with his parents always regarding him with even the smallest bit of ire for having been forced to birth him - I can imagine no greater hell. For a mind to evolve and come into conciousness instantly damned by the title "mistake"; why do we want to subject people to this?
Leave parenting to the responsible and the capable. Give the people who couldn't afford to give a child a good home or the love they need to devop properly a chance to better themselves first. Some people will never want children, but everyone deserves the right to have the time to make their lives habitable for a child.
Some people make mistakes. Other people try to be responsible but something goes wrong. Regardless, it is not the parent you are punishing by forcing them to have a child - never so much as you are punishing the child.
And if someone wants an abortion, they will get one. Hundreds of thousands of years of human exsistence and we still haven't learned that if we really want something, we get it. We can't stop abortions by outlawing them, so lets at least give these wayward humans a safe and clean place to go to.",3,0,Pro-Choice
586,abortion,"Why should the woman be punished with 9 months of physiological, mental, and physical/anatomical changes? I haven't had a child yet, but for many women, pregnancies are not a walk in the park and there is some risk to the health of both mother and child.",3,0,Pro-Choice
478,abortion,"the child does not have an rights. According to the U.S. Constitution under Amendment 9 (I think), the rights are given whe you are a U.S. citizen. A fetus inside the womb does not have an rights because he/she has not been born into U.S. territory yet.",3,0,Pro-Choice
81,abortion,"Pro-Choice means keeping the Government out of this debate and leaving the decision between a woman and her God. Pro-life means the Government deciding for a woman based on one view of religion.",3,0,Pro-Choice
81,abortion,"Yeah, try to enforce that! It is actually not illegal to commit suicide everywhere (ever been to Oregon?).
Being pro-choice and keeping abortion legal leaves the decision with the woman and her God instead of with the government. The government has enough power without forcing the views of one religion on others.",3,0,Pro-Choice
81,abortion,"Actually that "contraceptive drug" only works if conception has already occurred, so it is considered a form of abortion by most pro-life folks.",3,0,Pro-Choice
255,abortion,"Using your example of "destroying a farmer's stock of seed is ridding him of the final product he sells and robbing him of his livelihood":
Is a fetus not the product of a man and woman? If that farmer decides to rid HIS OWN APPLE SEED, then what business is it of ours what he does with his own...apples? Maybe he has decided that he doesn't have the right farming skills to nurture these apple seeds into full grown apples? I'd rather him realize that before he messed up some perfectly good apples. It is a mature decision to leave raising apples to people who are better apple farmers.
On to a more literal point...There are already so many unwanted children filling up orphanages (where they are often mistreated). Why should we bring even more unwanted children into the world? Also, do we really want people who don't want children to be responsible for taking care of them? Scary!",3,0,Pro-Choice
826,abortion,"I am always interested in the beliefs of someone who makes the glib comment of "I choose life". Ok, so what are your parameters? First you need to define life, then define what it means to choose it.
Are we saying that you believe that all life is sacred and nothing should ever be done to cease life? If so, are you a vegetarian? Certainly killing an animal is taking life. Of course so is picking a head of lettuce, so I would guess that even eating veggies is taking life. At the extreme end, bacteria are life forms too, so antibiotics are pretty bad, as is antibac cleaner.
Of course no one actually means that they believe that ALL life is sacred and needs special protection. That was just to illustrate the need to define the problem. So, perhaps the more accurate statement would be, I think all HUMAN life is sacred and should be protected. Tough call to make...doesn't that necessitate that anyone who is pro life is also staunchly anti-war?...as it supports killing.
So, that causes something of a disconnect for those who think that war can even SOMETIMES be justified, if they think abortion should never be. What about those who really are pacifists...they have a better leg to stand on at least.
We still have to define though, when human life begins. What data do you have to back up that the split second between a sperm and an egg existing separately, for a very short period of time, is ok to not preserve and the fertilized egg suddenly becoming mandated to preserve? Guys probably "kill" a lot of sperm over their lives, women "kill" an egg every time they do not make an effort to fertilize it....sperm and egg are both cells. What separates those single cells from the single cell created by their union?
Some are opposed to abortion beyond a certain point. This becomes a much more defensible position, though still a little tough. It is hard to handle the thought of terminating the life of something that looks very close to being human, moreso if that organism has developed to the point where it can actually feel pain.
So, I ask again...when "I choose life"...what do you choose?",3,0,Pro-Choice
1868,abortion,"Hitler's mother wanted to have him aborted. Needless to say they should have let her.",3,0,Pro-Choice
450,abortion,"A women and she alone is the one who should determine if she wants an abortion or not, at any stage of her pregnancy. Why is that it is mostly older white men who are attempting to establish anti-abortion laws for women? Why is it that most anit-abortionists are pro-death penalty?
Jon Jax 71",3,0,Pro-Choice
666,abortion,"So then you're saying the if the woman were to get an abortion right after than t would be fine?",3,0,Pro-Choice
1129,abortion,"While I personally do not think that abortion is right in any way shape or form. I do not believe the government has the right to make that decision. This is a decision to be made by the parents of the unborn child. NOT the government.",3,0,Pro-Choice
270,abortion,"What does legalizing drugs have to do with saving lives? Keeping abortion legal will help save lives by eliminating the need to have to illegaly abort a child and kill themselves at the same time.",3,0,Pro-Choice
629,abortion,"Now that I'm safe, I'm Pro-Choice :-)",3,0,Pro-Choice
1877,abortion,"A long life full of suffering is worse abuse. Choosing to abort a birth when a parent feels they would be unable to properly care for the child is making a tough choice, but trying to do what is best.",3,0,Pro-Choice
1566,abortion,"I dont want to say i officially have a position, but i want someone on the other side to answer this because i honestly just dont know:
if a 14 year old is raped (which, we have established, happens), and she then gets pregnant, but because she is 14, she will die if she has the baby, what is the pro life decision? is it then pro-life to have an abortion?
i just dont know and i want an answer from someone on the other side",3,0,Pro-Choice
1836,abortion,"Forcing women to become mothers is a strictly misogynist view. Also, blaming women entirely for the act of bringing a baby into the world is completely backwards. It takes two, and if a woman believes that the man who impregnated her will be irresponsible, or abusive, or resent her for having the baby—why do you expect her to take up all the responsibility for herself? The government does not provide enough help for single mothers and the majority of the country looks down on them as being leeches on the state. Most of the anti-abortion rhetoric revolves around women being irresponsible and messy in their contraception practices, which is sometimes the case, but, like I said, it takes two to conceive. If a man convinces a woman that the pull-out method is safe and that he’ll be careful, she’s not being stupid. She’s being trusting. And sometimes (a lot of times) that doesn’t work out.
Pregnancy is an incredibly expensive, unstable, and physiologically damaging affair. Women should have the option to not put their bodies through it. My own mother was adopted and she remains pro-choice as it is an individual’s decision as to whether or not they want to put their bodies through that.
If you see a child as a “punishment” for irresponsible actions, you are not pro-life. You’re anti-women. Plain and simple.",3,0,Pro-Choice
935,abortion,"I have no business answering the moral question simply because I'm not a woman. I can only imagine the physiological, psychological, and emotional stress pregnancy has on a woman, let alone an unwanted and unplanned pregnancy. I consider it the choice of the woman and nobody else. That means NOBODY, especially the government, should have the right to tell a woman she MUST go through 9 months of stress because she happens to be pregnant.",3,0,Pro-Choice
255,abortion,""Reagan once said something like this
Notice that everyone who is pro choice has been born"
Notice that men who will never have to carry or give birth to a child have opinions about abortion. Yes, people sometimes have opinions about issues that don't DIRECTLY affect them...",3,0,Pro-Choice
255,abortion,"1. There is MORE than a 1% chance that a condom and/or birth control fails. Condoms can slip off (for those guys who think they're larger than they are), bust, and tear if the wrong lubricants are used (ky jelly, crisco, anything else with petroleum). And the wrong lubricants are often used, because not everyone has proper education about using condoms, especially not young teens who are now having sex more now than ever. And condoms are the "safest" of all safe sex or birth control methods.
2. The psychological trauma of having to go through a 9 month pregnancy and then A LIFETIME of being a parent (because hello, fathers of unwanted babies are traumatized too) is most definitely going to be more than the psychological trauma of NOT having an UNWANTED child. People feel guilt for aborting children that they don't want, and that's because of the religious and moral values pushed on them from their social environment. They'll get over that much sooner than they would get over being forced to nurture a child they didn't want.
Parents who planned their children often find it much harder to raise children than they originally thought and end up making incredible mistakes that negatively impact their children's lives. How good of a parent can you be if you don't even want the child?
3. The "physical difference" between a child one second before delivery and one second after delivery is that BEFORE delivery, the child is depending on the mother for life and AFTER, the child is an independent being. That's a HUGE difference. If you have a cancerous tumor inside your body, would you want anyone to be able to tell you that you have no right to remove it - even when it could cause your death? If yes, then why does a fetus have more of a right to survive than a cancerous tumor? They're both made up of living cells (sometimes, the tumor is even bigger than a baby before the 3 month cut off period to have an abortion), and they both can cause death or serious health issues in many cases.
4. I just hate when men are anti-choice (yes, anti-choice because pro-choice people are not anti-life), because they won't be the ones who are ultimately affected by a woman's choice to have an abortion. Whether or not the woman has a baby, the father can ditch responsibility and never be heard from again, leaving the woman to raise the baby alone. (And you know how much we all
just LOVE and APPRECIATE single mothers!) Also, it's illegal in some places for a mother to leave her baby somewhere, but they rarely charge the fathers because THEY CAN'T BE FOUND! Negligent fathers who ditched the woman AND the baby 9 months ago are rarely held
accountable. The police go looking for the baby's MOTHER. So if the mother is held more accountable for ditching her baby, then she should also have more say over whether or not to have a baby.
5. You mentioned adoption as an alternative to having an
abortion. So you recommend a woman carrying a baby inside her for 9 months, THEN GIVING IT UP as LESS psychological trauma than having an abortion BEFORE the living cell is a fully developed baby? Where's the logic in that?",3,0,Pro-Choice
1821,abortion,"Now, I understand that many arguments have been made about a raped woman getting pregnant. But what if the mother's life is in jeopardy? What if the child's life is in jeopardy? Where is the line drawn? What would happen if the mother, distraught by pregnancy, committed suicide? Would she then be blamed for killing two lives? I was once told that should this become an ammendment, that there would be shades of grey associated with life or death situations. My take: There's no such thing as shades of grey, there's only black, and white. Only life, or choice. But, should any of you come up with thoroughly conving answers to my questions, then I will certainly consider lessening my deep feelings against an anti-abortion law.",3,0,Pro-Choice
478,abortion,"This country was also founded on separation of church and state. This throws out your whole argument.",3,0,Pro-Choice
1818,abortion,"I'm for life.
Better life.
If that means one messed up life instead of two messed up lives (and the ever growing chain that follows), then I'm for that life.
Abortion isn't pretty, in fact it's pretty ugly, but when you consider the social implications of a child birthed by rape, it becomes more of a socially conscious decision.
I cannot advocate abortion, but I can see when it might serve a purpose.",3,0,Pro-Choice
1068,abortion,"To people who believe that adoption is a complete solution to the problem of unwanted pregnancies:
What about heroin addicts who become pregnant before they can get clean? Or deeply anorexic women, who refuse to eat enough to carry a healthy baby to term? Trust me: it happens.
Shall we start imprisoning pregnant women if we don't trust them, or should we condemn the child to a lifetime of the painful and crippling side effects of their mothers' choices? Isn't the mother responsible for putting the future baby's life at risk--or does it only count if there is actually a miscarriage or a stillbirth?
For that matter, shouldn't we be investigating miscarriages and stillbirths more closely? You never know; maybe the mother did something harmful to the pregnancy. If abortion is murder, then that should at least be negligent homicide.
The fact is that until a living, breathing baby is born, every last thing a woman does impacts the health of the eventual baby. If she knows that she is not up to the responsibility, then it's not for ANYONE else to contradict her for the "welfare" of the "child."",3,0,Pro-Choice
1835,abortion,"No one ever mentions that the cause of over 99% of all abortions is unwanted pregnancies. If you prevent those, you prevent abortions. Wouldn't that make both sides happy?",3,0,Pro-Choice
1806,abortion,"The farmer owns the land that nourishes the pollinated apple seed, and he owns access to the water that enables the pollinated apple seed to grow.
Are you saying that someone owns the woman's body in which the fertilized seed is going to grow?
The issue is who owns the body! The farmer can choose for the land whether it is to support an apple tree or not. Shouldn't the owner of the woman's body make that choice as well?
Now, of course if you assume the woman is just a vessel, and if she is impregnated no discomfort is too much, no financial desperation too dire, no emotional trauma relevant... well then sure, you just force your women to do your bidding.",3,0,Pro-Choice
1814,abortion,"Until every orphan in the country is adopted and has a home, pro-lifers do NOT have a single leg to stand on. If you are pro-life that means you are willing to take care of the life that is not aborted. If you have not adopted them all nor plan to, then you have nothing to say in the matter.",3,0,Pro-Choice
