author_id;topic;text;topic_id;discussion_stance_id;topic_stance_id;discussion_stance
2815;abortion;"I do not believe I gave my PERSONAL opinion anywhere, but rather the opinion I must present to clients as a maternity home for unwed teens. As to your questions, all good ones by the way: 1. The State's answer: Tell them that rape is horrible, a vicious but cowardly act, should definitely be prosecuted. Explain (at their level) that there are many couple waiting for a child, that while they are too young to bring a child up, they are old enough to provide this gift of life. Also that they still have the choice to make, and whatever they choose you will assist, uphold and defend their decision. Therapy is also expected to happen during this time. 2. The State's answer: The same as # 1 3. Kids waiting for adoption are given hope , therapy and are placed hopefully in good homes while waiting. The real challenge is to connect adopting parents with them. Most people think they must have a new born, but are willing to listen to alternatives when they realize the cost of adopting a newborn. More attention needs to be paid on adopting other aged children. Public awareness and work done by public agencies, go a long way in assisting adoption agencies in getting that message out. More funds need to be allocated towards this end. 4. That conversation is solely between the mother, her physician and if she has one her spiritual leader. Whatever, her decision it must be honored by all. 5. There is truly more than enough love out there. What there is not enough of is funds, support, therapy and people willing to be involved. Adoption is VERY expensive no matter what the age of the child and newborns being the most expensive. Also some States have really whacky laws. For instance. In the State of Florida, You can be single, married, divorced or gay and be a foster parent. However, you must be married or have REALLY good connections to adopt these same children. Single, divorced are discouraged and find it harder, and gays cannot adopt at all. However, there are many families in these categories that are already successful foster parents. As for going through abortion and changing your mind, I don't think abortion plays that big of a part. Those that have undergone the procedure seem to understand what they went through and use it as a tool to move on better equipped. Those that use abortion as a method for birth control probably need some therapy, as the abortion is not the problem, the personal attitude about pregnancy, relationships and intercourse or intimacy need to be looked at. Allowing abortion as an alternative is a legal and viable one, as long as all other aspects have been looked at and addressed. I almost neglected to say: EDUCATION, EDUCATION, EDUCATION! This is the most basic answer. Working with pre-teens and teens, male and female, will get better results than any politician, physician, scientist, or arm chair quarter back will ever produce. It is not a matter of whose theory is right or wrong, but what we can do to help the birth mother, father and baby that have the problem. AGAIN, a common sense solution to an ongoing problem!";3;1;2;Pro-Life
4013;abortion;"what's there to rebuttal, you didn't say anything lol, and i replied to the other post with lol because it was funny that you were trying to sound smart but didn't have anything. I made a point that abortion is murder and your rebuttal was that i wrote words down";3;1;2;Pro-Life
4013;abortion;"Ignore womanhood? what? so it's womenhood to have the right to murder a person? What about you, you just totally dicard the person in the womb, as nothing.";3;1;2;Pro-Life
4013;abortion;"thank you, i believe my rebuttal stated common sense which will pass right over your head";3;1;2;Pro-Life
869;abortion;"Its Murder Plain and simple. If your for abortion, your basically for killing the old lady down the street. Hell your a communist Nazi.";3;1;2;Pro-Life
869;abortion;"Its Murder Plain and simple. If your for abortion, your basically for killing the old lady down the street. Hell your a communist Nazi.";3;1;2;Pro-Life
4683;abortion;"Well if you think about it they could have become someone who changes all our life's, such as a doctor who finds a cure for cancer or a women/man who was supposed to become president. But how will we know since they were never born. Some may say well they aren't even fully matured yet, but eventually they would have. Also is it fair for them, because they haven't even had the choice to say if they wanted life or death. What if that was your that was aborted? I believe its wrong, do you?";3;1;2;Pro-Life
4848;abortion;"i feel that terminating a pregnancy is wrong. why take a innocent life? under certain circumstances such as rape abortions should be legal but because of irresponsibility it shouldnt. vote, comment, and feel free to message me your opinions";3;1;2;"i am against abortions"
930;abortion;"I believe that in almost every situation, abortion is wrong. I find it disturbing that so many people think it is completely okay to murder an unborn baby. Many say that this is not "technically" murder, but I want to know what gives you the right to say that a fetus is not a human life. In my opinion, the minute the sperm and egg meet and the fetus is created is when a human life and a soul are created in that child. There is only one situation in which I think abortion is a necessary evil. When a woman is physically incapable of carrying the child that she conceives (as when an 8 year old is raped and cannot carry the child) this is the only situation in which abortion should be allowed. I believe that in this life, we are meant to suffer the consequences of our actions, therefore I believe that if a teenage girl conceives a child ( through consensual sex ) she should carry that child and give birth to that child and, at that point, she may choose whether keeping the child or putting him/her up for adoption is better FOR THE CHILD. This is my main point in all of this. What is best not for the mother, but for that innocent child, is what we should concentrate on in making all decisions during and after pregnancy and, if you choose to keep the child, throughout his/her life. With all due respect, Paige Jaclyn";3;1;2;"i am against abortions"
930;abortion;"That's just ridiculous. The difference between the two is that with the death penalty, somebody did something really bad. What in the world did that child do to deserve being murdered???";3;1;2;"i am against abortions"
4849;abortion;"I actually disagree with this portion of the statement: I think that if the man wants to keep the unborn child, he should have a voice in it as well.";3;1;2;"i am against abortions"
4849;abortion;"-"Unsafe abortions kill thousands upon thousands of women each year with millions suffering complications, and"" -"In industrialized countries with legal abortion, death from unsafe abortions has been virtually eliminated and complications are very rare." I tend to think of these two points as population control. While I do not believe in punishing the unborn child for crimes they have not yet committed, I do think that death or suffering from illegal abortion methods are just punishment for the "murder" of the fetus. "You do not think critically and/or are ignorant, or" Critical thinking? Yes. Abstract? Absolutely. Ignorant? Not at all. "You want women to die and suffer or do not care if they do." Correct.";3;1;2;"i am against abortions"
3689;abortion;"To answer this question, it is best to determine whether or not the fetus is actually alive when the abortion takes place before considering further details. Let us first take a step back from such a controversial issue and define "life" in a human adult. An adult coma patient, as an example, is regarded as "alive" if and only if he or she has a heartbeat, regardless of whether or not he or she could survive without the assistance of machinery. According to the Mayo Clinic, the heart begins to beat at five weeks. However, the Mayo Clinic numbers the weeks according to the start of the last period so that conception is regarded as having happened in week 2, thus the heartbeat begins during the 4th week after conception. This date is clearly within the range of the first trimester, a time frame which is generally considered acceptable for an abortion to take place. Of course, brain activity in the fetus does not begin until approximately twenty-five weeks after conception. However, if one considers brainwaves to be the defining of life in a human, then one may argue that the fetus is not alive. Before taking this defense be sure to consider coma patients with no brain activity--should they all be killed immediately even though there is evidence that they can come back and return to their lives? The two scenarios are not unrelated, and a stance in one requires a corresponding stance in the other. Alright, so now we have discussed the conditions of life. From this point on, I will operate under the most basic assumption--that the beating of the heart signifies a life and that the levels of brain activity cannot be a decisive measure. Now let us move on to some of the arguments common from the pro-choice side. First, that if the woman was not impregnated through a consensual act she should be permitted to abort the pregnancy and not have to carry the child of her attacker. While I pity in woman in this situation, we must be clear on the subject of to who's rights we are referring. The woman should have the right to move on from her attack yes, but this is a right based on compassion rather than morality or legality. The fetus should have the right to life--even if that life will be partially lived in foster care or with an adoptive family--which is a right based on both morality (lived and let live in its most literal sense) and legality (murder is a crime punishable by jail-time or even death). Second, that if the parents are teenagers they cannot be expected to care for a child and should terminate the pregnancy. Again, I acknowledge that this can be an immensely trying time, but, again, the ease of one or two people's lives does not trump the continuation of another. If the child truly cannot be kept by "too young parents," there still exist care options for parent-less children. Third, that the above is all well and good, but that child services cost taxpayers a ridiculous sum of money. In response, I can offer only the following: well then, people need to control their sex drive. Now, back to the immediate topic at hand: should abortions be legal? By my definition of life--the start of the heartbeat--the expecting woman has a four-week window in which she can get an abortion before the fetus is alive. It takes two weeks for a pregnancy to be able to be detected, so this woman has, at most, two weeks in which she should legally be allowed to get an abortion, this is assuming that she immediately begins checking for pregnancy, so it may actually be less of a window if any at all.";3;1;2;"i am against abortions"
3689;abortion;"Actually, Rani15 said that a "innocent" life should not be taken. The death penalty is the taking of a guilty life, not an innocent one. The two are unrelated.";3;1;2;"i am against abortions"
3689;abortion;""Logically?" Really? Here's a few questions for you: have you ever heard of a "hasty generalization," "false dilemma," or a "nirvana fallacy?" How about an "existential fallacy," "argument from ignorance," "square logic," the "fallacy of the single cause," a "composition fallacy," or an "Ad hominem?" Or maybe an overabundance of "appeal to emotion ," "appeal to motive," combined only with "spotlight fallacies" rather than hard facts? In case you couldn't tell, these are all logical fallacies which you managed to incorporate into your "logical" argument. There are so many that I would assume you were trolling if you hadn't clearly put so much effort into your argument. Kindly learn how to structure your arguments and express your opinions without the aid of transparent fallacies. Furthermore, when making claims about vague statistics (your second and third arguments) please include the source of your information, at least in passing. Otherwise, no one can take your argument seriously or believe what you say.";3;1;2;"i am against abortions"
3746;abortion;"All life on Earth was created, and it is therefore morally wrong to deprive an unborn child of its God given right to live. Even though it may not be fully formed, a fetus in the second trimester is still able to feel pain. Although the baby is still in the womb, it will have its organs early on, so even when you abort it in the first trimester, you are still killing a living thing, a human. ABORTION IS MURDER! And I'll bet if you asked an unborn fetus whether he fancies the idea of being murdered, it would tell you to at least wait until it was old enough to fight back. All life on Earth was created by the almighty God, and so it follows that only the creator should take it away. As unbelievable as this may sound, your hard earned taxes go toward keeping abortion clinics running. Rape may be an excuse for an abortion, but there are other options besides abortion. Rape is horrible. But why should the child pay for the wrong doing of another? The baby is innocent of the offense and his life need not be taken because of the act of another. Just because your baby is going to be born with some special needs does not mean you can terminate him before he is born. Give him a chance. Miracles happen. Think about it. What if YOU weren't living right now, because your mother decided to get an abortion? The situation becomes a bit different when you think that it could have been you who wouldn't even be sitting here reading this because you wouldn't have been born.";3;1;2;"i am against abortions"
4296;abortion;"I'm not arguing against abortion per se. But let's ask this question: Should we allow women to receive abortions a day before the child is due? I would hope that most people would answer with a resounding no. This timeline seems much too close--this fetus is all but a real human child. So the question then becomes not whether it is the woman's right to do something with her body, but that given that she accepted the risk of pregnancy (except for rape) by engaging in sexual penetration, that her rights are not unlimited. They should be balanced against the interests of the unborn. We can argue the degree, but the principle stands. As a side note, there are some pro-choice scholars who advocate for abortion rights up and until the child reaches 1 year old--post birth.";3;1;2;No
3130;abortion;"Neither pro-choicers nor pro-lifers should "accept" abortion. Whether or not it remains legal, large-scale efforts need to be made to reduce unplanned pregnancies. Sexual education, access to contraception, and (yes, even) family values are all tools we can use to drive down the numbers. Fighting against poverty and for equal pay also helps, because so may women abort for purely economic reasons.";3;1;2;No
66;abortion;"I think abortion should be illegal because some women use abortion as birth control. If you are going to have sex, you should be using proper protection. It isn't fair for a life to be terminated because someone wanted to have fun, but wasn't ready to take responsibility for their actions.";3;1;2;No
1466;abortion;"Yes it is a woman's right to do whatever she wants with her life.. but we're not just talking about "her", we're referring to another innocent human being in need of care and love.. Why take away the baby's chance to experience life? Abortion is as good as murder.. not just that, abortion could also inflict some damage on the woman's physical, emotional and mental health.. it could cost her life..";3;1;2;No
1466;abortion;"So you are trying to say that career is more important than your own flesh and blood? If a woman gets pregnant despite all her efforts then that "clump of non-sentient cells" is really for her. And once the fetus is inside her, she is resposible for its life. ok let's say a woman got pregnant because she was raped and wanted to have an abortion. So what? she's pouring out all her anger on the child because that was the son of a rapist? or because she wanted to get her life back together? dude her life will never be the same whether or not she gains a child.. It's not the baby's fault that he was created out of monstrosity. A mistake will never be corrected by doing another mistake. And just because abortions are performed all the time or are done regularly around the globe doesn't mean it is right. Try putting yourself in the situation of the child, would you ever want to be murdered by your own mom because you were unwanted? what if you're mother tried to abort you before but she didn't, how would you feel now? would you regret that you lived? Parenting is never an option once you started to have that baby bump inside you.";3;1;2;No
4296;abortion;"I don't think many people feel abortion shouldn't be an option for rape victims. My question, though, was why we inherently value that child as lesser (not legally but colloquially). I'm going to have to take issue with a few of the statements you've made as well. 1. While no hard numbers exist, it has recently become clear that partial-birth abortions (late term) is almost never required to ensure the women's safety. I'm talking .1% of abortions performed. 2. I'd ask this question--is there any 100% effective form of birth control? The last time I checked there was not, and so any person engaging in penetrative sexual behavior takes on the responsibility for potentially conceiving a child. 3. Abortions are surprisingly unsafe. This is not a reality that has been reported by the press because its existence would detract from many of so-called benefits to abortion. http://www.slate.com/id/2285988/. The article suggests that abortion can be a relatively safe procedure, but that the kinds of professionals performing the procedure (generally the least capable physicians) creates a situation where the danger is increased dramatically. 4. The child might not have the best life, but I would still think it would prefer a life. If the mother is that incapable a parent, she should just get her tubes tied. 5. Yes, contraceptive methods need to be better taught. However, I think they should be taught from the angle that having sex is not a zero-cost activity. By engaging in the practice, you take on the responsibility for the potential outcomes. You must be responsible. I'm going to start a battle on a similar abortion question if anyone is interested.";3;1;2;No
1466;abortion;"What I wanted to know is why do some women opt for abortion? is it the only choice they got? I mean there are social groups who are concerned with children's welfare... the community's not simply going to abandon someone in need..maybe the mother could put the child up to adoption else, hand him over to an orphanage or something like that... in that manner, the woman did not only let her baby live but she also provided him with an opportunity to have a better life than what she could offer... plus, let her have the time to pull herself together until she becomes ready to really become a responsible and stable parent..";3;1;2;No
951;abortion;"Well, the truth and matter is, in the english and non religious society it has already been accepted. There are a few exceptions but otherwise it's true. I think, being a christian, it's completely and utterly wrong. Why do you take away the chance for the child to be part of the world and a part of history? Thing is, when you abort you are actually killing your own creation. Abortion is exactly the same as murdering a fully grown person. So why is the law, When you murder a living being, it's instant jail. But when you abort and literally murder a baby inside you thats OK? Abortion is a very sensitive topic, in the sense that people all over the world do it and may not want to, because of certain reasons!!!!";3;1;2;No
66;abortion;"It isn't fair for a life to be "burdened" because someone wanted to have fun? It isn't fair for a life to be DESTROYED because someone wanted to have fun. Sex is for reproduction. I know with the proper protection it can be used as fun, but still, it's main purpose is for reproduction. If a person does not want to be burdoned with a child, they have the option to give it up for adoption, but it is not right to kill the baby because you aren't ready for that responsiblity. If a person isn't responsible/mature enough to use proper protection, they aren't responsible/mature enough to have sex.";3;1;2;No
988;abortion;"Yes women's rights, but what about that babies rights? if she does not want children one word contraception!!!!!!! Abortion is not the answer to immature women whom are careless and irresponsible. I personally know someone who was raped and had twins, they have been the best thing in her life! irrespective of the circumstance she was put through, they were her positive light at the end of the terrible crime committed on her! your life does not end because of children, im taking you don't have any?";3;1;2;No
4905;abortion;"i think that even thugh it might be the wrong thing to do, it is also a persons choice to care for their baby or not. i think that if the legal parents were forced to keep their child instead of it being terminated, and they were gonna have the baby terminated in the first place so that would set a bad environment for the child to grow up in, knowing that he is dispised by his gaurdians would set a really emotional mood for their life, and lead to suicide or harm to others";3;1;2;"It's wrong"
4905;abortion;"my bad ment to put this on the "it is right tab"";3;1;2;"It's wrong"
2785;abortion;"First of all no child should be unwanted, they knew what would happen by having sex and yet they still did it. Secondly, in instances as rape where the child was forced upon a female, adoption would be the ideal option. In cases where an adopter is not found the child can be placed in an orphanage or put in a foster home, there is no reason for the child to die.";3;1;2;"It's wrong"
4910;abortion;"Would you want to be killed in your safest haven? Would you like your life essence to be crushed? You never know. The cure to cancer. The unknown discovery. The answer might lie in the mind of what might have been a great scientist, theologian, or any person.";3;1;2;"It's wrong"
968;abortion;"OK... I agree with your reasoning they will probably grow up knowing they're unwanted and be neglected and abused....But, if you don't want a child don't do the act. Birth Control is cheap and available at most drugstores. It fails sometimes, but everything fails at least once. 2nd, there are plenty of people looking to adopt and foster. I'm sure that you would be able to find something to help provide or someone to take the child.";3;1;2;"It's wrong"
4908;abortion;"it's xcompletely wrong. anybody who has an abortion, is a baby killer. point blank.";3;1;2;"It's wrong"
1933;abortion;"Abortion as an act is wrong you are deliberatley ending the life of an unborn baby who has a beating heart from week 5 and a nervous system from week 8 which enables them to feel pain which discredits the theory that the fetus does not feel pain or is not a human being. Another argument is it is the womans right too choose, women may be able to validate her reasons for wanting an abortion but wheter you believe it to be right or wrong she is making a selfish choice to benefit herself and her current lifestyle with the majority of the reasons for wanting an abortion is simply that the woman is not ready to be tied down with a baby (but was ready to in have unprotected sex fully aware of the chance of pregnancy) Once the wheels are in motion for an abortion the medical agencies involved are obviously pro abortion and there is no inbetween agency to determine whether the woman is really happy with her decision this leads to many problems as the woman is not really making an educated decison with information from both sides, firstly there may be medical problems later on in life which can result in infertility, secondly the mental problems numerous women have suffered in later life due to abortions and thirdly the culture that abortion can be used as a form of contraception as alot of younger women are not fully aware of what is really being done other than that they just want the baby to be gone so they can go back to normal. I personally would not like to see abortion totally stopped as it would cause more problems than solving and to go back to the days when women tried to abort there own babies or did so illegally is not what anyone wants. But rules of abortion must be stricter an abortion can take place up to 6 months, which no matter what you believe is abborant and is murder. In normal circumstances 10 weeks should be the maximum amount of time, by this time a woman should have realised the pregnancy.";3;1;2;"It's wrong"
4904;abortion;"Wrong becasue we all had the chance to live.Even if we were just mistake's good or bad ones.We can live but other's can not ...??? This only means we can choose who live's and who can't.YOU see my point of view???";3;1;2;"It's wrong"
