author_id,topic,text,topic_id,discussion_stance_id,discussion_stance
2,evolution,"I have never read a high school biology text book with a chapter devoted entirely to slamming religion.The reason for this is that scientists justify their findings on their own merit. They have no need to slam other areas like creationism. Creationism does not provide evidence to support itself so it needs to slam science in order to justify itself.
Evolution has not been cast out by scientists. Maybe it doesn't look the same as when Darwin proposed it, but that's because scientists are interested in progress and improving theories. Additionally, there is proof of evolution in the form of speciation (there is other assorted proof, but I'm not a biologist so I won't try to explain it). For instance, a new mosquito has developed that is specifically adapted to live in London metro tunnels. This insect did not previously exist (which makes sense as there were no metro tubes, before metro tubes were built).
Claiming that evolution should not be taught as it inflicts harm on and is unfair to religion is a weak argument. Evolution is not a belief system. Most developed nations are founded with freedom of religion in mind. In this vein, people are therefore guaranteed freedom to pursue no religion. Teaching creationism is akin to teaching religion. If it is taught in public schools, the children's right to freedom of religion is being violated.
Furthermore, Pope John Paul II himself is quoted as saying "In his encyclical Humani Generis (1950), my predecessor Pius XII has already affirmed that there is no conflict between evolution and the doctrine of the faith regarding man and his vocation, provided that we do not lose sight of certain fixed points....Today, more than a half-century after the appearance of that encyclical, some new findings lead us toward the recognition of evolution as more than a hypothesis. In fact it is remarkable that this theory has had progressively greater influence on the spirit of researchers, following a series of discoveries in different scholarly disciplines. The convergence in the results of these independent studies – which was neither planned nor sought – constitutes in itself a significant argument in favor of the theory."
Finally, most Christian denominations do not enforce a literal interpretation of the Genesis story. Most allow it to be read as allegorical.",7,1,"for, evolution lessons in schools"
337,evolution,"And you must not have read my post either, because nowhere did I accuse you of being one of the crammers.
While the "both sides" story is a valid argument, it only applies when there are two sides worthy of consideration.
If what you meant was that evolution should be taught, with a brief note in passing that there are people who believe in ID, and the reasons why those beliefs are not scientific, then I can agree with you.
But to teach evolution and ID as if they were equals would be to make a mockery of science.",7,1,"for, evolution lessons in schools"
1189,evolution,"Your lack of ability to recognize the difference between science and fantasy is an excellent argument in favor of teaching more science and less fantasy.
Evolution does not have "many flaws" - your understanding of it does. Do you also wish that alchemy would be given equal time to chemistry? Of course, with creationism, there's nothing to actually teach, unless you want to teach the different creation myths of hundreds of cultures.
As for those textbooks containing obsolete and wrong information, do you have examples for current textbooks?",7,1,"for, evolution lessons in schools"
1189,evolution,"Wait, you're telling me this, because? The last time I remember, I only used the same counter-argument that refutes the argument given-especially when it's repeated myriads of times. Oh, right, you're the one who repeats the arguments!
In fact, it's rather ridiculous to bring this up, when I can keep counter-arguing your arguments by notifying you that they're logical fallacies. Please, don't go ahead and remind me that I'm reminding that you're using logical fallacies.",7,1,"for, evolution lessons in schools"
1189,evolution,"Uhm, evolution is a fact.
Can you define evolution for us? The actual, scientific definition? I'm sorry to hear your education didn't take, but that's really no reason to deny other children the right to an education, should they choose to take advantage of it.",7,1,"for, evolution lessons in schools"
1189,evolution,"Most christians are educated enough to accept evolution.
Secondly, "it teaches many outdated theories" - sorry, what?
Thirdly, there are no other scientific theories, so there is nothing else to teach. There are no scientific theories of creation.
"Why didn't they tell me about the evidences that contradiction evolution?" Gee, maybe it has something to do with the fact that THERE ARE NONE, idiot.
Wow, you're really into this bearing false witness stuff, aren't you?",7,1,"for, evolution lessons in schools"
1189,evolution,"And maybe parents who teach their kids that lightning bolts are thrown by Zeus can have their kids excused from learning about atmospheric discharge. And by "middle ground" you mean "suppress all science that disproves my specific religion".",7,1,"for, evolution lessons in schools"
1189,evolution,"Is that right? What exactly?
The wondering stops there, I do.
By the way, which of the logical fallacies you committed that were pointed out to you do you think were not logical fallacies?",7,1,"for, evolution lessons in schools"
1189,evolution,"Lying for Jesus again, I see. In almost all western countries, education is adequate and most people, even in countries composed of mostly Christians, accept evolution. The scientific illiteracy required to reject it is limited to the third world, and countries with really bad education like Turkey.
http://blog.nodvin.net/?p=211
Please provide the scientific definition of evolution, and explain why you think it's not a fact.
"Actually, there are."
Then, by all means, PRESENT them.",7,1,"for, evolution lessons in schools"
1189,evolution,"Actually, the Earth is not spherical - it's an oblate spheroid. But anyway, all the evidence points to a non-flat earth, just like all the evidence points towards evolution. The only major reasons some people don't accept evolution are scientific illiteracy and religious fundamentalism (often intertwined).
"Proof" is a concept in math. Science deals with evidence. Again: THERE ARE NO ALTERNATIVE SCIENTIFIC THEORIES TO THE THEORY OF EVOLUTION, hence nothing else to teach except fantasy. Yes, it's proper to teach children science, but not religion. Parents can take care of the indoctrination at home if they choose.
Do you want science classes to cover all the hundreds of different creation myths?",7,1,"for, evolution lessons in schools"
1223,evolution,"Except that most of evolution is indeed proven fact. The fact that we eat foods derived from evolutionary sciences, use drugs derived from evolutionary sciences, use buildings derived from evolutionary sciences, the list goes on and on. Commercial tangibility is a strong piece of evidence to support evolution.
Creationism has not a damn thing commercialized other than propaganda print.",7,1,"for, evolution lessons in schools"
1223,evolution,"Find me a textbook that actually does what you say. Furthermore, are you actually saying that TOE teaches what Darwin wrote? Are you truly that ignorant?
The science curriculum teaches no other theories because no other theories have any evidence. No other theories have done any experiments. Would you teach Norse Mythology as science? Didn't think so.
The problems of evolution are largely in the details and many of them are actually falsehoods propogated by liar creationists in the field of abiogenesis.",7,1,"for, evolution lessons in schools"
450,evolution,"Biological? whoa horsey evolution is not limited to biology and all of a sudden you throw out that word that has no place, biology is a byproduct of cosmic evolution, biology is made up of the very same ingredients found throughout the cosmos.
There are planets, moons, stars, solar systems, galaxies, cluster of galaxies, clusters of clusters of glaxies, supernovas, black holes, quasars et al dying and being born throughout the cosmos, that's evolution, not creation as used to explain the origins of the universe",7,1,"for, evolution lessons in schools"
337,evolution,"The Pope accepts evolution, and there are more Catholics than any other sort of Christian.",7,1,"for, evolution lessons in schools"
337,evolution,"Re the previous post: I said nothing about cramming evolution into kids' heads. My observation was that those who cram religion in are for "equal time" when it comes to evolution, which is hypocrisy.
Creation isn't in a position to slam evolution because it doesn't explain anything, and evolution does.
Apes are primates. Did you really not know that?
Neither "creation" nor "assisted evolution" add any information or insight to the existing theory of evolution. At best, they're unfalsifiable in the strong sense that they make no predictions. At worst, they're just plain wrong.
Would you teach prospective doctors that angels help the healing process?",7,1,"for, evolution lessons in schools"
337,evolution,"#1 Yes, and? The earth is billions of years old, not thousands.
#2 Not an opinion. Fact until someone comes up with another theory.
#3 We know Haeckel committed fraud. The issue is, *which* textbooks still have the drawings? And what do they say about them? Just name one and quote a sentence.
#4 Out-of-date statements do not a theory break. Evolution has had more than its share of hoaxes, probably because of the controversy it arouses. But that's not the point. There is plenty of evidence that is not tainted in any way. The accepted evidence universally supports the theory. Can you point to one demonstrably false claim that the modern evolutionary synthesis makes?
PS - Haeckel used his drawings in support of the so-called biogenetic law, which was discarded a century ago. Again, nothing to do with the modern theory.",7,1,"for, evolution lessons in schools"
431,evolution,"well i think that having evolutions taught in schools is a good thing, because where else are they going to learn that stuff. ya some people may say they dont want their child to even hear about it but they cant be sheltered and even the parents who would say "ill tell them about it" well how can parents teach them when they are one sided. they wont let their children chose for themselves if they have a say in it.....
but i also think that evelution should only be taught however much that schools are teaching about religions...... ex. if a class only teaches 2 chapters of religion than there should only be 2 chapters taught on evolution.....",7,1,"for, evolution lessons in schools"
1189,evolution,""I thought to myself, If evolution is so solid, why do
they continue to publish false and disproven findings
in our textbooks?"
Evolutionary theory is not founded on Haeckel's observations or theories. Haeckel's work was discredited in the 19th century, and has not been relevant to biology since the rediscovery of Mendel's laws of genetics. That the biogenetic law is false has been the consensus of biologists for over 100 years, and developmental biologists have been working constructively to provide alternative explanations, which have so far all been evolutionary in nature.
The similarities between vertebrate embryos are real. We must distinguish between observations of those similarities and hypotheses about their causes. The similarities are not in doubt; there are worthwhile studies of the degree and timing of the similarities, but none that question their overall existence. What Wells has described is one hypothesis about the cause, Haeckel's biogenetic law, which failed early and spectacularly. He has not addressed any modern hypotheses, nor has he provided a better alternative.
Evidence for common descent lies in the unity of form and process. We do not use Haeckel's outmoded, invalid mechanism to argue for evolution. Instead, we look at the marvelous convergence of disparate organisms on common principles: all animals use the same genes to define regions of their bodies, all vertebrates build their faces by unlikely rearrangements of odd pharyngeal protrusions, and even tailless mammals like us have to start with tailed embryos. The best explanation for these phenomena is that they are a consequence of a common heritage.
- PZ Myers
Now, would you consider learning about evolution now, since you now know of this? Or are you going to remain with the baseless assertion of creationism, which holds a few of its hoaxes of its own?",7,1,"for, evolution lessons in schools"
1189,evolution,"Well that's too bad, we always have our handy dandy evidence to determine whether something is factual or not. And that is lacked by those who refuse to either challenge or accept the evolutionary theory, and instead like during a chess board game - they knock all the chess pieces down and craps all over the board, flying away to claim victory of their position (creationism in this case, if not said "ignorance") to others who also refuse to learn.",7,1,"for, evolution lessons in schools"
1189,evolution,"Evolution is only "in doubt" because some people can't understand it, others are frightened by it because it disproves their beliefs, and yet others turn dishonesty into a career.
The people who speak against evolution do so because of ignorance, lack of intelligence, insanity, or dishonesty.",7,1,"for, evolution lessons in schools"
1223,evolution,"Sad.
Did Haeckel fake his drawings? Yes.
Does evolution depend on them? No.
Was Haeckel's basic premise, that organisms that came from a common ancestor develop relatively similarly correct? Damn straight.
Was his greater notion of ontogeny recapitulates phylogeny wrong? Yes.
Is that a part of evolution, and has it been for years? No.
You, as a dishonest and highly ignorant Creationist, fail to educate yourself as to why pictures that appear to be similar to Haeckel's work are presented in textbooks. You also fail to educate yourself to the fact that actual photos of embryos have replaced drawings. What's next, you're going to claim that the photos were faked? lol.
http://www.talkorigins.org/faqs/wells/haeckel.html
Do you want to reinforce that Creationist is a synonym for Ignorant?",7,1,"for, evolution lessons in schools"
1223,evolution,"By that measure, as long as organic chemistry, physics and gravity are in doubt by both lay and acedamia, then organic chemistry, physics and gravity are in doubt.
Gravity is a theory. Why aren't you giving it the same treatment you do to evolution?
Or is it because you are ignorant?
Angelic Falling anyone?",7,1,"for, evolution lessons in schools"
1189,evolution,"When Haeckel's inaccuracies were exposed, authors started using corrected versions. Science tends to be self-correcting.
Can you name a biology textbook currently used in american schools that shows Haeckel's embryo pictures, or were you just bearing false witness?",7,1,"for, evolution lessons in schools"
1189,evolution,"I can't seem to fathom of your ways, you disagree that evolution is "factual science", however continue blathering about how textbooks still have Haeckel's work in them with yet given cited textbooks presently. If you, yourself, knew this "evidence" was false, what is your opinion of the overwhelming factual evidence that has supported it being a scientific theory; or "factual science"?
"saw right through it's many flaws", what are flaws of the modern theory of evolution have?
Don't misconstrue what I'm trying to figure out, I could care less whether you're OK with it being taught in school (I would only be worried if it weren't being taught presently), what I want to know now is why you think "creation is truth", and what you mean by truth. As factual?",7,1,"for, evolution lessons in schools"
1189,evolution,"Why hasn't ANYONE presented any evidence against the modern theory of evolution or its flaws?",7,1,"for, evolution lessons in schools"
1223,evolution,"Because in your extreme ignorance, you don't even understand what Haeckel's fraud was about. You just cite it as an attack on evolution without understanding what he was trying to do.
Show me a recent textbook that has the actual Haeckel drawings. Or you could just run away.",7,1,"for, evolution lessons in schools"
1223,evolution,"Sure you never said Evolution hung on Haeckel's work. You just attacked evolution as a fraud because of it, despite Haeckel's theory being tossed long ago. Does that show you have any understanding of modern TOE? No.
What you see is actual photos and drawings of photos showing that development patterns of species that share common ancestors are similar supporting the notion of common descent.
Are you really saying that biology has not changed in 6 years? Really.
I know for a fact that the 7th edition of Campbell and Reece biology has actual photos. And colleges and good prep schools use that or the 8th edition.
You are like a guy who heckles the professor discussing complex physics without understanding what force is.",7,1,"for, evolution lessons in schools"
1223,evolution,"Why doesn't it carry the same weight? Because gravity at a superficial level doesn't threaten your creationist beliefs?",7,1,"for, evolution lessons in schools"
337,evolution,"Argument ad populum - clearly evolution is not a popular idea, otherwise there wouldn't be such a fight over it. It's a bit of a cheek to be accusing us of that. Nobody has ever said, "evolution is true because Darwin/Huxley/Gould/Dawkins says so". On the other hand, quite a few people have said that evolution can't be true because the Bible says so.
I sure hope we do eventually colonize space, but nothing about evolution tells us that this will happen - if anything, the lesson is that even the mighty fall (cf. the dinosaurs).
Radioactive (and other forms of) dating. We don't declare the dates to be correct. We compare the results of a number of different dating methods, see that they agree, and then take this as strong evidence that the dates are correct. Radiometric dating is only "notoriously inaccurate" in the minds of creationists. In reality it's accurate to within about 1% in most cases. As you would know if you bothered to look up radiometric dating in an encyclopedia.
As to scientists "arbitrarily assigning dates" - that is a very serious charge. You're accusing them of lying and/or falsifying evidence. Back up your accusation, please. Same applies to paleomagnetic findings.
The use of analogy is often used to instruct, but never as a basis for a scientific theory. Perhaps Herbert Spencer was a moron, but what does a 200-year-old philosopher have to do with evolution? Talk about using analogy to mislead....
And for God's sake, let go of Haeckel already. He was arguing for a completely separate theory, loosely described as "ontogenesis recapitulates phylogenesis". It wasn't evolutionary theory then, and it isn't evolutionary theory now.
The commonly-used "survival of the fittest" shorthand for evolution is indeed tautological as it stands. That's not the definition of evolution. Evolution is the change in allele frequencies of a population due to differential rates of reproduction of the phenotypes corresponding to the set of genotypes in the pool. In no way is this definition tautological.
"There was only sand, seawater, lightning, and volcanoes to produce evolution, so we know that is what produced it. "
Statements like that make me cringe. To paraphrase Babbage, I am not able rightly to apprehend the kind of confusion of ideas that could provoke such a statement. It's an infantile thing to say. And I guarantee you it wasn't a scientist who said it. So who's the creationist straw-man in this case?
...And you go on with another half a dozen equally infantile misconstructions of science, which are rightly easy to demolish, straw-men that they are.
"Since creationism could not possibly be true, ours wins by default." Nonsense. Utter rubbish. The actual statement is this: to demonstrate that life must have had a creator, you must show that this is the only mechanism that could have achieved the given complexity. Since you have not demonstrated that it is the only possible mechanism (evolution being a viable alternative), and since your hypothesis makes no other testable predictions, you have not advanced an argument that makes a useful contribution to our understanding of the world. In other words, creationism is useless (as Rev. Marc Leclerc said to the Discovery Institute, in explanation for why they weren't invited to the Vatican's conference on evolution).
Evolution can be falsified. It's been said many times. Find a fossil rabbit in the pre-Cambrian, and you've blown evolution out of the water. That's all you have to do. Maybe you should be out there digging instead of in here misquoting?
By the way, I found a good resource for you: http://creation.com/arguments-we-think-creationists-should-not-use
And I do find it amusing that you're attempting to be scientific by referencing a proselytist site :-)",7,1,"for, evolution lessons in schools"
1189,evolution,"Is that so? Looks like someone else gave you a rebuttal, which would probably mean that I wasn't the first to see them. Aside that ridiculous guarantee of yours, be prepared to respond once I've responded to that excerpt of diarrhea you pasted.",7,1,"for, evolution lessons in schools"
1223,evolution,"You wonder why I call you ignorant? You deliberately ignore what I stated about Haeckel's premise. Furthermore, you deliberately ignore how actual photos show that embryonic development is similar in species that are closely related.
This is why creationists are considered to be idiots. You attack something without even bothering to understand what you are discussing.
I see you deliberately ignored my other point about Haeckel.",7,1,"for, evolution lessons in schools"
337,evolution,"Evolution by analogy:
A living creature's genes are like a set of blueprints that are used to build the creature. Offspring inherit roughly half of their blueprints from each parent (with some exceptions). Very occasionally a blueprint is subtly altered when it is being copied. Some blueprints are "better" than others when it comes to surviving and reproducing, e.g. longer legs make it easier to run away from predators. Statistically, we expect that over time there will be more of the better blueprints and fewer of the inferior blueprints.
Sometimes, particularly when two populations are isolated from each other, the sets of available blueprints in two populations become so different that they are incompatible, i.e. it's impossible to build a working individual from any combination of blueprints from the two sets. This is known as speciation. Once this happens, the blueprints tend to drift further apart, as no mixing occurs. Thus we end up with situations where, for example, the reptiles branched into two distinct groups, birds and mammals, which cannot breed with each other.
Over further time the distinct groups branch into further incompatible sub-groups (e.g. canines and ungulates), and then branch again and again, so that we end up with a "tree of life" - many distinct species, all of which had a common ancestor at some point, but some pairs having had a more recent common ancestor than others. For example, humans and chimps had a common ancestor about 5 million years ago, whereas our most recent common ancestor with the baboons lived about 24 million years ago.
How can it be that two populations might favor different blueprints? There are a variety of reasons for this. Consider, for example, one population living near water and another living near trees: the population near water will tend to favor blueprints that make it easier to swim, while the population near trees favors blueprints that help them to swing from the branches. This is the origin of divergent evolution. Species fit themselves into niches, and each niche imposes different requirements which lead to different genes being preferred.
There's also convergent evolution: two species with very different origins may find themselves in similar situations, so that they both evolve towards a common adaption. An example of this is the Tasmanian wolf versus the common wolf: their origins couldn't be more different, but they both moved into the stalker-predator niche in their respective territories.
Any questions? Sorry if anybody found this patronizing, but I hope it clarified evolution for some. It's also very hard to argue that this isn't what's happening, given what we know about DNA and population dynamics.",7,1,"for, evolution lessons in schools"
1842,evolution,"Wrong, wrong, wrong.... again.
Look at my posts. I never said or implied that evolution hangs on Haeckel's work.
Please be honest.
As I said before, I saw it with my own eyes. My son's ninth grade science book showed Haeckel's work, identified it as Haeckel's work and presented it as evidence. You can take that for what it's worth. It really doesn't matter.
As for education, I graduated the public school system and the local university. I wasn't afraid.....even one time.",7,1,"for, evolution lessons in schools"
1842,evolution,""yet you deliberately attacked evolution as a whole on Haeckel's work."
Wrong again.
Maybe you didn't hear me before. I'll say it again.
I did not attack evolution based on Haeckel's work. Nor have I attacked his work as a whole. Why do you keep saying this? It is not true. But, you seem to be obsessed in thinking that I did these things.
My whole point was concerning false evidence in textbooks. Haeckel's work was an example that I gave. The textbook used Haeckel's Falsified photos as truth. I am not attacking his whole body of work
