author_id,topic,text,topic_id,discussion_stance_id,discussion_stance
613,evolution,"I see your points and they are valid. However, if you read up on your science you will realize that a large amount of science communities believe in a creationist of evolution. They look at the facts of order and possibilities as well. If you wanna call God a Sky Daddy, then I believe I can be just as skeptical about the universe and all of its order coming together from random parts of nothing. Its as if a BMW were formed from car parts just because you threw them together millions of years ago. Sorry folks but that is harder to believe for me than a someone or something orchestrating everything through order and detail.",7,1,Creation
613,evolution,"Oops, I meant to say creationist version of evolution. My apologies.",7,1,Creation
1212,evolution,"Ah Creation vs Evolution. A debate that is essentially the debate since the release of "The Origin of Species" by Charles Darwin in 1859.
Now let's look at each. In evolution, the general theory is that "populations evolve over the course of generations through a process of natural selection." Where as in Creation, the explanation is that someone/some being/some force created life as we know it.
While evolutionary theory is a scientific theory (which is based on facts, creationism is more a belief or rather "faith based" as one puts it. At first appearances, it would seem that evolutionary theory has the upper hand since it "evolves" as discoveries are made. Whereas creationism fails because it's a set story and as inconsistencies are discovered, the belief becomes invalidated.
But the idea that evolutionary theory "evolves" is essentially saying that the theory can "change" to fit the discoveries made. In essence, evolutionary theory is allowed to "change" its story provided that there is evidence to support a change.
Creationism on the other hand, as a belief is based on faith not science. It's a belief that puts the responsibility of creating life into a "Creator" whether that creator is God, Shiva, the Force, or whatever is not the focal point.
Oddly enough, Creationism seeks to explain the what I call the "moment" that started it all. Whereas evolutionary theory seeks to explain our past but not necessary the moment in which it all began.
After all evolutionary theory states that all life stems from a common ancestor. But where did that common ancestor come from? In current evolutionary experiments, we can see microevolution and a limited degree of macroevolution. We can show how a primal soup of chemicals can form basic amino acids given certain conditions. We can show how single cell organisms can form into multi cell organisms. Yet to this day we can't show how basic amino acids can form a single cell organism.
Science can discover and explain a lot of questions. Yet even now there are questions that science can't fully answer. Sure science can tell you that as a species your goal is to procreate and ensure the survival of your genes, but science can't tell you exactly what is your purpose in life.",7,1,Creation
1229,evolution,"k, I believe that 'God' created and then tweaked via evolution?
we all find out within 100 years anyways....",7,1,Creation
1241,evolution,"yes i do. except better than your description.",7,1,Creation
1201,evolution,"The scientific rigor you mention is not present in evolutionary theory. Here's one example: In the 1800s, Charles Lyell and others came up with dates for the rock strata. Radiometric dating wasn't invented until the 1900s. When it was invented, the techniques were calibrated to match the dates Lyell came up with. To say that this proves the dates that Lyell came up with is a logical fallacy, and it sure doesn't sound like true scientific rigor to me.",7,1,Creation
1201,evolution,"God is abstract. He doesn't often show himself. In general, the idea of a god or gods is pretty hard to think about.
Apes are concrete. You can see them. Generally, the whole ape concept is easy to get your hands around.
It's funny that the supposedly unsophisticated ancients would all choose to believe in an abstract concept rather than a concrete one. If you asked Adam where he came from, why would he say "God must have created me, I've seen Him around the garden" instead of "I was magically transformed from one of those apes over there"?",7,1,Creation
1201,evolution,"One of evolution's major problems is a moral one. Evolution states that creatures change over time. When a creature is more fit than those around it, it takes over. As a result, the best creature rises to the top. It is claimed that all this is in the best interest of the species.
If that were true, it would justify a whole bunch of things that most people disagree with. White men kept slaves in the South, and slavery stuck around for some time. And when the slaves were freed, they didn't free themselves - white men from the North did most of the work. Does this mean that white men were more fit than the slaves and that the plantation owners were justified in keeping slaves?
There are plenty of other examples. Terrorists (and their American counterparts), the Darfur conflict, feudalism... Evolution implies that the side with the upper hand deserves to win. This post isn't a very scientific argument, I know, but I don't think I could ever accept the "might makes right" mindset.",7,1,Creation
1201,evolution,"I stand corrected - there is rigor in evolutionary research. However, not all of it is scientific, and a lot of it is based on exaggerated facts, half-truths, and assumptions.
I mentioned the dates in rock strata for two reasons. First of all, my post was a reply to burnman, who claimed the Earth was older than 10,000 years. Second, geology, which I concede isn't the exact same thing as evolutionary theory, is still very important. Evolution requires incredible amounts of time - if the proposed periods of time don't line up with the strata or the fossil records the strata contain, that's a pretty big problem with evolution.
I found The Origin of Species on Wikisource and am reading through it. Any interesting passages?",7,1,Creation
975,evolution,"Unfortunately, the title of this discussion is wrong. Instead of being Evolution vs. Creationism, it should be:
Does God exist?
Creationism and evolution are not exclusionary. Creationism implies that a Higher Power, a God, orchestrated the creation of this planet and its inhabitants. Evolution may very well have been one of the tools used to accomplish this.
As to whether God exists (however you choose to define God), each person has to decide for themselves.
I look at the world around me, the thousands of beautiful plants, animals, etc, and think that their must be a Higher Power behind it all.
Mathematically, it seems like it would take much more than a few billion years for a world to evolve by chance to what we experience today. It could take a few billion iterations just for someone to guess my password. It doesn't make sense to me that the earth could evolve to what it has become in its short (few billion years?) history by chance.
More than that, my soul tells me there is a God.",7,1,Creation
1201,evolution,"The different parts of the embryo don't grow at the same rate. What looks like a tail is really the spine, which develops earlier and starts off longer than the rest of the embryo. The body then "fills it out," so to speak.
There are several other features that are often cited as evidence of evolution, such as "gill slits," "yolk sacs," and other bits and pieces that were supposedly left over from evolutionary ancestors. However, many of these comparisons are based on appearance, not function. Just because something looks like a _____ doesn't prove that it used to be a _____.
Many frequently cited claims of evolutionary leftovers in the embryo are part of the theory of recapitulation. This theory was widely published in old textbooks and so remains a common misconception, but nowadays even mainstream scientists reject at least most of it, as it was based mostly on guesswork and exaggerated illustrations.",7,1,Creation
76,evolution,"*
If evolution is true....
How come people aren't still evolving?",7,1,Creation
975,evolution,"jwdunn, first of all, I appreciate the tone of your post, so I chose to reply to you even though you weren't the only one to make some of your points.
Two points:
1. RE: this couldn't happen by chance.
First of all, my understanding of the universe is too limited to know if 13.7 billion years x 150 billion galaxies x 1 trillion stars x 5 planets per star makes for good odds or bad odds for a planet to exist by chance that has the right orbit, spin, tilt, elements, etc to support life.
However, for life to evolve like it has from essentially nothing on such a planet in just a few billion years by chance seems pretty far-fetched to me.
Even still, suppose mathematically it isn't so far-fetched. It still doesn't invalidate creationism. If evolution was a tool used by God to populate the earth, He might have "only" set the Universe in motion to accomplish this, or, in my opinion at the moment given my limited understanding, He might have used "accelerators" to speed up the evolutionary process so that we could reach this point in "just" a few billion years.
2. RE: Creationism is an argument that came from a time when humans believed the earth was the center of the universe.
Creationism came from, and still comes from, people who devote significant effort to trying to commune with God--whoever God is. Millions, or billions, of people claim that they are able to pray to God and feel his influence in their lives. That has been true for thousands of years, and continues to be true today.
Just as I have no way of convincing someone who refuses to honestly devote effort to communicating with God that he does exist, there is no way for me to be convinced that he doesn't exist.
Finally, if God is all knowing and all powerful, the implication is that God knows science perfectly. As a result, it makes perfect sense to me that he would understand and use tools like evolution (that we only partially understand) to accomplish his designs.",7,1,Creation
1229,evolution,"For us to understand God, is like your cat or dog trying to understand your income tax report!
Evolution and Creation go hand in hand!",7,1,Creation
1229,evolution,"Interesting argument a la Sagan, 'Billions of Billions'.
But then who/what created the basic physical (physics) law?
Who/what created/evolved time? Chronos?
Both evolution and creation are comparable and hold as much credence when viewed from a limited perspective.
I'm a scientist and agree that there is a lot more out there then what we can see and touch, to blindly believe in religion is dumb, to blindly believe in science is dumber, to not believe is dumbest!
---
However, the old "this couldn't happen by chance" argument just doesn't work to defend Creationism, in light of recent scientific findings. Consider a crude version of the famous Drake Equation:
1. Age of universe: 13.7 billion years
2. Galaxies in universe: about 150 billion
3. Stars per galaxy: about 1 trillion
4. Planets per star: about 5",7,1,Creation
1229,evolution,"Why do you assume that god needs to operate within the constraints of time when accusing him of wasting his time? :)",7,1,Creation
76,evolution,"So why don't we have talking monkeys?
It seems to me that the monkeys would grow tired of their oppression.
You said that with some species it can take eons
So why can't we see at least one species in the process of evolving? Shouldn't we have some hybrid species?
Why hasn't there been a mass monkey revolution a la "Planet of the Apes" ?
With the threat of global warming looming, why do we still get skin cancer? Shouldn't we be developing some sort of "adaptable trait" which allows us not be harmed by the sun's rays? And why has pollution made our lungs worse and not better?
If there is any reason man is living longer it is because of technology and not because of an inherent trait.
Humankind is breaking down, not getting better",7,1,Creation
76,evolution,"Actually, creationism is an argument that has been in existence since the beginning of recorded history
With the writing of the Old Testament
I think you are referring to a time of more recent Christianity
So the Biblical account is an argument which has been in existance much longer than your note",7,1,Creation
76,evolution,"That's your best argument - "Because they don't" ?
I thought there was a reason for everything...
I don't see the squirrel outside my window evolving. In fact, I'm pretty sure squirrels have looked and acted the same for thousands of years.
How does an animal aquire a trait that he wasn't born with? Does he just wish for it really hard and it magically grows?
And you proved my point - "species have certain characteristics and properties"
I noticed you didn't mention that their characteristics randomly change
And by the way, I'm just wondering because I'm a curious person...
what insects are you talking about?",7,1,Creation
76,evolution,"Just because you think your opponent has been brainwashed one way or the other does not make your argument any stronger",7,1,Creation
76,evolution,"Was there a historical record of man evolving?
dang, I must have missed it",7,1,Creation
76,evolution,"You're just as much brainwashed as I am
except you're the other side",7,1,Creation
1212,evolution,"However, the fact remains that creationism is not inserted into Evolutionary theory on the basis that there are no "scientifically reproducible" evidence that gives credit to creationism.
That's why there's a difference and that's why we're having this debate.
Now looking back at my original post, the definition I set forth for Evolutionary Theory is the one that is commonly accepted from the works of Charles Darwin in the Species of Origins which was (as aforementioned) in 1859.
Using that basis for evolution theory was my starting point. Naturally if you wanted to use a different definition for your starting point then yes I might be incorrect.
But I digress, let us examine your defining point then. Evolutionary theory, according to you, is the general theory about how life came about. Based on natural selection and the predominance of certain genes being passed down from generation to generation (which also meant that some genes were not passed down). And while there is significant evidence to support this theory, there is little evidence of how it started. How did a lifeless planet "form" life? What was the first starting point? The first formation of an organism from various building blocks? The first generation to "pass its genes" to the next? For these questions, Evolutionary theory has no answer.
Creationism does however have "general" answers. Now I realize that some may point to the fact that these "answers" are typically very vague (i.e. how does a rib from a man be formed into a woman?), but consider the author and audience at the time. Examine how you would go about explaining electricity to someone from the 8th Century A.D.
Now going back to my original point I do concede that I digressed in the last paragraph, but let me instead end with examining logicchop's analogy of evolution theory is similar to the scientific view that matter is made up of smaller things.
Odd that one would choose that particular example as our knowledge of that field has come to some serious dead ends. Now I'm no physicist, but I did take a few classes back in college.
Sure matter is made from smaller things (i.e. atoms) and those atoms are made up of even smaller things (i.e. electrons, protons, and neutrons) and those things are even made up of smaller things (i.e. leptons, quarks, etc.). Yet despite the various theories (both true and false) we have yet figured out how these atoms came to be. Did something create these leptons and quarks? Where they pre-existing? Did the transfer of energy create these leptons and quarks? If so who created the energy?
The problem now becomes a hundredfold more complicated as various scientific theorems, laws, and principles invalidates possible explanations to this unique phenomenon. The explanation is considered the Unified Field Theory, a holy grail of sorts for the scientific (particularly the physics side) community.
So there you have it. Perhaps the question for debate should have included a framework in which both sides can accurately engage in a "civil" debate rather than take assumptions that may (or may not) be true.",7,1,Creation
76,evolution,"Ah yes, the classic peppered moth argument
I'm very familiar with it
I'm not sure how that proves the evolutionary process
Both moth colors have always been there
Its just a matter of which is it easier for their prey to see. That's not evolution-
That's a diet plan",7,1,Creation
76,evolution,"Then according to your theory the fruit flies would have adapted and survived
So I'm not really sure how that argument works...",7,1,Creation
76,evolution,"What I meant was that in the situation, both moths were present at the time of the observation - both colored moths were on the trees to begin with...
"Then the darkness was selected for when the environment changed during the Industrial Revolution."
-Who selects this mutation to occur? Does it just happen by good fortune?",7,1,Creation
76,evolution,"That's interesting because the burden of proof rests on you to prove that we are still evolving.
I don't know about anyone else but I haven't noticed mankind change form for a few thousand years....
Another question- With this whole "big bang" theory. It seems like everything should have blown apart in a big bang and not come together.",7,1,Creation
76,evolution,"That doesn't make much sense. Why are we still evolving and the monkeys aren't?
Why aren't fish jumping out of the water and growing legs?
I mean, if it happened billions of years ago than how come its not happening today?
Why can't we find psuedo-hybrid fish with legs forming?
What caused evolution to stop happening for a mysterious time of thousands of years?",7,1,Creation
975,evolution,"----------------
However, I don't think standard "polite" argument is going to convince any creationists that evolution is true. Creationists have been brainwashed by forces in their childhood. From birth, they have been indoctrinated with false truths. To reverse this, they need to be shocked out of their stupour. Of course, what they really need are sessions with a psychiatrist, perhaps with shock treatment.
----------------
That's a little silly in my opinion. Everyone comes with their own biases. To paraphrase a Christian saying, you might want to consider removing the beam in your own eye before trying to help Creationists remove the mote in their eyes.
----------------
I think we might need to redefine Creationism for the purposes of this debate. Shouldn't it be limited to the appearance of humans in the historical record?
Evolutionists: "Humans evolved over millions of years from earlier forms of life."
Creationists: "Man was created by God in the Garden of Eden and Woman was created from one of Man's ribs."
Or have creationists accepted all of the scientific evidence of evolution?
----------------
I disagree. Creationists believe that some Higher Power, a God, is responsible for creating the universe--including this planet and also man.
Evolutionists (as pitted against Creationists) believe that there is no God behind all that we know to exist.
There may be some Creationists who believe that God literally created Adam in the Garden of Eden, but there are others who don't even believe in the Christian God--let alone Adam and Eve.
I am a Christian and believe in the divinity of Jesus, but that doesn't mean I have to believe that the Bible is entirely correct or that it is literal. I embrace learning through the scientific method and have had no problems whatsoever accepting both my Christian beliefs and scientific learning at the same time. So far, I have seen no conflicts between the two.
The conflicts come when people want to extrapolate from what we have actually learned through science and create "theories" for which we have no real proof. The science of evolution is interesting and educational. The theory that God doesn't exist because of what we learn from scientific observations is just that--a theory--no more provable than the idea that God does in fact exist.
Unfortunately for evolution, the scientific principles and learnings are unnecessarily grouped so tightly with the theory that God doesn't exist that the two are effectively merged into one for most people. That is obvious in the classroom, in this thread, and anywhere the topic of "evolution" is brought up.
I embrace the scientific principles and observations of evolution. I reject the theory that God doesn't exist, and have yet to see anyone offer a good argument in favor of that theory.",7,1,Creation
76,evolution,"Actually you must know nothing about debate because what I am doing is called
"Cross Examining"
and it is a very common tactic for exposing holes in an opponent's position
Also, Calling names never won a debate
You just can't answer my questions and I'm sure that is frustrating for you",7,1,Creation
76,evolution,"I can prove to you that humans have not evolved since the beginning of recorded history",7,1,Creation
975,evolution,"Your bias is not towards science. Your bias goes far beyond that and is a bias against God. Science cannot prove or disprove God.
Science can't say a thing about how the universe came to be, whether or not there is more to our existence than just this life, whether or not we have an obligation to do "good" (whatever that is) during our lives, etc.
Religion is effectively a collection of beliefs that typically include some answers about what right and wrong are, why we exist in this universe, and so on. You may not call your set of beliefs a religion since the word "religion" is typically tied to belief in a God. However, they are your own substitute for organized religion.
I believe in science just as much as you do. The difference is that I don't then put my faith in theories that go FAR beyond the science while condemning others for not accepting my beliefs.
To sum it up, I can't prove God exists, and you can't prove he doesn't. I can't prove how the universe got to this point, and neither can you. I have my set of beliefs that might explain some of these things, and so do you. But, I'm not going belittle your beliefs in the name of science or any other cause. I would hope that you could show the same respect.",7,1,Creation
828,evolution,"This is an interesting debate in that there is so much confusion regarding what it actually means that it turns into more of a religious fight than anything else.
For instance you first have to determine whether the argument is the origin of the universe was natural or by intelligent design (ID). Second you have to determine do you think the earth is billions of years old or only 10 thousand or so.
I love the fact that many on the evolutionary side have clarified that evolution only explains the history of the world around us, not it's origins. Also, intelligent design does require faith that there is a supreme power out there whatever name you want to apply to it.
For me, I personally go for the Christian God created the universe around 10,000 years ago. I know many in the scientific community will argue it, but I am a Christian and believe that the Bible is the inerrant Word of God. I have also read many articles that state many scientific facts that help to support this idea (see www.icr.org). Finally, with all the articles I have read on evolution as well, it appears that you definitely have to have some faith for some of the claims some of the scientists are making and if I have to choose where I rest my faith it will be on the Bible.",7,1,Creation
657,evolution,"Believing "Evolution" as in Darwinism and the like, is like believing the puzzle can be solved by pouring the pieces out because two pieces kind of stuck together.",7,1,Creation
1200,evolution,"No, the theory of evolution is in fact, devolving. All of the time, we find that major pillars holding up the theory of evolution are fabricated. For example the frauds of the Piltdown Man and the Archeopteyx and Haeckel's embryo drawings. All were huge evidence for evolution, and yet, all wer found to be frauds. What about the Butterflies adapting in London? They were proven to be frauds as well. However, you seem to lack the skills to differentiate between biblical literalism and the scientifically based theory of intelligent design. Intelligent Design uses both science and mathematics to demonstrate that the odds of human life occuring by chance are over one in a trillion. For example, if the gravity in this universe were one part in a trillion trillion trillion stronger, the universe would have expanded too quickly during the Big Bang. Had it been one part in a trillion trillion trillion weaker, it would have expanded so quickly the universe would topple. Either way. we wouldn't exist. This is the science in cosmic fine tuning. We live in an extremely narrow "Galactic Habitable Zone" any closer to the sun, we're dead, but any farther, we're dead as well. Our planet and galaxy are also extremely well suited for scientic discovery. Our galxy is relatively flat, allowing us to see into other galaxies. The moon, Earth, and Sun are perfect in size,shape, and distance to observe a solar eclipse. Without the scientific knowledge obtained through eclipses, many of our later discoveries would have been postponed, perhaps indefinitely.
Your description of creationists and intelligent design proponents is just a mere caricature of a genuine scientific movement supported by facts and logic.",7,1,Creation
