author_id,topic,text,topic_id,discussion_stance_id,discussion_stance
If antelope had a will to survive, they would not even live near lions. Do bible thumping americans go to live in places like Iran and Iraq en mass? No they dont because they have the will to survive. Antelope on the other hand, have been hanging in the same turf with lions for thousands of years at least.
The irony is, your post had no substance vs mine. Like that natural selection which is evolution argument. Retarded.",7,1,"No, I Dont Believe in Evolution"
575,evolution,"You misunderstood what i said. It's the evolutionists that imply that the x factor is mother nature or god, not me.",7,1,"No, I Dont Believe in Evolution"
575,evolution,"It's the evolutionists that argue or imply that the x factor is mother nature or god, not me. Remember, I'm not arguing in favor of intelligent design. It's kind of a cliche, but try to think outside the box.",7,1,"No, I Dont Believe in Evolution"
171,evolution,"hey look we have a new cbart!",7,1,"No, I Dont Believe in Evolution"
534,evolution,"I'm not going to hide it. You are funny. roflmao.",7,1,"No, I Dont Believe in Evolution"
136,evolution,"Isnt evolution a process that takes millions and millions of years to take into affect?",7,1,"God is a trickster"
171,evolution,"Theres also an articlue published in Nat Geo about a group of lizards that were moved to another island and evolved in, scientific terms, the blink of an eye. :P The articles posted in the other evolution debate on the left side.... under my name _",7,1,"God is a trickster"
136,evolution,"Well that really was the point of my question..
If something is only changing over a monthly time period then is it really evolution? Or is it short term..but still detailed adaptation?
There is definately a difference between the two. Oh and another question..Why did the bacteria form that trait anyway? The article (unless i misread it) made no reference to why the bacteria did what it did.",7,1,"God is a trickster"
3312,evolution,"Really? The bacteria evolved? Are you saying they ceased to be bacteria and hence broke the bonds of species or other tiers of classification through mutation? Or are we just talking about adaptation through mutation? Didn't break any barriers with fruit flies. Doubt we will do much better with bacteria.",7,1,"God is a trickster"
3603,evolution,"Evolution is a theory. It is not a fact.
I agree that it's the most logical theory we have, but still not a FACT.",7,1,No
136,evolution,"As i have always said..
"If i dont believe in evolution, it will have nothing to do with God and everything to do with the science behind it"
Evolution is CURRENTLY the most congruent theory which explains the empiracal and anectdotal observations of our world. It is a very sound theory, but there are some holes in it that seem to be brushed under the carpet. That doesnt make it wrong! It just means that I nor any of us should "take it to the bank" so to speak, and accept it as the ultimate truth because at this point in time we just do not know everything for sure.",7,1,No
2153,evolution,"I DIDNT COME FROM A FUCKING MONKEY !!!!!!!!!!!!!!!!!!!!!!!!!!!!!!!!!!!!!!!!!!!!!!!!!!!!!!!!!!!!!!!!!!!!!!!!!!!!!!!!!!!!!!!!!!!!!!!!!!!!!!!!!!!!!!!!!!!!!!!!!!!!!!!!!!!!!!!!!!!!!!!!!!!!!!!!!!!!!!!!!!!!!!!!!!!!!!!!!!!!!!!!!!!!!!!!!!!!!!!!!!!!!!!!!!!!!!!!!!!!!!!!!!!!!!!!!!!!!!!!!!!!!!!!!!!!!!!!!!!!!!!!!!!!!!!!!!!!!!!!!!!!!!!!!!!!!!!!!!!!!!!!!!!!!!!!!!!!!!!!!!!!!!!!!!!!!!!!!!!!!!!!!!!!!!!!!!!!!!!!!!!!!!!!!!!!!!!!!!!!!!!!!!!!!!!!!!!!!!!!!!!!!!!!!!!!!!!!!!!!!!!!!!!!!!!!!!!!!!!!!!!!!!!!!!!!!!!!!!!!!!!!!!!!!!!!!!!!!!!!!!!!!!!!!!!!!!!!!!!!!!!!!!!!!!!!!!!!!!!!!!!!!!!!!!!!!!!!!!!!!!!!!!!!!!!!!!!!!!!!!!!!!!!!!!!!!!!!!!!!!!!!!!!!!!!!!!!!!!!!!!!!!!!!!!!!!!!!!!!!!!!!!!!!!!!!!!!!!!!!!!!!!!!!!!!!!!!!!!!!!!!!!!!!!!!!!!!!!!!!!!!!!!!!!!!!!!!!!!!!!!!!!!!!!!!!!!!!!!!!!!!!!!!!!!!!!!!!!!!!!!!!!!!!!!!!!!!!!!!!!!!!!!!!!!!!!!!!!!!!!!!!!!!!!!!!!!!!!!!!!!!!!!!!!!!!!!!!!!!!!!!!!!!!!!!!!!!!!!!!!!!!!!!!!!!!!!!!!!!!!!!!!!!!!!!!!!!!!!!!!!!!!!!!!!!!!!!!!!!!!!!!!!!!!!!!!!!!!!!!!!!!!!!!!!!!!!!!!!!!!!!!!!!!!!!!!!!!!!!!!!!!!!!!!!!!!!!!!!!!!!!!!!!!!!!!!!!!!!!!!!!!!!!!!!!!!!!!!!!!!!!!!!!!!!!!!!!!!!!!!!!!!!!!!!!!!!!!!!!!!!!!!!!!!!!!!!!!!!!!!!!!!!!!!!!!!!!!!!!!!!!!!!!!!!!!!!!!!!!!!!!!!!!!!!!!!!!!!!!!!!!!!!!!!!!!!!!!!!!!!!!!!!!!!!!!!!!!!!!!!!!!!!!!!!!!!!!!!!!!!!!!!!!!!!!!!!!!!!!!!!!!!!!!!!!!!!!!!!!!!!!!!!!!!!!!!!!!!!!!!!!!!!!!!!!!!!!!!!!!!!!!!!!!!!!!!!!!!!!!!",7,1,No
3603,evolution,"Look...the majority of every intelligent and credible body accepts evolution as an explanation to our presence in this planet. I completely believe in evolution. However, just because it make soo much sense does not make it a fact. In order to firmly say that something exists it must be a fact.
It makes no sense to compare evolution to gravity. Gravity can simply be witnessed by throwing an object up into the air. This phenomenon can be clearly seen and thus is a fact.
Evolution on the other hand is a very logical theory. There are no transitional fossils to confirm it; there is no direct proof to explain common lineages. Unfortunately we don't have a time-lapse camera set-up to witness this in action. As long as we cant see for ourselves that evolution is EXACTLY what happened, to bring us to this point in time, it will remain a theory.",7,1,No
136,evolution,"Global syrup answered this question pretty well..
Gravity and Evolution are not interchangeable in this situation. Gravity is a distinctly observed part of life that has transfered from mere observation into mathematical formula. Gravity can be proven, it is a constant both here on this planet and through out the universe. Evolution on the other hand, is still in the "mere observation" stage. I'm not saying i dont believe in it! I'm saying that the possibility of evolution being incorrect is still out there.
Like Syrup said, most people believe in evolution and we accept it to explain our earlier days on earth. But just because its the "popular" explanation of things doesnt make it correct and still makes it a theory.",7,1,No
534,evolution,"No Sandi, I think it's something of lower intellect.",7,1,No
2295,evolution,"evolution is not a proven fact. adaptation is.
evolution is not a science but a theory and as such it stands in the same grounds with creationism. it's only the push by the secular humanist liberal left that evolution has been given the imprimatur of being science when by all means it is nothing more that a theory.",7,1,No
3312,evolution,"teachme...it would appear we have similar interests and opposing views. In any case. The interchange of adaptation and evolution should always be clearly defined in these discussions. Adaptation can be clearly observed and is 100% fact. The genetic phenomenon associated with adaptation are a well developed science. Evoution i.e. a truley new species emerging from another, has never been observed or manipulated into manifestation in a lab. It runs contrary to observable biology and, even when given the millions upon millions of years to wash the imagination in, still does not work. Imagine the poor creature that is not quite still a lizard and not quite yet a bird. His front legs can no longer help him run or defend himself or gather food, neither can they help him fly. If he lives more than three days in a predatory environment he only has to find a female who has also developed similarly and survived DESPITE her mutations in order to have another happless half creature as a child. Wash rinse and repeat this impossible scenario about a thousand more times and you almost have a bird...but not quite.",7,1,No
2390,evolution,"Uhhh How?",7,1,No
2390,evolution,"You say "It is true that adaptation is well proven as a fact, as is evolution." and I asked "How?"
-How- An interrogative word with prompting questions like 'in which way' or 'why'",7,1,No
2390,evolution,"I can't believe you actually used the words "scientific method" in your rebuttal.
Here is the definition of the scientific method from the American Heritage Dictionary...
The principles and empirical processes of discovery and demonstration considered characteristic of or necessary for scientific investigation, generally involving the observation of phenomena, the formulation of a hypothesis concerning the phenomena, experimentation to demonstrate the truth or falseness of the hypothesis, and a conclusion that validates or modifies the hypothesis....
Now here is the definition of the word "prove" from the unabridged dictionary at dictionary.com...
to subject to a test, experiment, comparison, analysis, or the like, to determine quality, amount, acceptability, characteristics....
Please tell me, what about evolution suggests that this theory has been proven by empirical data? What actual evidence is there that this same phenomena can be tested and the same or similar results will happen again and again?
That is how theories are made fact or law. Evolution is neither fact or law, it is still a theory because its results can still not be reproduced and properly determined.",7,1,No
136,evolution,"You're willing to claim something as fact based on the observations made on a single species? If that's the case, then surely those exact same tests performed on every other species would yield the exact same results right?",7,1,No
1223,evolution,"The better question is what parts of the TOE need work, which are largely speculation and which are likely to be replaced with new evidence and information.
The Theory as a whole and principle is largely solid. It is the details that are always in question.",7,1,No
1190,evolution,"Scientific fact? Can I have an example?",7,1,No
1223,evolution,"This is a failure to understand what a theory is.
A theory is an overarching explanation based on empirical testable evidence.
That evidence is indeed fact. To say that a theory is not a fact is to fail to understand what a theory is.
Some theories have more facts then others, but what you just did was say that theories are not based on facts.",7,1,No
3623,evolution,"No, I don't think it does.
How can an organism adapt to something that it can't sense?
Example; How can an organism develop a system to catch sound waves if it doesn't know they exist in the first place?",7,1,No
164,evolution,"people joke when they can't debate.
The anti-science crowd is amazing on this one. I've been sent via link to some insane sites.
It seems the biggest conspiracy for these zealots "who don't need to defend their arguments btw"
is confusion in the fossil records, "i.e. some bones being out of place as archeologists dig down".
That supposedly counters tested evidence of evolution.
The problem with the zealots is that they think evolution = secular..... why? Darwin was religious.",7,1,No
164,evolution,"There are many reasons but lets not kid ourselves,
special interests through money and politics drives such decisions.",7,1,No
3622,evolution,"Pretty much everything in science is like this: a theory. It hasn't been proven yet, so I can't just say "it does because he says so". I'm in the 'maybe' gray area.",7,1,No
2333,evolution,"Creationism is religiously motivated to reject evolution as an explanation of origins.
The word "evolution" usually refers to the underlying facts, and the theory that explains them. Its not a matter of weather its true or not....its a FACT!!!
Organisms changing generation to generation is called evolution....If you don't believe so pick up a book and get current with the century you live in.",7,1,Evolution
2333,evolution,"Some people have not yet debated on these topics so if you don't want to debate then create something you do want to debate about.
its not fair for those who have not gotten a chance to debate on it.",7,1,Evolution
1095,evolution,"You don't even have to page over to find the debates I mentioned, all you have to do is scroll down.",7,1,Evolution
1189,evolution,"All of the questions that allegedly plague non-God attempts to explain our origins--why are we here, where are we going, what is the point of it all, why is the universe here--still apply to the faux explanation of God. The suggestion that God created everything does not make it any clearer to us where it all came from, how he created it, why he created it, where it is all going. In fact, it raises even more difficult mysteries: how did God, operating outside the confines of space, time, and natural law "create" or "build" a universe that has physical laws? We have no precedent and maybe no hope of answering or understanding such a possibility. What does it mean to say that some disembodied, spiritual being who knows everything and has all power, "loves" us, or has thoughts, or goals, or plans? How could such a being have any sort of personal relationship with beings like us?",7,1,Evolution
136,evolution,"You gotta admit though, its not like Evolutionists are pulling this stuff out of thin air like we believers do. I love when people say "The Theory of Evolution" and emphasize the "THEORY" part like its some pipe dream. I myself am guilty of this.
Evolution at the very least has strong evidence to back up the theory, not enough to prove it but still enough to suggest that its a genuine explanation of the progress of life. Creation doesn't have this. Creationism/ID has strong arguments that would suggest some of the things of that Evolution brings to the table, but they are just arguments/ideas/beliefs and not based off of much fact.",7,1,Evolution
1189,evolution,"The ID movement is motivated by and inseparable from a narrow religious viewpoint. In the words of its founders and leaders:
There's a difference of opinion about how important this debate [advocating intelligent design] is. What I always say is that it's not just scientific theory. The question is best understood as: Is God real or imaginary? (Phillip Johnson, "The Search for Intelligent Design in the Universe", Silicon Valley Magazine, 9 Jan. 2000.)
"We are taking an intuition most people have [the belief in God] and making it a scientific and academic enterprise. We are removing the most important cultural roadblock to accepting the role of God as creator. (Phillip Johnson, "Enlisting Science to Find the Fingerprints of a Creator", LA Times, 25 Mar. 2001.)
Our strategy has been to change the subject a bit so that we can get the issue of intelligent design, which really means the reality of God, before the academic world and into the schools (P. Johnson 2003).
"Father's words, my studies, and my prayers convinced me that I should devote my life to destroying Darwinism, just as many of my fellow Unificationists had already devoted their lives to destroying Marxism. When Father chose me (along with about a dozen other seminary graduates) to enter a Ph.D. program in 1978, I welcomed the opportunity to prepare myself for battle (J. Wells n.d.).
If we take seriously the word-flesh Christology of Chalcedon (i.e. the doctrine that Christ is fully human and fully divine) and view Christ as the telos toward which God is drawing the whole of creation, then any view of the sciences that leaves Christ out of the picture must be seen as fundamentally deficient. (William Dembski, Intelligent Design: The Bridge Between Science & Theology, Downers Grove, InterVarsity Press, 1999.)
"Intelligent design is just the Logos theology of John's Gospel restated in the idiom of information theory (Dembski 1999, 84).
Johnson said he and most others in the intelligent design movement believe the designer is the God of the Bible (Maynard 2001).",7,1,Evolution
1189,evolution,"1) It is hard to understand how anyone could make this claim, since anything mutations can do, mutations can undo. Some mutations add information to a genome; some subtract it. Creationists get by with this claim only by leaving the term "information" undefined, impossibly vague, or constantly shifting. By any reasonable definition, increases in information have been observed to evolve. We have observed the evolution of
* increased genetic variety in a population (Lenski 1995; Lenski et al. 1991)
* increased genetic material (Alves et al. 2001; Brown et al. 1998; Hughes and Friedman 2003; Lynch and Conery 2000; Ohta 2003)
* novel genetic material (Knox et al. 1996; Park et al. 1996)
* novel genetically-regulated abilities (Prijambada et al. 1995)
If these do not qualify as information, then nothing about information is relevant to evolution in the first place.
2) A mechanism that is likely to be particularly common for adding information is gene duplication, in which a long stretch of DNA is copied, followed by point mutations that change one or both of the copies. Genetic sequencing has revealed several instances in which this is likely the origin of some proteins. For example:
* Two enzymes in the histidine biosynthesis pathway that are barrel-shaped, structural and sequence evidence suggests, were formed via gene duplication and fusion of two half-barrel ancestors (Lang et al. 2000).
* RNASE1, a gene for a pancreatic enzyme, was duplicated, and in langur monkeys one of the copies mutated into RNASE1B, which works better in the more acidic small intestine of the langur. (Zhang et al. 2002)
* Yeast was put in a medium with very little sugar. After 450 generations, hexose transport genes had duplicated several times, and some of the duplicated versions had mutated further. (Brown et al. 1998)
The biological literature is full of additional examples. A PubMed search (at http://www.ncbi.nlm.nih.gov/entrez/query.fcgi) on "gene duplication" gives more than 3000 references.
3) According to Shannon-Weaver information theory, random noise maximizes information. This is not just playing word games. The random variation that mutations add to populations is the variation on which selection acts. Mutation alone will not cause adaptive evolution, but by eliminating nonadaptive variation, natural selection communicates information about the environment to the organism so that the organism becomes better adapted to it. Natural selection is the process by which information about the environment is transferred to an organism's genome and thus to the organism (Adami et al. 2000).
4) The process of mutation and selection is observed to increase information and complexity in simulations (Adami et al. 2000; Schneider 2000).
Links:
Max, Edward E., 1999. The evolution of improved fitness by random mutation plus selection. http://www.talkorigins.org/faqs/fitness
Musgrave, Ian, 2001. The Period gene of Drosophila. http://www.talkorigins.org/origins/postmonth/apr01.html",7,1,Evolution
3804,evolution,"In my opinion the whole debate seems rather idiotic. Let's assume that evolution is true in the belief that it all started with "The Big Bang." Essentially this means that there was a tiny, highly dense ball that exploded and started this awesome chain reaction. Let's stop right there and just debate that much. Forget genetic evolution, fossil findings ect. The debate never needs to go that far. I assume that we can all agree according to any scientific view everything has a lifespan, ie a beggining and an end. Such as protons, nutrons, all physical things and the universe. Do we all agree on this? ok, now I think we can all agree that according to even the most basic science nothing+nothing=nothing Ok so what's the point right? Well since everything has a to come from something and has to have a beginning, this super tiny, dense ball could not have just been floating in space for all eternity because we agreed that's not possible, and this ball could not have just came into existence from nothing, because that too is impossible. So even if you just take the theory a far as the tiny, dense ball of matter there is no possible way to get around the fact that something that stands outside of space/time, something eternal, ie GOD, had to have created it. You say "But that's not scientific and takes a leap of faith" and I will tell you that all other answers go against all scientific data at the most basic level on up and take a much bigger leap of faith to believe since I just proved they are all scientificaly impossible.",7,1,Evolution
600,evolution,"Everyone is like, "Evolution doesn't explain how we all began!!!". It's not supposed to, that is not the purpose of the theory of evolution. Evolution, the word, by definition means "change over time". The theory of evolution has nothing to do with the big bang, or how everything started in the galaxy, evolution is just really a simple concept. It's the concept of how natural organism change over time on earth, not how they got here, or began. I mean, I know a lot about evolution, and that's the main argument, people just don't understand that evolution isn't an answer to the beginning. Also, evolution is a scientific theory. A scientific theory is one that has been backed up my year and years, and thousands upon thousands of scientific information that only leads in one direction. For instance, gravity. Gravity is only a theory, we have proof that it currently exists, do we know why it exists? No exactly, but we have a pretty close answer, but it is only a theory because it could one day change. Just like evolution, we have information that only point towards it, not against it, but it could change one day, and we don't know that. There is a difference between a fact and a theory, 2+2=4, that's a fact, that will never change. gravity and evolution is a theory, it could very well one day change. People who believe in evolution are not trying to shut down people who believe in creationism, evolution is just a scientific statement of change over time. that's all.",7,1,Evolution
600,evolution,"Actually, it is proven that dinosaurs and birds, two completely different species are related and have changed through adaptation. Keep in mind, this isn't an over night change, it takes milions upon milions upon millions of year to occur. Think about bats. Bats are mammals. They have fur, they birth like any other mammals, no eggs involved. We are very much genetically related to bats, yet they fly like birds? Why? adaptation to environemental change, something that takes a LONG time to occur, but occurs none the less. Now dinosaurs, they are reptiles, how could they become birds? It's called homologous structures. Through bone sturctures, organs, muscles, and other important factors, organisms can be related to each other through common anscestory. For example, why do birds have wings?And why do we have arms? how do birds have legs? how do we have legs? How do birds have heads? how do we have heads? birds have eyes, we have eyes. Why do we share so much in common with so many organisms? The only explanation is the derivation of a common anscetor milllions of years ago that head a head, had arms or wings, had legs, had eyes. The structure of the bones within a bird, whale, human, are almost completely similar structures as far as the compostition on the bone is concerned. And then, we have to keep in mind of etymological relations. If you look at a human fetus, whale fetus, bird fetus in the first few months and weeks of like, there is almost no difference in structure or the way they look, theya ctually look almost the same. I implore you to look at this. Why? Coincidence? I'm afraid not, the beauty of change over time!",7,1,Evolution
600,evolution,"We cannot say that micro-evolution occurs but that macro-evolution does not. It is false to say that the changes that occur at the microscopic level in our bodies or in the bodies of any organism does not have a lasting effect at the macroscopic level. Take DNA. Good ol' Deoxyribosenucleic acid. Now, DNA is constantly going through mutations. 1 in every 10,000 base pairs in the DNA strand of a homo-sapian is mutated, whether that part of the strand is deleted, inserted, flipped, it happens. Okay, when we reproduce, chromosomes (build-ups/thick clumps of DNA and tertiary protein bonds) are mixed between the male and female. It's called Meiosis. So say, the mother's DNA codes for long hair, and the fathers DNA strand genetically codes for curly hair. When their chromosomes go through meiosis, and the alleles cross-over onto each others, the base pairs mix together. That's why if a mother with straight hair, and a father with curly have a kid, the kid has wavy hair. that is an example of how DNA changes at the microscopic level and have a macroscopic effect. This kid with wavy hair will then pass down his genetic material and mix it with someone else, and it will go on and on, and the pool of gentic codes will constantly be changed and over millions of years, that generation will have been completely changed. And isn't that the definition of evolution. a change over time.",7,1,Evolution
3878,evolution,"Wheras the scientific evolution theory as in DNA and Genetic traits can be proven, creationism and Intelligent Design are completely creative.",7,1,"ID should NOT be taught."
3878,evolution,"they are researching but without an outcome and no proof that it is a science!",7,1,"ID should NOT be taught."
3878,evolution,"Intelligent Design should not be taught in science class because it is a disguised religion and a belief. The theory of intelligent design can be possibly taught in ethics class to provide the students with a possibility of evaluating both theories, evolution and intelligent design, and making up their own mind about this topic.
Evolution is more science than intelligent design because supportable proof was provided earlier, whereas intelligent design is only a theory providing another explanation other than evolution.",7,1,"ID should NOT be taught."
3878,evolution,"How can intelligent design be proven at all?",7,1,"ID should NOT be taught."
3878,evolution,"did any ID "scientist" ever find anything but his own belief in the theory to hang on to?",7,1,"ID should NOT be taught."
