author_id,topic,text,topic_id,discussion_stance_id,discussion_stance
810,evolution,"As an animal adapts to his environment, do you think the building blocks of organisms change also?
(e.g. They say that a giraffe had it's long neck because it tries to reach the higher leaves which are more nutritious, through time, as this continues, do information that DNA carries also change, does the information of short-neckedness be changed suddenly to long-neckedness? Well, there may be a change on the giraffe's neck because of REACHING those leaves but this wouldn't affect the information inside the nucleus in the DNA.",7,1,Creation
1209,evolution,"although i voted for evolution... creation is easier to accept due to the fact that someone somewhere had to change aspects of the universe in order for us to exist.",7,1,Creation
1032,evolution,"Of course, you can NEVER prove either of them. I'm a Christian, and I'm pretty stuck in the middle. Of course, evolution is exptremely possible, and we know it happens, but I saw this video, that showed how the earth was really hot, and some single celled bacteria was there and it evolved into germs, and bugs, and stuff, and that's how we all came about. Yet again, that is why religion is FAITH. You're not going to die if you don't believe it.",7,1,Creation
568,evolution,"In the 21'st century, we have come to a point where the only way for us to evolve is to start to create. Creation is evolution just with more responsibility placed on mankind.",7,1,Creation
1202,evolution,"Could a unproven higher power have created a perfect world that appeared to have existed for more than 10 million years when really it is only 1 hundred thousand years old?",7,1,Creation
1245,evolution,"The problem here is that both creationists and evolutionists are looking for evidence where there is none. By way of analogy, think of acceleration. Acceleration is a change in velocity/speed over time. Compare two vehicles. One accelerates from a stop at a rate of 9.8fps/ps. It takes almost 1100 feet for it to reach a speed of 100 mph. The other vehicle has instant acceleration. Within no time or distance, it accelerates from a full stop to 100 mph. The result of both accelerations is the same. The vehicles are traveling at 100 mph. Thus, from the result, you cannot tell which vehicle had which acceleration.
There are two ways to prove either creation or evolution.
First, we could prove the cause of one or the other. Proving the existence of the Christian God, for example, would prove creation. God by His nature is holy and perfect. He does not lie. Therefore, when He claimed to have created the world, He did. On the other hand, we could prove the existence and operation of natural, physical forces capable of bringing about the world as it is. Both God and the physical forces would be proven in the same way - on the basis of their continuing work in this world.
Second, we could prove creation or evolution by proving the existence of that which can only be accounted for by one of these and not by the other. For example, the incredible design of the universe points to an intelligent designer. Can evolution account for that design?",7,1,Creation
853,evolution,"If evealution is real find me someone/something that is half way",7,1,Creation
1196,evolution,"There has to have been a creator. If you believe in 'The Big Bang', then that's fine. But what caused it? And if it was caused by certain gases reacting with each other, then where did those gases come from? It doesn't matter how you think this universe came to be. The point is that it can't have just appeared. There must have been a creator.",7,1,Creation
1192,evolution,"I am a nurse and the more I studied biology, the more I was in awe of the miracle of our bodies. Every tiny cell has it's own design that is even more complex than a computer. When you look at a computer do you question that there had to be a creator? Or do you need proof that this highly organized machine came to be about by a mere accident or order of circumstances? Evolutionists need more faith than Creationists.",7,1,Creation
632,evolution,"As someone who has taken, and passed, a high school biology course, let me be the first to tell you that evolution is false and creationism is true. Think about it -- if evolution were true, then we should have flying apes shooting laser beams because this would be the most optimal way to survive. That's just one argument of many that shows how backwards evolution is. Another is the fact that dinosaur bones are here to test us. Also, God changed the speed of light recently so it seems like we're looking at planets and galaxies from a long time ago, but in reality it's just a test from God since he only wants the most devout in heaven and doesn't want to hang around with sinners because he's above that.
Just thinking about it, there's so many reasons creationism is the way to go. Whenever I see a tree, or a pretty picture, it becomes obvious. When I open my Bible and get a fuzzy feeling, it's obvious. The fact that there's not fish running around with little legs should be the nail in the coffin but these stubborn evolutionists keep making up junk like transitional periods and all that. Too bad all their fancy "knowledge" will only earn them a one-way ticket to aitch ee double hockey sticks. Unfortunately for them there won't be any fans evolving down there.
Apes. Lasers. Think about it.",7,1,Creation
1242,evolution,"Creationism is the belief of an intelligent plan not so much of the bible your arguing GOD VS EVOLUTION which is a whole other subject. 96 percent of science is all theory the only thing that stays the same is nothing anyway, everything changes evryday in science more than one third of all scientist beleive in a higher power. their is also proof of biblical events, Noahs ark was found in Turkey, chariot remains and bones of humans and horses were found under the Red Sea Noahs anchors were found also they recently found a stone with a chisled engravement of a face and a crown of thorns. now ill agree alot of the things found or claimed is bogus but still the bible has stayed the same while science..... well lets just leave it at that.",7,1,Creation
1225,evolution,"OK you are completly wrong for these reasons 1. the way you potray the christian religion is varry offensive, 2,not only dead people have seen him because there have been people throught history who have seen him or one of his angel or the virgin marry, 3, seeing is not beliving, you may not be able to see God but that dosent mean he isnt real its like saying the wind is notreal because you cant see it,4, God wassant made he was in the heavens from the begining of time.5, also about the adam and eve thing, they were not brother and sister, God made them idividually.",7,1,Creation
902,evolution,"I see your point but evolution has no perfect evidence. I say this because scientist haven't been there have they and yet they try figure out what happened by using theories and imagination and say that it is a fact and you can't deny it. Now I think I can deny someone's imagination",7,1,Creation
1222,evolution,"The very existence of creation itself is proof that there is a God. Even ask an evolution scientist. They will admit that the chances of nothing exploding and creating a super complex system we call life is very slim. Let's just say it is impossible to explode nothing, let alone create life. Please show me the evidence of evolution. The great scientists, including Albert Einstein himself believed that the evidence in science points to a God. No one in their right mind would believe that a super advanced computer evolved by chance out of nothing. It was designed. And you evolutionists believe that our DNA, which is 100 million times more complex than a super advanced computer, evolved by chance?! You might want to rethink your theology. The DNA also gives information that can fill up the Grand Canyon 40 times over. In order to produce information, you need to have a valid source who knows the information himself. In my opinion, whoever designed the DNA must have been all knowing and all powerful.",7,1,Creation
1222,evolution,"What you say is exactly what I believe. Everything is evolving. It's called micro evolution.
For example: dogs are a kind of animal with many different species of dogs within them. Bull dogs and great danes are different types of dogs, but they are still dogs. Even after breeding many dogs together, they came out with chihuahuas, which is a completely useless dog, but it is still a dog. Darwin found plenty of evidence for micro evolution. He noticed that depending on the island and habitats of the birds, the birds' beaks were made different. Each beak specialized and adapted to the area around them in order for them to survive. That was his only evidence. Humans also evolve through micro evolution. Tribes in Africa tend to have larger jaws than humans in America. The only reason is because the humans in Africa use their jaws more often to carry things, while humans in America have cars and other tools to carry things. This is micro evolution in the sense that their jaws adapted to the habitats around them.
The evidence of micro evolution is everywhere. However, the evolution we all think of and debate upon is macro evolution. Macro evolution is an animal turning from one kind of animal to another. An example is a bird evolving into an alligator. That doesn't work and has never been proven. The evidence you just gave was all a part of micro evolution which is the result of animals evolving within their own kind.",7,1,Creation
1244,evolution,"CREATIONISM IS NOT SIMPLY AN ANCIENT STORY! For proof look at the Bible! See some of the stories that God and the Prophets tell, then compare those to things that are happening to-day! Evolution is in fact a story that is laughable! You just believe in evolution because you don't want to believe in God and other religions. You weak-minded soul! There is more proof than anything that God created the world in six days and that is that. Adam and Eve were tricked by the devil to sin against God and that is how sin came into the world. If new parts of evolution are always being added and discarded, then it is not the truth. The truth can not be changed! GOD DOES NOT CHANGE! Therefore creationism is the truth! There is almost no evidence supporting the evolutionary argument and the evidence that is there is fake and comical. Let me recite 2 Timothy 4:3 from the Holy Bible "For the time will come when men will not put up with sound doctrine. Instead, to suit their own desires, they will gather around them a great number of teachers to say what their itching ears want to hear." I tell you, this is the truth. On and episode of "Hillbilly: The Real Story" on the History Channel, a priest in a church was talking about the people in his congregation that do not agree with his teachings, he said, "If you do not agree with me and my teachings, then go join a new congregation or go down the road and build your own church." That is exactly what 2 Timothy 4:3 is saying! Proof I tell you proof!
The Theory of Evolution is not a fact. A scientific fact must be 100% correct. Failure to meet only one challenge proves the fact is wrong and therefore proving creationism right. This will prove that the Theory of Evolution fails many challenges, not simply one. And because it does, the only other option is that God is the ultimate creator. The Theory of Evolution will never become a law of science because it is wrought with errors. This is why it is a theory.
The process of natural selection is not an evolutionary process. The DNA in plants and animals allows selective breeding to achieve desired results. Dogs are a good example of selective breeding. The DNA in all dogs has many recessive traits. A desired trait can be produced in dogs by selecting dogs with a particular trait to produce offspring with that trait. But you don't see dogs giving birth to humans. This is the same as the "survival of the fittest" theory of the evolutionists. Many different types of dogs can be developed this way, but they can never develop a human by selectively breeding dogs. Natural selection can never extend outside of the DNA limit. DNA cannot be changed into a new species by natural selection. It's not like whenever a person is born they "receive" DNA from their parents. God gives us DNA like a computer programmer types in code. A computer programmer doesn't create programs from other programs. It's all hand written, the same as the Bible. The same process of selective breeding is done with flowers, fruits, and vegetables. New variations of the species are possible, but a new species has never been developed by science. If Evolution were true, and using a lightning bolt and a mud puddle started life, Scientists would be able to create life easily. Evolutionist fail to admit that no species has ever been proven to have evolved in any way. Evolution is simply pie-in-the-sky conjecture without scientific proof.
Genesis 1: 1-31 is perfect proof that creationism is correct, " 1 First God made heaven & earth 2 The earth was without form and void, and darkness was upon the face of the deep; and the Spirit of God was moving over the face of the waters. 3 And God said, "Let there be light"; and there was light. 4 And God saw that the light was good; and God separated the light from the darkness. 5 God called the light Day, and the darkness he called Night. And there was evening and there was morning, one day. 6 And God said, "Let there be a firmament in the midst of the waters, and let it separate the waters from the waters." 7 And God made the firmament and separated the waters which were under the firmament from the waters which were above the firmament. And it was so. 8 And God called the firmament Heaven. And there was evening and there was morning, a second day. 9 And God said, "Let the waters under the heavens be gathered together into one place, and let the dry land appear." And it was so. 10 God called the dry land Earth, and the waters that were gathered together he called Seas. And God saw that it was good. 11 And God said, "Let the earth put forth vegetation, plants yielding seed, and fruit trees bearing fruit in which is their seed, each according to its kind, upon the earth." And it was so. 12 The earth brought forth vegetation, plants yielding seed according to their own kinds, and trees bearing fruit in which is their seed, each according to its kind. And God saw that it was good. 13 And there was evening and there was morning, a third day. 14 And God said, "Let there be lights in the firmament of the heavens to separate the day from the night; and let them be for signs and for seasons and for days and years, 15 and let them be lights in the firmament of the heavens to give light upon the earth." And it was so. 16 And God made the two great lights, the greater light to rule the day, and the lesser light to rule the night; he made the stars also. 17 And God set them in the firmament of the heavens to give light upon the earth, 18 to rule over the day and over the night, and to separate the light from the darkness. And God saw that it was good. 19 And there was evening and there was morning, a fourth day. 20 And God said, "Let the waters bring forth swarms of living creatures, and let birds fly above the earth across the firmament of the heavens." 21 So God created the great sea monsters and every living creature that moves, with which the waters swarm, according to their kinds, and every winged bird according to its kind. And God saw that it was good. 22 And God blessed them, saying, "Be fruitful and multiply and fill the waters in the seas, and let birds multiply on the earth." 23 And there was evening and there was morning, a fifth day. 24 And God said, "Let the earth bring forth living creatures according to their kinds: cattle and creeping things and beasts of the earth according to their kinds." And it was so. 25 And God made the beasts of the earth according to their kinds and the cattle according to their kinds, and everything that creeps upon the ground according to its kind. And God saw that it was good. 26 Then God said, "Let us make man in our image, after our likeness; and let them have dominion over the fish of the sea, and over the birds of the air, and over the cattle, and over all the earth, and over every creeping thing that creeps upon the earth." 27 So God created man in his own image, in the image of God he created him; male and female he created them. 28 And God blessed them, and God said to them, "Be fruitful and multiply, and fill the earth and subdue it; and have dominion over the fish of the sea and over the birds of the air and over every living thing that moves upon the earth." 29 And God said, "Behold, I have given you every plant yielding seed which is upon the face of all the earth, and every tree with seed in its fruit; you shall have them for food. 30 And to every beast of the earth, and to every bird of the air, and to everything that creeps on the earth, everything that has the breath of life, I have given every green plant for food." And it was so. 31 And God saw everything that he had made, and behold, it was very good. And there was evening and there was morning, a sixth day."
Genesis 2: 1-8 describes how God made man: "Thus the heavens and the earth were finished, and all the host of them. 2 And on the seventh day God finished his work which he had done, and he rested on the seventh day from all his work which he had done. 3 So God blessed the seventh day and hallowed it, because on it God rested from all his work which he had done in creation. 4 These are the generations of the heavens and the earth when they were created. In the day that the LORD God made the earth and the heavens, 5 when no plant of the field was yet in the earth and no herb of the field had yet sprung up--for the LORD God had not caused it to rain upon the earth, and there was no man to till the ground; 6 but a mist went up from the earth and watered the whole face of the ground-- 7 then the LORD God formed man of dust from the ground, and breathed into his nostrils the breath of life; and man became a living being."
I tell you, all Bible verses you have read in this passage to-day are the truth and nothing but the truth. GOD IS THE SUPREME CREATOR OF EARTH AND YOU CAN DO NOTHING TO TRUTHFULLY PROVE THAT FACT WRONG NOR CAN YOU DENY IT! I have made myself clear.",7,1,Creation
1227,evolution,"Are you telling me that some explosion occurred out of nowhere?!Or the stupid monkey evolved into us?!It must hurt you your ego to know that you were once a animal in a zoo who only knew how to do 3 things:eat ,sleep then eat again.How could the skull of a monkey,be chiselled using what?a drill?into our type of skull?How could the bones of the monkey be lengthened or shortened to fit our structure?Or how could cells congregate together to form us ?I'll also be really scared to know that I was once a salmon or a lizard.
The truth is,God created the world in 7 days.humans were created on the 6th day.Animals were created the days before.(Genesis 1). If you want to know anymore,go to True life BPC Singapore on the web.",7,1,Creation
1213,evolution,"you cannot argue with the theory of creatoinism without getting into an extreamly dumb argument because anybody who beleives in creatoinism who is arguing with anyone who doesn't can say that god makes them think what they think
TAKE A HINT EVERYBODY THIS ARGUMENT IS MORONIC!!!!!!!!!!!!!!!!!!",7,1,Creation
551,evolution,"This is a dumb argument to have here because anyone who says that evolution is the origin of life will never be convinced by someone who is saying that God created everything because the evolutionist doesn't believe there is a God. A Creationist, like myself, is never going to be convinced by an evolutionist because our belief in God discredits anything you say to prove evolution. However, common sense tells me that the delicate life we all have today was to circumstantial to have happened at random. I suggest you watch "The Case for a Creator". Also, there was an experiment conducted with monkeys who were given computers and began to type ant random. After hours, none of the twelve monkeys had actually typed something that made legitimate sense. Personally, I think lots of people are so desperate to get away from the idea that they aren't in control of their own life that they're willing to believe whatever they have to to try to disprove God. Evolution just isn't possible and, as the great Sherlock Holmes said, "Once you have ruled out the impossible, whatever is left, no matter how improbable, must be the truth."",7,1,Creation
1213,evolution,"Actually the big bang theory is about how the universe is created not life
Secondly it is called the big bang THEORY!!! which means that its just a suggestoin otherwise if it was proven it would be the big bang law.
Thirdly according to scientists the theory of how life was created is primordial soup which is where lightening caused reactoins between gasses in the atmosphere which created small puddles amino acid. And from the acids life crawled. However the theory was tested by sending an electric current through gasses suspected to be in the Earths atmosphere at the time and although amino acid was formed the ammount was unbeleivably small and they thought that the theory was incorrect.
Besides god made you think evolutoin is real and you cant argue with me unless god makes you argue and you cant understand the mind of god so you cant say that I am incorrect.",7,1,Creation
1208,evolution,"Evolution is as likely as a tornado going through a junkyard and putting together a 747 Airplane.",7,1,Creation
1208,evolution,"Evolution is trying to deny God by making up a shallow explanation for things we don't understand.
Creation is realizing that things are very complex and created by a God who knows what He's doing. Which doesn't mean we're NOT trying to understand the world around us.
The "puzzle" someone else was talking about, doesn't represent finding "transitions" that lead up to the big picture of today. It represents the eco-system of this world and how each piece (Intelligently, and uniquely made) fits together to support each other.
If you really think about it, things that evolutionists use as proof of evolution could be disproved by simply questioning how long animals could have survived while waiting to evolve into something better.
For example, giraffes. Giraffes have specially designed hearts to pump blood up their long necks, and neck valves that prevent too much blood from going to the brain. They would have died of high blood pressure every time they bent over to drink water if they didn't have these traits. In other words, they would have died while waiting for this trait to slowly develop.
So obviously, giraffes and other creatures like them with unique traits, must have been created with the characteristics needed to survive.",7,1,Creation
1567,evolution,"It's scientific by definition. Darwin's theory of the evolution of species right through to theories of modern evolutionary synthesis are researched by scientists using scientific methods.
Therefore, it is 'scientific'.",7,1,"evolution is scientific"
87,evolution,"OK, to start. Ofcourse it is observable, it is constant, and is still happening. If you believe this, then you don't observe anything of the world you live in.
Secondly, of course it is replicable. AS I have said it is constant. Evolution is always happening, just because the exact smae changes arent happening, it doesnt mean it isn't happening.",7,1,"evolution is scientific"
1567,evolution,"The question refers to evolution, not specifically to Darwin's 150-year-old theory in isolation. Subsequent scientific discoveries in the areas of genetics and DNA allow a definite scientific, mathematical and observable analysis of 'evolution'. Take for example;
- Speciation (observable, reproducible)
- Kin selection (the analysis of how gene frequency changes over generations)
- Mutation
- Genotype frequencies / Allele frequencies (the calculations are all there. Can't get much more scientific than that!)
These areas of scientific research underpin the theories of modern evolutionary synthesis. Or neo-Darwinism.",7,1,"evolution is scientific"
812,evolution,"Explain how. Evolution is based on a theory, which produces testable conclusions. Creation is not. Whether or not one or the other is true has nothing to do with which one is 'scientific'. That is purely a matter of which one is actually subject to criticism and constructive review. Do not confuse your belief in one or the other with their dependence on scientific method or faith.",7,1,"evolution is scientific"
797,evolution,"You are sort of correct, but your thinking is flawed.
Single mutations do not create new specie they do however create one step towards something which isn’t anything like its ancestors.
After 1 million of these little changes would the new creature look like its ancestors 1 million years ago?
No, so where is the new specie?
You don’t notice a new specie if you only look at one generation. You need to look over a LONG period of time.
That’s why creationists think there are no "missing link" fossils. They see the fossil and see fossils which come before and after and say, hey there not that different. That’s not a new specie.",7,1,"evolution is scientific"
