author_id;topic;text;topic_id;discussion_stance_id;topic_stance_id;discussion_stance
1043;immigration;"That's it? “When the going gets tough, Americans keep giving - to the tune of nearly $241 billion. Charitable donations for 2002 set a new high, rising 1 percent over 2001's total in current dollars, according to Giving USA, a report released Monday by the American Association of Fundraising Counsel's Trust for Philanthropy in Indianapolis. The estimated $240.92 billion in gifts equalled 2.3 percent of US gross domestic product. By Stacy A. Teicher | Staff writer of The Christian Science Monitor newsfeed, 2003 June 23 “Since 1950, America and her allies have spent about $1 trillion U.S. dollars on anti-poverty and aid programs for poor and developing nations. After World War II, U.S. administrations considered foreign aid to be a strategic weapon, believing it could fortify weak nations vulnerable to Soviet aggression, and every aid dollar for food, for industrial development, for basic infrastructure had beneficial political, social and military effects.” http://archive.newsmax.com/archives/articles/2002/4/1/192451.shtml “By nearly all measures, the amount of foreign aid provided by the United States declined for several decades but has grown in the past few years. After hitting an alltime low in the mid1990s, total foreign assistance (but excluding Iraq reconstruction) for FY2003-2005, in real terms, has been larger than any three-year period since the early 1990s. The 0.16% of U.S. gross national product represented by foreign aid obligations for FY2005, however, is among the smallest amounts in the last half-century. The United States is the largest international economic aid donor in dollar terms…” “roughly the same time that fighting terrorism became the leading concern of American foreign aid, the Bush Administration announced other significant initiatives that have defined and strengthened two additional key foreign assistance goals: promoting economic growth and reducing poverty, and combating the global HIV/AIDS pandemic. The Millennium Challenge Corporation (MCC) is a new aid delivery concept, established in early 2004, that is intended to concentrate significantly higher amounts of U.S. resources in a few low- and low-middle income countries that have demonstrated a strong commitment to political, economic, and social reforms. If fully funded, $5 billion will be available by FY2006 to support these “best development performers” in order to accelerate economic growth and lower the number of people living in absolute poverty. Addressing global health problems has further become a core U.S. aid objective in recent years. Congress created a separate appropriation account for Child Survival and Health activities in the mid-1990s and increased funding for international HIV/AIDS and other infectious disease programs. President Bush’s announcement at his 2003 State of the Union message of a five-year, $15 billion effort to combat AIDS, malaria, and tuberculosis has added greater emphasis to this primary foreign assistance objective. Beyond these recently emerging foreign aid goals, other prominent objectives that have continued since the early 1990s have included supporting peace in the Middle East through assistance to Israel, Egypt, Jordan, and the Palestinians, fostering democratization and stability for countries in crisis, such as Bosnia, Haiti, Rwanda, Kosovo, and Liberia, facilitating democratization and free market economies in Central Europe and the former Soviet Union, suppressing international narcotics production and trafficking through assistance to Colombia and other Andean drug-producing countries, and alleviating famine and mitigating refugee situations in places throughout the world, including tsunami victims in Asia and east Africa.” “The U.S. assistance program to Iraq — the largest aid initiative since the 1948-1951 Marshall Plan — supports the long-term reconstruction requirements of the country following the March 2003 U.S. invasion and overthrow of the regime of Saddam Hussein. Funds have been mostly directed at improving the security capabilities of the Iraqi police and armed forces, at making rapid improvements in infrastructure — including electricity, oil, water and sewage, and telecommunications — and promoting democratization efforts. To date, two emergency supplemental appropriations have provided funds for these purposes (P.L. 108-11 for FY2003 and P.L. 108-106 for FY2004). The bulk of Iraq assistance — nearly $21 billion of the $23.7 billion that is expected to support the program — is held in an Iraq Relief and Reconstruction Fund controlled by the Office of the President and delegated to other executive branch agencies.” “Humanitarian Assistance. In FY2005, Congress appropriated $2.68 billion, 12.6% of assistance, for programs of humanitarian aid.3 Unlike, development assistance programs, which are often viewed as long-term efforts that may have the effect of preventing future crises from developing, three programs are devoted largely to the immediate alleviation of humanitarian emergencies. The bulk of humanitarian assistance goes to the refugee program administered by the State Department. It supports, with about $819 million in FY2005, a number of refugee relief organizations, including the U.N. High Commission for Refugees and the International Committee of the Red Cross. The Offices of Foreign Disaster Assistance (OFDA) and Transition Initiatives (OTI) in USAID provide relief, rehabilitation, and reconstruction assistance to victims of manmade and natural disasters, activities totaling $600 million in FY2005.” http://italy.usembassy.gov/pdf/other/98-916.pdf Now that is aid. And by the way, I found that without looking to Bill and Melinda Gates Org, and other things like that...";16;1;0;"Building a wall around America is a superb idea"
1043;immigration;"The real key is legal versus illegal immigration. Like I said, everyone needs to just follow the rules.";16;1;0;"Building a wall around America is a superb idea"
1043;immigration;"Real mature.";16;1;0;"Building a wall around America is a superb idea"
171;immigration;"You appear to be rebutting yourself then.";16;1;0;"Building a wall around America is a superb idea"
171;immigration;"I would say "feel free to put words in my mouth" but you appear to have already done so. Quote me on where I stated that nations should be obliged to let people break laws.";16;1;0;"Building a wall around America is a superb idea"
171;immigration;"Well with our total population being 300 million (Less than the population of Florida), I would say we're doing pretty well.";16;1;0;"Building a wall around America is a superb idea"
171;immigration;"P.S. Now that you've proven that your country is richer than mine, I'd like to see an apology for implying that Canada has done nothing to contribute to world peace/AIDS/etc.";16;1;0;"Building a wall around America is a superb idea"
171;immigration;"I like to think of it as dry humour... and it seems to be quite mature considering the arguments of my opposition.";16;1;0;"Building a wall around America is a superb idea"
1043;immigration;"Nothing is relative. If you say that America hasn't done enough then a nation that does less than that is doing relatively nothing.";16;1;0;"Building a wall around America is a superb idea"
1043;immigration;"Uh, Florida doesn't have over 300 million people. The entire US barely has over that. Look at the 2000 US census.";16;1;0;"Building a wall around America is a superb idea"
171;immigration;"30 million*, typo";16;1;0;"Building a wall around America is a superb idea"
171;immigration;"additional error, California not Florida*";16;1;0;"Building a wall around America is a superb idea"
171;immigration;"I encourage you to point out where I stated that America has not done enough.";16;1;0;"Building a wall around America is a superb idea"
2106;immigration;"The UK has exactly the same problem. Immigrants take over areas and turn it into a place of their own. They turn cristian churches into their own religion church, they complain to the local schools because they do not teach in their language, or teach their subject. Nearly all of them take benefits from the government because they claim they cannot work, for what ever reason. They should only be allowed in the country if they're doing something for it... e.g Doctor, Nurse, Dentist etc. Otherwise... Kick them out!";16;1;0;"Building a wall around America is a superb idea"
136;immigration;"Maybe if the Mexican and Cuban Governments fixed their sh*t countries they wouldnt have to come here either.";16;0;0;Agree
3909;immigration;"is not my jorb to speek messican. i thinks that messicans shood completly assimelate or be oven'd becuz there dirty.";16;0;0;Agree
3214;immigration;"That's why convinceme calls it a rant.";16;0;0;Agree
3713;immigration;"Mexicans, Cubans, Puerto Ricans, Peruvians, Nicaraguans, whatever it don't matter all those Spanish speaking immigrants are almost all illegal and they are bringing down the country. They need to stop yakking in Spanish and speak English so we can understand them Good thing Hispanics are Christians so we don't have to worry about terrorists in our misst.";16;0;0;Agree
3921;immigration;"Very interesting statement of opinion Jonax71. "The US must bear a great deal of responsibility for causing the conditions in Mexico, Central America, South America and elsewhere that force persons to abandon their homeland and desire to come to the US " How do you propose that the US created Coca Plants, Dictatorships, Marajuana fields, poor health care, alcohalism, lack of education, corrupt government officals and lack of infrastructure in these parts of the world. The U.S. DID construct the Panama Canal, provides medicine food and clothing to these parts of the world. Blaming the United states for other Nations inability to create safe, healthy and prosperous conditions for their citizens is rediculous. If the USA is truly an "Evil" influence on these nations then why doesnt Mexico turn its back to us and close the border? Look up to see what nation gives the largest amount of money to the world food aid program by dollars and by % of national budget. You will see that the big "bully" United states gives more by % and by amount than any other nation. Its alwayse easy to blame somebody elses success for your own failure. Whatever happend to personal responsability?";16;0;0;Agree
3684;immigration;"While the US has probably carried out acts in Latin American countries that would be wrong, it cannot be blamed for the state these countries are in. Mexico is a country that has a large population of poor people,and this is due in large part to their corrupt government. The US has nothing to do with this. If Latin American countries have governments that oppress their own people, then the problem has more to do with them than the US.";16;0;0;Agree
3909;immigration;"well they donts becuz there a lazy dirty peoples who bring death an distrukshon everywere they go. tahts why third world nations need to be distroyed and there lands absorbed by the ones who make there own heaven on earth thru sweat ahn blood.";16;0;0;Agree
1697;immigration;"Stop European people to check their credentials??? Are you kidding? Well, chalk up another one for someone that has absolutely no clue what they are talking about. The law SPECIFICALLY STATES that race alone without any other factor CANNOT be a determining factor in establishing probable cause or reasonable suspicion for a stop. So, we are now protesting against states that are simply enforcing laws that ALREADY EXIST!!!! Why don't you libtards just flush the Constitution down the toilet? I think that's your goal anyway.";16;1;0;"Necessary, not racist"
1697;immigration;"You know what is so ironically funny about everyone attacking Arizona? What is funny is that California is one of the worst enemies to Arizona's law but look at California... California has a 20 BILLION DOLLAR deficit... Where did that deficit come from? Probably the 15 BILLION DOLLAR a year bill for their Department of Corrections.... Now, guess how many illegals comprise the prison population of Kahleeforneea? Another huge irony is that this health care bs that just got passed. What is so freakin funny is that I personally know of 7 hospitals that shut down simply because they couldn't afford to exist. Why is that? Because of all of the undocumented people who come to be treated and they can't be turned away. Now, with osama's health care plan, are the illegals going to suddenly become legal and pay into that health care plan? See, we have been doing osama's plan all along. When we pay $20 for an aspirin and $100 for a temperature check, those exorbitant costs were necessary to pay for all of the non-paying, no insurance customers the hospital receives. But this time, we will be fined if we don't cooperate.... Yet, we down Arizona?????? HOW DUMB!";16;1;0;"Necessary, not racist"
1697;immigration;"Just to clarify something for you.... About HALF of California's prison population are illegal.... So, the libtards claiming that the VAST MAJORITY of illegals here are law abiding citizens???? I definitely have an issue with that argument... Illegals have cost this country more than terrorism!";16;1;0;"Necessary, not racist"
1697;immigration;"We all know???? Really? You KNOW that because that is the BULL SHIT that the liberal left wing media has fed to you! Seriously! You need to go to your police department and do a ride along or take a few criminal justice classes. Just like the idiot on here that said the Sean Bell shooting was racist, even though the detective that first shot him and he tried to run over was BLACK! lol When people speak like you do, I know for a fact that it is out of the kool aid that you have been force fed your entire life. Anyway, did you know that those mean police officers are wearing guns and are out there among your kids and family members???? Better get those bad police officers away from the public!!!!";16;1;0;"Necessary, not racist"
1697;immigration;"Coming from someone who KNOWS NOTHING ABOUT THE LAW ANYWAY!!! Hey pathetic ass! Did you know that the law already exists??? I could go out and jack every freakin Hispanic that looks illegal and be well within the bounds of the law... But you libtards think that a state law that MATCHES FEDERAL LAW is going to make COPS LIKE US more adamant about violating people's rights!!!! YOU ARE A FREAKIN IDIOT!!!!!";16;1;0;"Necessary, not racist"
1697;immigration;"I REITERATE YOU ARE A FREAKIN IDIOT!!! WAKE UP AND STOP DRINKING THE KOOL AID! THE LAW ALREADY EXISTS!!!!";16;1;0;"Necessary, not racist"
1697;immigration;"YES IDIOT YOU SCUM BAG LIBTARD!!! I BLAME KAHLEEPHORNEEAH!!! MORON!!!!";16;1;0;"Necessary, not racist"
1697;immigration;"Well DUMBASS! The laws are already on the books that allow me to 'jack' hispanics and it has been illegal to be here illegally since WAY BEFORE I WAS A COP but yet, we don't... So go ahead and blame cops for you being an idiot!";16;1;0;"Necessary, not racist"
1697;immigration;"Don't know the law, didn't finish high school but still you would not face me in person and say any of this crap you libtard!";16;1;0;"Necessary, not racist"
1697;immigration;"Really? I wish I could believe that but I feel that I am talking to a child. You certainly shouldn't be playing outside of your sandbox.. It really could get dangerous.";16;1;0;"Necessary, not racist"
1697;immigration;"That made total sense.... Uh, if I were you, I would start with an education and stop blaming others for your... uh... shortcomings...";16;1;0;"Necessary, not racist"
1697;immigration;"Smerfette... Oh I get it... You are a little blue girl... OK that makes total sense!";16;1;0;"Necessary, not racist"
1697;immigration;""Umm.. Just because you are a cop doesn't mean you know anything about the law. So far, you've only proven that you know sh*t about the law." Really? I don't know anything about the law.... Wow, that's a good one! You have proven that you are truly an idiot.... So, where did you get your law degree? Wanna know how many attorneys I have arrested? IDIOT!";16;1;0;"Necessary, not racist"
1697;immigration;"Hey drop your sponge bob toy and quit spewing bullsh*t.... Not about health care huh? Hmmmm I think you had better go back and read up on what prompted Arizona's bill.... A HUGE part of their complaint is paying for immigrant's health care... Are you sure you are qualified to speak on this topic? Oh, I forgot, you are just a kid.";16;1;0;"Necessary, not racist"
4395;immigration;"i completely agree with Larry, plus this law is not changing that much, federal agents can already arrest people suspected of being immigrants, the law is just saying that now state police officers can arrest people suspected of being immigrants. i really dont see what all the fuss is about this law hardly changes a thing.";16;1;0;"Necessary, not racist"
4053;immigration;"We don't have an illegal immigrant problem, we have an illegal employer problem. GO AFTER CORPORATIONS.";16;0;0;"should we put more time in trying to get illegal immigrants out of our country"
4545;immigration;"man you got a lot fo thinking to do before you type something";16;0;0;"should we put more time in trying to get illegal immigrants out of our country"
4053;immigration;"Because of our so called free trade, W.T.O., Nafta, and illegal immigration the working people are getting screwed in America. Average worker income in the U.S. has almost dropped by half sense 1970. It now takes two workers in a house hold to make the same income. I’ll rather pay 20% more for American made stuff at Wal-mart If I got a job that pays 40% more because I'm working here in the U.S. building it.";16;0;0;"should we put more time in trying to get illegal immigrants out of our country"
4053;immigration;"What solution republican have today that will help the american people and the economy Larry OHH republicans don't have solutions all they do is Bitch and want tax cuts. go home";16;0;0;"should we put more time in trying to get illegal immigrants out of our country"
4053;immigration;"WOOOW what world your living in lol. I'm not the smartest guy in the world but If I remember democrats always streamline government and leave surpluses and republican put this country in debt and increase government. Remember the Three great tax cuts President Harding, Reagan, and Bush left this country in debt my friend. Madder of fact when President Clinton balance the budget by raising taxes that not one republican voted for Larry. So you must be high or joking.";16;0;0;"should we put more time in trying to get illegal immigrants out of our country"
4053;immigration;"Ok If your so smart you tell me what republican in the last 110 years left this country in a surplus. You probably won't answer it, you might start talking about my spelling or something again lol.";16;0;0;"should we put more time in trying to get illegal immigrants out of our country"
4053;immigration;"Good good good Larry, your war stories are good but a debate for another time. I knew you would not answer the question I asked, so let me try again. What republican president in the last 110 years left with a surplus? I would respect you better if you admit that you don't know so I can answer the question for you.";16;0;0;"should we put more time in trying to get illegal immigrants out of our country"
4053;immigration;"Just as I thought you can't answer the question. Well I'll answer it for you ok. You probably won't read it because truth have a liberal bias right. Quote from George W. Bush “I think when people take a look back at this moment in our economic history they recognize tax cuts worked, they had made a different" Here's the reality (the brute facts).1, Large income tax cuts are always followed by a large bubble and then a crash. 2, high income taxes co relate with economic growth. (Another words as income taxes goes up, economic growth goes up Income tax increases are followed by economic growth. Moderate income tax cuts are followed by a flat economy. All of this is especially true applied to the top tax rates. Here are the examples. The three great tax cuts we had sense the beginning of the 20th century (last hundred years) Hebert Hoover doing world war 1 the top marginal tax rate went up to 73%. In 1922 republicans took control of the house, senate and presidency and they began cutting taxes. They cut taxes rate down from 56% then down to 46% then in 1925 they cut income taxes down to 25%. (They cut taxes down below 30% just like Reagan did). The stock market took off there was a boom but the boom was a bubbles, it was follow by the great crash of 1929. Bank failures and the great depression. Then comes Reagan, from Roosevelt 's second term and all the way up to Jimmy Carter (1936 to 1982) the top rate was in the 70 to top 92% range. Then came Reagan in 1981, in 1982 he cut that to 50%. The economy immediately went into the worst recession sense the great depression. WHY cause Reagan cut taxes. Reagan's supporters argued it was a Carters fault and that the new policies will take time to work so the tax cut stayed in place. By 1987 there was another round of tax cuts, they took the top rate down to 38% and they said it would stimulate the economy, there was a boom but it was a bubble. In October of 1987, by the end of that year there was a crash (the worst sense 1929 and we still call it black Monday). Much of the bubble money was all gone and it went into reel-estate. Suddenly there were bank failures more then doing the great depression. Savings and loan crisis, we had to have a bail out. That what happen doing Ronald Reagan years in the 1980s. Now here comes George W. Bush two. He comes in the most healthiest and powerful economy in American history. Immediately he cut taxes. Top marginal rate down from 39 to 35%, also cut capital gain taxes, inheriting taxes and what happens, an immediate recession. But he persists economy doesn't grows much. It was accentual flat, and then there's a crash, bank failures and then a bail-out. On the other hand every-time taxes have been raised. Whether it was War World 2 1941 to 1945, taxes was 88 to 94% and what happen, the economy BOOMED (in another words got better for those who don't know what boomed means). Under presidents Truman and Eisenhower the economy BOOMED, Clinton raise taxes the economy BOOMED, Roosevelt raise taxes the economy GREW. Tax increases are followed by economic growth. Three of the four high growth periods in the last 100 years have immediately followed significant tax hikes. And the fourth, in the Truman and Eisenhower years begin with a top tax rate at 91%, they did not need a tax hike.";16;0;0;"should we put more time in trying to get illegal immigrants out of our country"
4053;immigration;"Your education has failed you Larry. You heard of the GREAT DEPRESSION! all those tax cuts put people on the bread line once the good times bubble burst in 1929. The roaring twenties ended with the largest global market crash ever seen. The"roaring twenties" culminated in the 1929 Stock Market Crash and the onset of the Great Depression. http://www.cindyvallar.com/dustbowl.html the roaring 20's was a myth. Seems like that always happens after 8 years of Republicans. I will say this. The U.S. was massively in debt after World War ll, our debt was great then 100% of gross domestic product. The U.S. borrowed more then we had to fight World War ll, and we paid it back HOW? not by raising taxes, taxes on the millionaires and billionaires was already 91%. We did it by increasing the economy. By giving people better wages, they bought things and stuff that stimulated the economy. When people are able to buy stuff, that increase demand, which then cause company and individual to start business that do the same. We don't make sh*t in this country any more.";16;0;0;"should we put more time in trying to get illegal immigrants out of our country"
4053;immigration;"During the Clinton administration the federal budget balanced http://www.factcheck.org/askfactcheck/during_the_clinton_ administration_was_the_federal.html This is from the nonpartisan Congressional Budget Office look at page 7 http://www.cbo.gov/ftpdocs/110xx/doc11047/05-13-CBO_Presentation_to_AAAS.pdf Bush I 1988-1992 Deficit Clinton 1992 - 2000 Surplus Bush II 2000 - 2008 Deficit Duh";16;0;0;"should we put more time in trying to get illegal immigrants out of our country"
4053;immigration;"This is a editorial written by the financial editors of F.T.. A Conservative business news paper. We got a wolf pack working out of Manhattan and London taking down entire counties, taking out the American middle class, and paying themselves in the last six mounts, bonuses of $$$145 BILLION DOLLARS. That's 3 times the debt in Greece. One guy, John Paulson who's head of the Paulson Hedge Fund, cut the deal with Goldman sac to create the back of security, the product full of dieing mortgages then they sold to pinching and municipality (who sold to unsuspected suckers). This one guy takes over $$4 BILLION DOLLARS, and when you run a hedge found and you take money out, you take it out as capital gains and you paid a maximum %15 income tax. My friend this is CRIMINAL any other time. It's also know as bank robbery. Is it legal may be, but it should not be. just like your'ur against illegal immigration you should be against this too.";16;0;0;"should we put more time in trying to get illegal immigrants out of our country"
